commit	score	score_std	mean_rank	p_top3	n_sims	status	description
3d0eed5	1889.2	119.6	4.87	0.405	2700	discard	auto 1042 confirmed: {"need_bonus": 43.733, "flex_bonus": 6.218, "depth_quota_wr": 4, "depth_quota_te": 2, "surplus_penalty": 26.432, "bench_bonus": 6.488, "wait_discount": -0.038, "wait_margin": 5.269, "injury_penalty": 32.538, "rb_early_bonus": 17.214, "avail_sigma": 4
3d0eed5	1887.5	119.9	4.97	0.393	300	discard	auto 1043 screen: {"need_bonus": 12.842, "flex_bonus": 6.216, "depth_quota_rb": 5, "depth_quota_wr": 6, "depth_quota_te": 4, "surplus_penalty": 37.518, "bench_bonus": 5.513, "wait_discount": 0.251, "wait_margin": 3.293, "injury_penalty": 2.41, "rb_early_bonus": -0.824
3d0eed5	1887.3	116.8	4.91	0.398	2700	discard	auto 1044 confirmed: {"need_bonus": 30.872, "flex_bonus": 10.408, "depth_quota_wr": 6, "depth_quota_te": 4, "surplus_penalty": 33.673, "bench_bonus": 4.549, "wait_discount": 0.183, "wait_margin": 3.33, "kdef_rounds_from_end": 2, "injury_penalty": 28.171, "rb_early_bonus"
3d0eed5	1891.2	116.7	4.79	0.42	2700	discard	auto 1045 confirmed: {"need_bonus": 40.43, "flex_bonus": 16.595, "depth_quota_wr": 6, "surplus_penalty": 50.988, "bench_bonus": 3.973, "wait_discount": 0.134, "wait_margin": -1.729, "injury_penalty": 19.542, "rb_early_bonus": 11.686, "avail_sigma": 1.99, "avail_strength"
3d0eed5	1874.1	112.6	5.12	0.363	300	discard	auto 1046 screen: {"need_bonus": 13.677, "flex_bonus": 9.164, "depth_quota_wr": 4, "surplus_penalty": 6.358, "bench_bonus": 5.596, "wait_discount": 0.368, "wait_margin": -3.838, "kdef_rounds_from_end": 2, "injury_penalty": -5.307, "rb_early_bonus": 14.621, "qb_earlies
3d0eed5	1885.8	118.8	4.88	0.417	300	discard	auto 1047 screen: {"need_bonus": 32.859, "flex_bonus": 10.274, "depth_quota_rb": 3, "depth_quota_wr": 6, "depth_quota_qb": 3, "surplus_penalty": 47.414, "bench_bonus": 7.228, "wait_discount": 0.145, "wait_margin": 3.87, "injury_penalty": 50.198, "rb_early_bonus": 11.2
3d0eed5	1886.6	119.0	4.92	0.398	2700	discard	auto 1048 confirmed: {"need_bonus": 32.894, "flex_bonus": 9.227, "depth_quota_rb": 5, "depth_quota_te": 2, "surplus_penalty": 31.633, "bench_bonus": 5.966, "wait_discount": 0.137, "wait_margin": 5.819, "injury_penalty": 27.764, "rb_early_bonus": 10.087, "qb_earliest_roun
3d0eed5	1864.2	120.1	5.42	0.337	300	discard	auto 1049 screen: {"need_bonus": 34.005, "flex_bonus": 11.724, "depth_quota_wr": 4, "depth_quota_te": 2, "depth_quota_qb": 1, "surplus_penalty": 80.723, "bench_bonus": -2.462, "wait_discount": 0.151, "wait_margin": 0.97, "kdef_rounds_from_end": 2, "injury_penalty": 16
3d0eed5	1890.7	118.3	4.81	0.425	2700	discard	auto 1050 confirmed: {"need_bonus": 49.106, "flex_bonus": 13.348, "depth_quota_wr": 6, "surplus_penalty": 37.036, "bench_bonus": 5.975, "wait_discount": 0.34, "wait_margin": 4.5, "injury_penalty": 58.56, "rb_early_bonus": 9.246, "avail_sigma": 5.144, "avail_strength": 0.
3d0eed5	1888.9	120.6	4.84	0.417	2700	discard	auto 1051 confirmed: {"need_bonus": 35.801, "flex_bonus": 2.483, "depth_quota_rb": 5, "depth_quota_wr": 6, "surplus_penalty": 18.994, "bench_bonus": 3.501, "wait_discount": 0.178, "wait_margin": 2.941, "injury_penalty": 20.134, "rb_early_bonus": 1.736, "te_earliest_round
3d0eed5	1877.7	120.8	5.07	0.367	300	discard	auto 1052 screen: {"need_bonus": 20.206, "flex_bonus": 7.488, "depth_quota_rb": 3, "depth_quota_wr": 4, "depth_quota_te": 4, "depth_quota_qb": 1, "surplus_penalty": 38.097, "bench_bonus": 4.538, "wait_discount": 0.254, "wait_margin": 3.436, "injury_penalty": 29.007, "
3d0eed5	1876.0	114.4	5.03	0.377	300	discard	auto 1053 screen: {"need_bonus": 33.679, "flex_bonus": 8.95, "surplus_penalty": 40.886, "bench_bonus": 6.605, "wait_discount": 0.243, "wait_margin": 2.271, "kdef_rounds_from_end": 2, "injury_penalty": 11.528, "rb_early_bonus": 10.485, "avail_sigma": 5.623, "avail_stre
3d0eed5	1876.9	109.3	5.0	0.39	300	discard	auto 1054 screen: {"need_bonus": 20.062, "flex_bonus": 7.163, "depth_quota_rb": 3, "depth_quota_wr": 4, "depth_quota_te": 2, "depth_quota_qb": 1, "surplus_penalty": 42.722, "bench_bonus": 3.418, "wait_discount": 0.266, "wait_margin": 0.977, "injury_penalty": 27.247, "
3d0eed5	1868.9	124.9	5.45	0.327	300	discard	auto 1055 screen: {"need_bonus": 24.829, "flex_bonus": 16.201, "depth_quota_qb": 3, "surplus_penalty": 48.822, "bench_bonus": 4.352, "wait_discount": 0.312, "wait_margin": 7.495, "injury_penalty": 43.229, "rb_early_bonus": 20.793, "avail_sigma": 0.103, "avail_strength
3d0eed5	1891.1	120.2	4.81	0.413	2700	discard	auto 1056 confirmed: {"need_bonus": 27.949, "flex_bonus": 7.919, "depth_quota_rb": 3, "depth_quota_wr": 4, "surplus_penalty": 25.189, "bench_bonus": 5.835, "wait_discount": 0.185, "wait_margin": 6.583, "injury_penalty": 19.161, "rb_early_bonus": 11.964, "te_earliest_roun
3d0eed5	1894.5	118.8	4.72	0.432	2700	discard	auto 1057 confirmed: {"need_bonus": 30.06, "flex_bonus": 11.401, "surplus_penalty": 38.551, "bench_bonus": 4.819, "wait_discount": 0.154, "wait_margin": 3.782, "injury_penalty": 32.975, "rb_early_bonus": 9.739, "avail_sigma": 4.968, "avail_strength": 0.333, "cliff_gap": 
3d0eed5	1895.8	117.6	4.64	0.443	2700	discard	auto 1058 confirmed: {"need_bonus": 35.243, "flex_bonus": 13.42, "surplus_penalty": 41.224, "bench_bonus": 4.114, "wait_discount": 0.176, "wait_margin": 4.548, "injury_penalty": 29.118, "rb_early_bonus": 8.195, "te_earliest_round": 5, "avail_sigma": 4.244, "avail_strengt
3d0eed5	1884.6	118.3	4.98	0.399	2700	discard	auto 1059 confirmed: {"need_bonus": 30.186, "flex_bonus": 12.288, "depth_quota_qb": 1, "surplus_penalty": 40.149, "bench_bonus": 5.287, "wait_discount": 0.161, "wait_margin": 2.802, "injury_penalty": 24.634, "rb_early_bonus": 10.255, "avail_sigma": 5.264, "avail_strength
3d0eed5	1815.9	129.6	6.73	0.203	300	discard	auto 1060 screen: {"need_bonus": -0.22, "flex_bonus": 7.294, "depth_quota_wr": 4, "depth_quota_qb": 3, "surplus_penalty": -21.389, "bench_bonus": 8.074, "wait_discount": 0.14, "wait_margin": 4.083, "injury_penalty": 51.359, "rb_early_bonus": 11.931, "qb_earliest_round
3d0eed5	1878.6	117.7	4.98	0.413	300	discard	auto 1061 screen: {"need_bonus": 28.416, "flex_bonus": 11.51, "depth_quota_wr": 6, "depth_quota_qb": 1, "surplus_penalty": 42.738, "bench_bonus": 4.594, "wait_discount": 0.232, "wait_margin": 4.01, "kdef_rounds_from_end": 2, "injury_penalty": 23.302, "rb_early_bonus":
3d0eed5	1890.2	118.0	4.77	0.412	2700	discard	auto 1062 confirmed: {"need_bonus": 25.405, "flex_bonus": -8.786, "depth_quota_rb": 3, "depth_quota_qb": 3, "surplus_penalty": 61.943, "bench_bonus": 1.513, "wait_discount": 0.114, "wait_margin": 5.617, "injury_penalty": 29.706, "rb_early_bonus": 10.686, "avail_sigma": 6
3d0eed5	1870.1	128.7	5.31	0.39	300	discard	auto 1063 screen: {"need_bonus": 54.537, "flex_bonus": 2.578, "surplus_penalty": 18.14, "bench_bonus": 0.213, "wait_discount": 0.197, "wait_margin": 4.526, "injury_penalty": -1.511, "rb_early_bonus": 11.647, "te_earliest_round": 3, "avail_sigma": 2.812, "avail_strengt
3d0eed5	1886.7	118.8	4.94	0.408	2700	discard	auto 1064 confirmed: {"need_bonus": 33.859, "flex_bonus": 10.352, "depth_quota_qb": 1, "surplus_penalty": 33.989, "bench_bonus": 4.837, "wait_discount": 0.141, "wait_margin": 3.313, "injury_penalty": 22.714, "rb_early_bonus": 12.886, "qb_earliest_round": 6, "avail_sigma"
3d0eed5	1879.0	117.6	5.01	0.38	300	discard	auto 1065 screen: {"need_bonus": 56.687, "flex_bonus": 9.121, "depth_quota_te": 2, "surplus_penalty": 53.761, "bench_bonus": 4.465, "wait_discount": 0.18, "wait_margin": 5.484, "injury_penalty": 14.864, "rb_early_bonus": 11.161, "avail_sigma": 7.232, "avail_strength":
3d0eed5	1881.9	114.8	5.14	0.373	300	discard	auto 1066 screen: {"need_bonus": 32.424, "flex_bonus": 1.79, "depth_quota_rb": 3, "depth_quota_te": 2, "surplus_penalty": 36.417, "bench_bonus": 2.858, "wait_discount": 0.24, "wait_margin": 5.767, "injury_penalty": 27.908, "rb_early_bonus": 5.974, "qb_earliest_round":
3d0eed5	1891.2	120.6	4.85	0.404	2700	discard	auto 1067 confirmed: {"need_bonus": 34.706, "flex_bonus": 11.388, "depth_quota_rb": 5, "depth_quota_wr": 6, "surplus_penalty": 33.14, "bench_bonus": 6.336, "wait_discount": 0.157, "wait_margin": 3.844, "injury_penalty": 18.484, "rb_early_bonus": 10.57, "qb_earliest_round
3d0eed5	1884.2	121.1	4.96	0.4	2700	discard	auto 1068 confirmed: {"need_bonus": 35.127, "flex_bonus": 10.744, "depth_quota_rb": 5, "depth_quota_wr": 4, "depth_quota_te": 2, "depth_quota_qb": 3, "surplus_penalty": 43.386, "bench_bonus": 3.98, "wait_discount": 0.204, "wait_margin": 3.087, "kdef_rounds_from_end": 2, 
3d0eed5	1881.4	125.4	5.08	0.4	300	discard	auto 1069 screen: {"need_bonus": 14.242, "flex_bonus": 8.524, "depth_quota_qb": 1, "surplus_penalty": 24.124, "bench_bonus": 3.017, "wait_discount": 0.183, "wait_margin": 4.007, "injury_penalty": -14.435, "rb_early_bonus": 7.583, "qb_earliest_round": 4, "avail_sigma":
3d0eed5	1880.6	119.7	5.05	0.38	300	discard	auto 1070 screen: {"need_bonus": 34.528, "flex_bonus": 4.869, "depth_quota_rb": 3, "depth_quota_wr": 6, "surplus_penalty": 21.976, "bench_bonus": 3.224, "wait_discount": 0.189, "wait_margin": 3.799, "injury_penalty": 32.076, "rb_early_bonus": 13.201, "avail_sigma": 3.
3d0eed5	1885.4	113.6	4.97	0.4	300	discard	auto 1071 screen: {"need_bonus": 27.189, "flex_bonus": 9.897, "depth_quota_te": 2, "depth_quota_qb": 3, "surplus_penalty": 34.72, "bench_bonus": 5.154, "wait_discount": 0.176, "wait_margin": 3.992, "injury_penalty": 24.92, "rb_early_bonus": 8.031, "qb_earliest_round":
3d0eed5	1873.6	120.2	5.13	0.357	300	discard	auto 1072 screen: {"need_bonus": 18.529, "flex_bonus": -0.688, "depth_quota_rb": 5, "depth_quota_te": 2, "depth_quota_qb": 3, "surplus_penalty": 45.504, "bench_bonus": 2.572, "wait_discount": 0.268, "wait_margin": 6.35, "kdef_rounds_from_end": 2, "injury_penalty": 44.
3d0eed5	1892.5	119.9	4.72	0.434	2700	discard	auto 1073 confirmed: {"need_bonus": 15.746, "flex_bonus": 8.447, "depth_quota_rb": 5, "depth_quota_qb": 3, "surplus_penalty": 42.61, "bench_bonus": 4.755, "wait_discount": 0.155, "wait_margin": 3.88, "injury_penalty": 19.228, "rb_early_bonus": 9.221, "qb_earliest_round":
3d0eed5	1887.3	119.8	4.9	0.401	2700	discard	auto 1074 confirmed: {"need_bonus": 29.506, "flex_bonus": 5.969, "surplus_penalty": 25.629, "bench_bonus": 3.501, "wait_discount": 0.184, "wait_margin": 5.944, "injury_penalty": 41.879, "rb_early_bonus": 6.569, "avail_sigma": 3.477, "avail_strength": 0.172, "cliff_gap": 
3d0eed5	1839.8	119.0	6.11	0.303	300	discard	auto 1075 screen: {"need_bonus": -5.936, "flex_bonus": 8.674, "depth_quota_wr": 6, "depth_quota_te": 4, "depth_quota_qb": 3, "surplus_penalty": 17.522, "bench_bonus": 3.747, "wait_discount": 0.201, "wait_margin": 5.513, "injury_penalty": 45.1, "rb_early_bonus": 16.62,
3d0eed5	1891.4	119.2	4.79	0.419	2700	discard	auto 1076 confirmed: {"need_bonus": 32.703, "flex_bonus": 9.734, "surplus_penalty": 38.854, "bench_bonus": 4.109, "wait_discount": 0.165, "wait_margin": 1.864, "injury_penalty": 30.659, "rb_early_bonus": 8.213, "qb_earliest_round": 4, "te_earliest_round": 5, "avail_sigma
3d0eed5	1892.6	119.5	4.78	0.422	2700	discard	auto 1077 confirmed: {"need_bonus": 30.634, "flex_bonus": 10.85, "depth_quota_rb": 3, "depth_quota_wr": 6, "depth_quota_te": 4, "surplus_penalty": 18.735, "bench_bonus": 2.731, "wait_discount": 0.145, "wait_margin": 2.751, "injury_penalty": 23.352, "rb_early_bonus": 9.94
3d0eed5	1879.0	129.6	5.21	0.393	300	discard	auto 1078 screen: {"need_bonus": 19.884, "flex_bonus": 8.686, "depth_quota_qb": 1, "surplus_penalty": 33.881, "bench_bonus": 2.779, "wait_discount": 0.212, "wait_margin": 4.635, "injury_penalty": 14.437, "rb_early_bonus": 8.008, "qb_earliest_round": 6, "te_earliest_ro
3d0eed5	1889.0	117.7	4.86	0.409	2700	discard	auto 1079 confirmed: {"need_bonus": 18.965, "flex_bonus": 11.866, "depth_quota_te": 2, "surplus_penalty": 54.633, "bench_bonus": 3.121, "wait_discount": 0.126, "wait_margin": 4.329, "injury_penalty": 27.1, "rb_early_bonus": 5.412, "qb_earliest_round": 6, "avail_sigma": 4
3d0eed5	1892.9	117.1	4.74	0.429	2700	discard	auto 1080 confirmed: {"need_bonus": 21.646, "flex_bonus": 8.552, "depth_quota_rb": 5, "surplus_penalty": 46.665, "bench_bonus": 5.947, "wait_discount": 0.229, "wait_margin": 7.213, "injury_penalty": 43.793, "rb_early_bonus": 7.329, "qb_earliest_round": 4, "avail_sigma": 
3d0eed5	1847.7	118.7	5.98	0.26	300	discard	auto 1081 screen: {"need_bonus": 59.577, "flex_bonus": 3.487, "depth_quota_rb": 5, "depth_quota_wr": 4, "depth_quota_te": 4, "surplus_penalty": 69.521, "bench_bonus": 3.667, "wait_discount": 0.136, "wait_margin": 3.845, "injury_penalty": 7.251, "rb_early_bonus": 12.34
3d0eed5	1887.2	119.6	4.92	0.41	300	discard	auto 1082 screen: {"need_bonus": 34.924, "flex_bonus": 4.614, "surplus_penalty": 43.743, "bench_bonus": 5.506, "wait_discount": 0.199, "wait_margin": 3.557, "injury_penalty": 19.334, "rb_early_bonus": 6.312, "qb_earliest_round": 4, "te_earliest_round": 3, "avail_sigma
3d0eed5	1881.3	117.6	5.05	0.42	300	discard	auto 1083 screen: {"need_bonus": 33.434, "flex_bonus": 5.143, "depth_quota_rb": 3, "depth_quota_qb": 1, "surplus_penalty": 28.246, "bench_bonus": 1.144, "wait_discount": 0.115, "wait_margin": 3.831, "injury_penalty": 15.367, "rb_early_bonus": 7.636, "te_earliest_round
3d0eed5	1865.8	125.3	5.43	0.34	300	discard	auto 1084 screen: {"need_bonus": 27.648, "flex_bonus": 1.484, "depth_quota_wr": 4, "depth_quota_qb": 1, "surplus_penalty": 26.413, "bench_bonus": 4.71, "wait_discount": 0.148, "wait_margin": 5.197, "injury_penalty": 22.422, "rb_early_bonus": 13.623, "qb_earliest_round
3d0eed5	1892.9	117.5	4.74	0.421	2700	discard	auto 1085 confirmed: {"need_bonus": 28.554, "flex_bonus": 5.363, "depth_quota_rb": 3, "depth_quota_te": 2, "surplus_penalty": 29.304, "bench_bonus": 6.914, "wait_discount": 0.213, "wait_margin": 5.433, "injury_penalty": 32.521, "rb_early_bonus": 9.655, "qb_earliest_round
3d0eed5	1892.9	117.9	4.73	0.43	2700	discard	auto 1086 confirmed: {"need_bonus": 30.62, "flex_bonus": 8.474, "depth_quota_te": 2, "surplus_penalty": 31.473, "bench_bonus": 4.698, "wait_discount": 0.17, "wait_margin": 3.591, "kdef_rounds_from_end": 2, "injury_penalty": 28.795, "rb_early_bonus": 7.954, "qb_earliest_r
3d0eed5	1887.9	119.5	4.87	0.405	2700	discard	auto 1087 confirmed: {"need_bonus": 33.347, "flex_bonus": 18.034, "depth_quota_te": 2, "depth_quota_qb": 3, "surplus_penalty": 75.317, "bench_bonus": 1.518, "wait_discount": 0.299, "wait_margin": 2.867, "injury_penalty": 20.54, "rb_early_bonus": 8.229, "avail_sigma": 0.5
3d0eed5	1878.6	109.8	5.01	0.397	300	discard	auto 1088 screen: {"need_bonus": 39.44, "flex_bonus": 9.288, "depth_quota_rb": 3, "depth_quota_wr": 6, "depth_quota_te": 2, "depth_quota_qb": 1, "surplus_penalty": 48.957, "bench_bonus": 4.423, "wait_discount": 0.15, "wait_margin": 4.992, "injury_penalty": 24.471, "rb
3d0eed5	1881.2	120.0	5.05	0.393	300	discard	auto 1089 screen: {"need_bonus": 10.306, "flex_bonus": 10.507, "surplus_penalty": 12.683, "bench_bonus": 4.289, "wait_discount": 0.123, "wait_margin": 4.41, "injury_penalty": 32.056, "rb_early_bonus": 11.034, "qb_earliest_round": 6, "avail_sigma": 7.371, "avail_streng
3d0eed5	1889.5	117.7	4.81	0.417	2700	discard	auto 1090 confirmed: {"need_bonus": 26.491, "flex_bonus": 11.86, "depth_quota_wr": 6, "depth_quota_te": 4, "surplus_penalty": 26.177, "bench_bonus": 4.116, "wait_discount": 0.197, "wait_margin": 3.886, "injury_penalty": 13.112, "rb_early_bonus": 9.655, "qb_earliest_round
3d0eed5	1885.6	118.0	4.93	0.401	2700	discard	auto 1091 confirmed: {"need_bonus": 23.035, "flex_bonus": 10.678, "depth_quota_rb": 3, "depth_quota_wr": 6, "depth_quota_te": 2, "depth_quota_qb": 3, "surplus_penalty": 44.69, "bench_bonus": 2.718, "wait_discount": 0.19, "wait_margin": 2.821, "injury_penalty": 23.459, "r
3d0eed5	1881.7	117.9	5.08	0.37	300	discard	auto 1092 screen: {"need_bonus": 18.588, "flex_bonus": 6.915, "depth_quota_te": 2, "surplus_penalty": 2.314, "bench_bonus": 5.017, "wait_discount": 0.156, "wait_margin": 1.683, "injury_penalty": 0.271, "rb_early_bonus": 12.179, "te_earliest_round": 5, "avail_sigma": 6
3d0eed5	1887.1	118.3	4.92	0.394	2700	discard	auto 1093 confirmed: {"need_bonus": 31.679, "flex_bonus": 11.917, "surplus_penalty": 42.251, "bench_bonus": 3.189, "wait_discount": 0.266, "wait_margin": 7.098, "injury_penalty": 24.375, "rb_early_bonus": -4.736, "qb_earliest_round": 4, "avail_sigma": 2.612, "avail_stren
3d0eed5	1891.7	119.3	4.76	0.425	2700	discard	auto 1094 confirmed: {"need_bonus": 20.779, "flex_bonus": 15.23, "depth_quota_rb": 5, "depth_quota_qb": 3, "surplus_penalty": 21.537, "bench_bonus": 4.369, "wait_discount": 0.264, "wait_margin": 4.752, "injury_penalty": 22.695, "rb_early_bonus": 8.256, "avail_sigma": 4.4
3d0eed5	1864.2	119.4	5.51	0.353	300	discard	auto 1095 screen: {"need_bonus": 7.791, "flex_bonus": 10.455, "depth_quota_te": 4, "depth_quota_qb": 1, "surplus_penalty": 24.231, "bench_bonus": 1.932, "wait_discount": 0.036, "wait_margin": 4.609, "injury_penalty": 52.812, "rb_early_bonus": 10.115, "qb_earliest_roun
3d0eed5	1893.7	117.8	4.71	0.424	2700	discard	auto 1096 confirmed: {"need_bonus": 27.466, "flex_bonus": 11.12, "depth_quota_rb": 3, "depth_quota_wr": 6, "surplus_penalty": 35.409, "bench_bonus": 4.434, "wait_discount": 0.189, "wait_margin": 3.528, "injury_penalty": 32.686, "rb_early_bonus": 10.266, "qb_earliest_roun
3d0eed5	1889.1	119.3	4.87	0.412	2700	discard	auto 1097 confirmed: {"need_bonus": 47.285, "flex_bonus": 6.536, "depth_quota_rb": 5, "depth_quota_wr": 4, "surplus_penalty": 45.988, "bench_bonus": 5.341, "wait_discount": 0.15, "wait_margin": 6.317, "injury_penalty": -8.863, "rb_early_bonus": 20.058, "qb_earliest_round
3d0eed5	1883.5	115.8	5.09	0.4	300	discard	auto 1098 screen: {"need_bonus": 32.319, "flex_bonus": 9.317, "depth_quota_rb": 5, "depth_quota_wr": 4, "depth_quota_qb": 1, "surplus_penalty": 36.349, "bench_bonus": 5.263, "wait_discount": 0.136, "wait_margin": 3.659, "kdef_rounds_from_end": 2, "injury_penalty": 30.
3d0eed5	1888.5	121.2	4.88	0.408	2700	discard	auto 1099 confirmed: {"need_bonus": 29.836, "flex_bonus": 5.798, "depth_quota_wr": 4, "depth_quota_te": 2, "surplus_penalty": 45.909, "bench_bonus": 2.911, "wait_discount": 0.178, "wait_margin": 2.066, "kdef_rounds_from_end": 2, "injury_penalty": 27.387, "rb_early_bonus"
3d0eed5	1895.9	119.3	4.67	0.44	2700	discard	auto 1100 confirmed: {"need_bonus": 30.184, "flex_bonus": 9.583, "depth_quota_wr": 6, "surplus_penalty": 34.466, "bench_bonus": 4.632, "wait_discount": 0.16, "wait_margin": 4.052, "injury_penalty": 25.531, "rb_early_bonus": 8.597, "qb_earliest_round": 4, "avail_sigma": 4
3d0eed5	1883.1	115.8	4.92	0.397	300	discard	auto 1101 screen: {"need_bonus": 30.164, "flex_bonus": 8.761, "depth_quota_wr": 6, "depth_quota_qb": 3, "surplus_penalty": 39.292, "bench_bonus": 4.601, "wait_discount": 0.124, "wait_margin": 4.298, "kdef_rounds_from_end": 2, "injury_penalty": 24.392, "rb_early_bonus"
3d0eed5	1890.2	118.8	4.78	0.423	2700	discard	auto 1102 confirmed: {"need_bonus": 29.915, "flex_bonus": 8.908, "depth_quota_wr": 6, "depth_quota_te": 2, "surplus_penalty": 43.877, "bench_bonus": 4.977, "wait_discount": 0.114, "wait_margin": 3.509, "injury_penalty": 25.824, "rb_early_bonus": 7.685, "qb_earliest_round
3d0eed5	1873.4	111.1	5.14	0.333	300	discard	auto 1103 screen: {"need_bonus": 32.887, "flex_bonus": 9.978, "depth_quota_te": 2, "depth_quota_qb": 1, "surplus_penalty": 35.826, "bench_bonus": 4.333, "wait_discount": 0.157, "wait_margin": 3.755, "injury_penalty": 27.657, "rb_early_bonus": 8.993, "qb_earliest_round
3d0eed5	1888.8	120.3	4.83	0.416	2700	discard	auto 1104 confirmed: {"need_bonus": 39.828, "flex_bonus": 14.363, "depth_quota_rb": 3, "depth_quota_wr": 6, "depth_quota_qb": 3, "surplus_penalty": 13.478, "bench_bonus": 5.794, "wait_discount": 0.23, "wait_margin": 2.748, "injury_penalty": 14.174, "rb_early_bonus": 9.90
3d0eed5	1882.4	118.5	4.99	0.388	2700	discard	auto 1105 confirmed: {"need_bonus": 38.189, "flex_bonus": 11.373, "depth_quota_wr": 4, "depth_quota_qb": 1, "surplus_penalty": 42.47, "bench_bonus": 4.291, "wait_discount": 0.222, "wait_margin": 4.562, "injury_penalty": 43.296, "rb_early_bonus": 7.777, "te_earliest_round
3d0eed5	1846.6	112.3	5.91	0.283	300	discard	auto 1106 screen: {"need_bonus": 52.321, "flex_bonus": 2.098, "depth_quota_qb": 3, "surplus_penalty": -17.545, "bench_bonus": 4.378, "wait_discount": 0.02, "wait_margin": 3.539, "kdef_rounds_from_end": 2, "injury_penalty": 54.597, "rb_early_bonus": 17.371, "te_earlies
3d0eed5	1892.5	118.7	4.78	0.419	2700	discard	auto 1107 confirmed: {"need_bonus": 33.878, "flex_bonus": 7.622, "depth_quota_wr": 4, "depth_quota_te": 4, "surplus_penalty": 36.573, "bench_bonus": 6.173, "wait_discount": 0.145, "wait_margin": 2.809, "injury_penalty": 19.83, "rb_early_bonus": 10.121, "avail_sigma": 1.8
3d0eed5	1888.1	119.0	4.85	0.413	2700	discard	auto 1108 confirmed: {"need_bonus": 22.772, "flex_bonus": 8.955, "depth_quota_te": 2, "surplus_penalty": 20.233, "bench_bonus": 2.869, "wait_discount": 0.101, "wait_margin": 3.051, "injury_penalty": 22.331, "rb_early_bonus": 5.6, "avail_sigma": 3.459, "avail_strength": 0
3d0eed5	1877.6	114.9	5.03	0.377	300	discard	auto 1109 screen: {"need_bonus": 42.242, "flex_bonus": 6.355, "depth_quota_wr": 6, "depth_quota_qb": 3, "surplus_penalty": 47.933, "bench_bonus": 4.25, "wait_discount": 0.154, "wait_margin": 3.479, "kdef_rounds_from_end": 2, "injury_penalty": 44.87, "rb_early_bonus": 
3d0eed5	1891.3	117.9	4.79	0.419	2700	discard	auto 1110 confirmed: {"need_bonus": 29.583, "flex_bonus": 9.723, "surplus_penalty": 36.534, "bench_bonus": 4.145, "wait_discount": 0.182, "wait_margin": 2.974, "injury_penalty": 31.397, "rb_early_bonus": 8.749, "avail_sigma": 3.548, "avail_strength": 0.421, "cliff_gap": 
