commit	score	score_std	mean_rank	p_top3	n_sims	status	description
3d0eed5	1891.6	117.6	4.75	0.432	2700	discard	auto 697 confirmed: {"need_bonus": 22.503, "flex_bonus": 6.271, "surplus_penalty": 19.571, "bench_bonus": 0.119, "wait_discount": 0.171, "wait_margin": 3.724, "injury_penalty": 6.208, "rb_early_bonus": 13.843, "qb_earliest_round": 6, "te_earliest_round": 5, "avail_sigma
3d0eed5	1890.3	117.5	4.77	0.414	2700	discard	auto 698 confirmed: {"need_bonus": 40.352, "flex_bonus": 8.049, "depth_quota_wr": 6, "depth_quota_te": 4, "surplus_penalty": 14.848, "bench_bonus": 4.013, "wait_discount": 0.163, "wait_margin": 3.966, "injury_penalty": 19.842, "rb_early_bonus": 5.918, "te_earliest_round
3d0eed5	1894.4	117.6	4.68	0.434	2700	discard	auto 699 confirmed: {"need_bonus": 32.306, "flex_bonus": 8.448, "depth_quota_wr": 6, "surplus_penalty": 26.159, "bench_bonus": 5.083, "wait_discount": 0.167, "wait_margin": 3.149, "injury_penalty": 30.811, "rb_early_bonus": 11.165, "qb_earliest_round": 6, "avail_sigma":
3d0eed5	1895.2	119.6	4.7	0.435	2700	discard	auto 700 confirmed: {"need_bonus": 28.54, "flex_bonus": 10.429, "depth_quota_rb": 5, "depth_quota_wr": 6, "surplus_penalty": 40.718, "bench_bonus": 3.984, "wait_discount": 0.172, "wait_margin": 4.013, "injury_penalty": 26.484, "rb_early_bonus": 10.327, "qb_earliest_roun
3d0eed5	1896.0	119.0	4.66	0.444	2700	discard	auto 701 confirmed: {"need_bonus": 28.32, "flex_bonus": 10.38, "depth_quota_wr": 6, "surplus_penalty": 37.408, "bench_bonus": 4.937, "wait_discount": 0.178, "wait_margin": 2.698, "injury_penalty": 22.67, "rb_early_bonus": 9.917, "qb_earliest_round": 6, "avail_sigma": 4.
3d0eed5	1888.8	120.4	4.86	0.42	2700	discard	auto 702 confirmed: {"need_bonus": 23.536, "flex_bonus": 9.21, "depth_quota_te": 2, "surplus_penalty": 27.585, "bench_bonus": 5.024, "wait_discount": 0.145, "wait_margin": 5.489, "kdef_rounds_from_end": 2, "injury_penalty": 21.794, "rb_early_bonus": 9.416, "qb_earliest_
3d0eed5	1875.9	124.0	5.36	0.373	300	discard	auto 703 screen: {"need_bonus": 42.922, "flex_bonus": 8.073, "depth_quota_rb": 3, "depth_quota_wr": 4, "depth_quota_qb": 1, "surplus_penalty": 32.275, "bench_bonus": 5.006, "wait_discount": 0.133, "wait_margin": 3.935, "injury_penalty": 27.564, "rb_early_bonus": 9.14
3d0eed5	1864.6	122.4	5.54	0.35	300	discard	auto 704 screen: {"need_bonus": 13.151, "flex_bonus": 8.332, "depth_quota_wr": 4, "depth_quota_qb": 1, "surplus_penalty": 32.271, "bench_bonus": 4.52, "wait_discount": 0.097, "wait_margin": 4.241, "kdef_rounds_from_end": 2, "injury_penalty": 34.908, "rb_early_bonus":
3d0eed5	1863.0	113.2	5.62	0.3	300	discard	auto 705 screen: {"need_bonus": 31.954, "flex_bonus": 4.174, "depth_quota_wr": 6, "depth_quota_te": 4, "depth_quota_qb": 1, "surplus_penalty": 33.867, "bench_bonus": 3.738, "wait_discount": 0.133, "wait_margin": 4.138, "kdef_rounds_from_end": 2, "injury_penalty": 39.
3d0eed5	1893.9	119.5	4.68	0.438	2700	discard	auto 706 confirmed: {"need_bonus": 25.93, "flex_bonus": 7.997, "depth_quota_wr": 4, "depth_quota_qb": 3, "surplus_penalty": 19.163, "bench_bonus": 3.679, "wait_discount": 0.22, "wait_margin": 3.047, "injury_penalty": 25.475, "rb_early_bonus": 8.276, "avail_sigma": 4.733
3d0eed5	1891.5	119.7	4.77	0.431	2700	discard	auto 707 confirmed: {"need_bonus": 33.4, "flex_bonus": 9.533, "depth_quota_rb": 5, "depth_quota_te": 2, "surplus_penalty": 40.901, "bench_bonus": 3.586, "wait_discount": 0.192, "wait_margin": 2.961, "kdef_rounds_from_end": 2, "injury_penalty": 25.936, "rb_early_bonus": 
3d0eed5	1891.7	118.9	4.77	0.421	2700	discard	auto 708 confirmed: {"need_bonus": 35.576, "flex_bonus": 10.839, "depth_quota_wr": 6, "depth_quota_te": 2, "surplus_penalty": 41.423, "bench_bonus": 6.339, "wait_discount": 0.189, "wait_margin": 2.324, "injury_penalty": 23.46, "rb_early_bonus": 11.174, "avail_sigma": 5.
3d0eed5	1889.9	119.7	4.86	0.417	2700	discard	auto 709 confirmed: {"need_bonus": 40.267, "flex_bonus": 9.43, "depth_quota_qb": 3, "surplus_penalty": 20.527, "bench_bonus": 7.526, "wait_discount": 0.118, "wait_margin": 5.743, "injury_penalty": 24.677, "rb_early_bonus": 7.101, "qb_earliest_round": 6, "avail_sigma": 3
3d0eed5	1857.9	130.4	5.83	0.31	300	discard	auto 710 screen: {"need_bonus": 3.299, "flex_bonus": 17.528, "depth_quota_te": 2, "surplus_penalty": 13.66, "bench_bonus": 0.15, "wait_discount": 0.165, "wait_margin": -1.258, "injury_penalty": 31.66, "rb_early_bonus": 9.248, "te_earliest_round": 5, "avail_sigma": 5.
3d0eed5	1889.3	121.7	4.88	0.412	2700	discard	auto 711 confirmed: {"need_bonus": 29.865, "flex_bonus": 10.506, "surplus_penalty": 30.369, "bench_bonus": 3.312, "wait_discount": 0.142, "wait_margin": 4.273, "injury_penalty": 23.164, "rb_early_bonus": 8.203, "avail_sigma": 4.576, "avail_strength": 0.32, "cliff_gap": 
3d0eed5	1895.9	120.3	4.7	0.425	2700	discard	auto 712 confirmed: {"need_bonus": 30.586, "flex_bonus": 10.742, "depth_quota_wr": 4, "depth_quota_te": 2, "depth_quota_qb": 3, "surplus_penalty": 36.204, "bench_bonus": 5.081, "wait_discount": 0.159, "wait_margin": 3.654, "injury_penalty": 25.319, "rb_early_bonus": 12.
3d0eed5	1884.4	121.0	4.96	0.41	300	discard	auto 713 screen: {"need_bonus": 26.762, "flex_bonus": 14.234, "depth_quota_wr": 6, "surplus_penalty": 33.693, "bench_bonus": 3.766, "wait_discount": 0.112, "wait_margin": 4.166, "kdef_rounds_from_end": 2, "injury_penalty": 21.88, "rb_early_bonus": 12.621, "te_earlies
3d0eed5	1878.0	124.3	5.19	0.36	300	discard	auto 714 screen: {"need_bonus": 24.223, "flex_bonus": 11.708, "depth_quota_rb": 5, "depth_quota_wr": 6, "depth_quota_te": 4, "depth_quota_qb": 3, "surplus_penalty": 45.67, "bench_bonus": 3.414, "wait_discount": 0.207, "wait_margin": 2.384, "injury_penalty": 20.776, "
3d0eed5	1865.3	121.0	5.53	0.307	300	discard	auto 715 screen: {"need_bonus": 29.369, "flex_bonus": 8.674, "depth_quota_wr": 4, "depth_quota_te": 4, "depth_quota_qb": 1, "surplus_penalty": 47.518, "bench_bonus": 4.861, "wait_discount": 0.173, "wait_margin": 2.182, "injury_penalty": 65.72, "rb_early_bonus": 12.35
3d0eed5	1859.6	119.0	5.64	0.32	300	discard	auto 716 screen: {"need_bonus": 44.255, "flex_bonus": 3.712, "depth_quota_wr": 4, "surplus_penalty": 34.392, "bench_bonus": 2.159, "wait_discount": -0.057, "wait_margin": 5.314, "injury_penalty": 37.839, "rb_early_bonus": 5.29, "qb_earliest_round": 4, "avail_sigma": 
3d0eed5	1893.9	120.0	4.73	0.429	2700	discard	auto 717 confirmed: {"need_bonus": 37.46, "flex_bonus": 11.431, "depth_quota_rb": 5, "depth_quota_wr": 4, "surplus_penalty": 34.875, "bench_bonus": 4.231, "wait_discount": 0.14, "wait_margin": 3.589, "injury_penalty": 26.022, "rb_early_bonus": 8.941, "avail_sigma": 5.25
3d0eed5	1880.9	125.2	5.12	0.407	300	discard	auto 718 screen: {"need_bonus": 21.811, "flex_bonus": 15.886, "depth_quota_rb": 5, "depth_quota_wr": 6, "depth_quota_qb": 1, "surplus_penalty": 45.472, "bench_bonus": 5.285, "wait_discount": 0.141, "wait_margin": 3.352, "kdef_rounds_from_end": 2, "injury_penalty": 28
3d0eed5	1889.6	119.8	4.84	0.413	2700	discard	auto 719 confirmed: {"need_bonus": 21.926, "flex_bonus": 11.913, "depth_quota_rb": 5, "depth_quota_te": 2, "depth_quota_qb": 3, "surplus_penalty": 46.181, "bench_bonus": 0.174, "wait_discount": 0.174, "wait_margin": 4.062, "kdef_rounds_from_end": 2, "injury_penalty": 24
3d0eed5	1872.5	119.7	5.36	0.323	300	discard	auto 720 screen: {"need_bonus": 37.72, "flex_bonus": 20.787, "depth_quota_te": 2, "surplus_penalty": -13.739, "bench_bonus": 1.638, "wait_discount": 0.118, "wait_margin": 1.701, "injury_penalty": 29.838, "rb_early_bonus": 1.538, "qb_earliest_round": 4, "avail_sigma":
3d0eed5	1887.1	120.5	4.86	0.417	300	discard	auto 721 screen: {"need_bonus": 37.222, "flex_bonus": 6.555, "depth_quota_rb": 5, "depth_quota_wr": 6, "depth_quota_te": 2, "surplus_penalty": 51.852, "bench_bonus": 3.617, "wait_discount": 0.163, "wait_margin": 4.657, "injury_penalty": 29.913, "rb_early_bonus": 7.23
3d0eed5	1890.7	117.8	4.79	0.42	2700	discard	auto 722 confirmed: {"need_bonus": 36.114, "flex_bonus": 10.165, "depth_quota_wr": 6, "depth_quota_te": 2, "surplus_penalty": 36.922, "bench_bonus": 4.479, "wait_discount": 0.211, "wait_margin": 3.194, "injury_penalty": 30.253, "rb_early_bonus": 7.676, "te_earliest_roun
3d0eed5	1878.1	116.6	5.14	0.38	300	discard	auto 723 screen: {"need_bonus": 32.687, "flex_bonus": 9.306, "depth_quota_rb": 3, "depth_quota_wr": 6, "depth_quota_qb": 1, "surplus_penalty": 35.724, "bench_bonus": 4.842, "wait_discount": 0.154, "wait_margin": 4.029, "injury_penalty": 23.165, "rb_early_bonus": 9.64
3d0eed5	1887.0	119.0	4.89	0.41	300	discard	auto 724 screen: {"need_bonus": 37.015, "flex_bonus": 9.182, "depth_quota_wr": 6, "depth_quota_te": 2, "surplus_penalty": 35.81, "bench_bonus": 3.882, "wait_discount": 0.2, "wait_margin": 4.731, "injury_penalty": 28.811, "rb_early_bonus": 10.928, "qb_earliest_round":
3d0eed5	1882.9	118.3	4.98	0.403	300	discard	auto 725 screen: {"need_bonus": 10.142, "flex_bonus": 6.537, "depth_quota_wr": 6, "surplus_penalty": 44.948, "bench_bonus": 1.723, "wait_discount": 0.264, "wait_margin": 5.044, "injury_penalty": 43.922, "rb_early_bonus": 9.42, "te_earliest_round": 3, "avail_sigma": 4
3d0eed5	1893.3	120.3	4.72	0.425	2700	discard	auto 726 confirmed: {"need_bonus": 33.352, "flex_bonus": 8.985, "depth_quota_rb": 5, "depth_quota_wr": 6, "depth_quota_te": 2, "depth_quota_qb": 3, "surplus_penalty": 34.885, "bench_bonus": 4.81, "wait_discount": 0.14, "wait_margin": 3.797, "injury_penalty": 26.939, "rb
3d0eed5	1893.8	117.9	4.7	0.428	2700	discard	auto 727 confirmed: {"need_bonus": 38.295, "flex_bonus": 6.519, "surplus_penalty": 29.558, "bench_bonus": 3.881, "wait_discount": 0.13, "wait_margin": 5.527, "injury_penalty": 26.518, "rb_early_bonus": 9.324, "avail_sigma": 4.264, "avail_strength": 0.389, "cliff_gap": 3
3d0eed5	1882.4	105.8	4.89	0.403	300	discard	auto 728 screen: {"need_bonus": 35.49, "flex_bonus": 8.149, "depth_quota_rb": 5, "depth_quota_te": 2, "depth_quota_qb": 1, "surplus_penalty": 28.499, "bench_bonus": 5.495, "wait_discount": 0.2, "wait_margin": 3.34, "kdef_rounds_from_end": 2, "injury_penalty": 27.597,
3d0eed5	1873.1	125.1	5.35	0.35	300	discard	auto 729 screen: {"need_bonus": 60.084, "flex_bonus": 11.239, "depth_quota_rb": 3, "depth_quota_wr": 4, "depth_quota_te": 4, "surplus_penalty": 24.44, "bench_bonus": -1.78, "wait_discount": 0.066, "wait_margin": 6.755, "kdef_rounds_from_end": 2, "injury_penalty": 29.
3d0eed5	1890.8	117.7	4.78	0.421	2700	discard	auto 730 confirmed: {"need_bonus": 37.565, "flex_bonus": 13.157, "depth_quota_rb": 5, "surplus_penalty": 31.989, "bench_bonus": 8.494, "wait_discount": 0.155, "wait_margin": 3.474, "injury_penalty": 34.648, "rb_early_bonus": 3.17, "qb_earliest_round": 6, "te_earliest_ro
3d0eed5	1892.4	120.5	4.79	0.419	2700	discard	auto 731 confirmed: {"need_bonus": 27.38, "flex_bonus": 10.311, "depth_quota_rb": 5, "depth_quota_wr": 4, "depth_quota_qb": 3, "surplus_penalty": 41.894, "bench_bonus": 4.585, "wait_discount": 0.141, "wait_margin": 3.865, "kdef_rounds_from_end": 2, "injury_penalty": 17.
3d0eed5	1889.6	117.2	4.8	0.411	2700	discard	auto 732 confirmed: {"need_bonus": 25.724, "flex_bonus": 9.611, "depth_quota_rb": 3, "depth_quota_te": 4, "surplus_penalty": 73.385, "bench_bonus": 3.791, "wait_discount": 0.277, "wait_margin": 4.763, "injury_penalty": 30.744, "rb_early_bonus": 12.993, "qb_earliest_roun
3d0eed5	1878.1	126.3	5.14	0.373	300	discard	auto 733 screen: {"need_bonus": 22.34, "flex_bonus": 9.6, "depth_quota_wr": 4, "depth_quota_te": 2, "depth_quota_qb": 1, "surplus_penalty": 38.241, "bench_bonus": 4.234, "wait_discount": 0.227, "wait_margin": 4.785, "injury_penalty": 34.76, "rb_early_bonus": 12.005, 
3d0eed5	1877.2	114.6	5.07	0.363	300	discard	auto 734 screen: {"need_bonus": 32.432, "flex_bonus": 11.305, "surplus_penalty": 34.518, "bench_bonus": 4.1, "wait_discount": 0.161, "wait_margin": 3.819, "injury_penalty": 25.592, "rb_early_bonus": 11.977, "qb_earliest_round": 6, "avail_sigma": 4.323, "avail_strengt
3d0eed5	1857.6	115.1	5.62	0.307	300	discard	auto 735 screen: {"need_bonus": 51.02, "flex_bonus": 13.404, "depth_quota_wr": 6, "surplus_penalty": 43.106, "bench_bonus": 3.441, "wait_discount": 0.16, "wait_margin": 2.964, "injury_penalty": 15.077, "rb_early_bonus": 4.605, "qb_earliest_round": 4, "te_earliest_rou
3d0eed5	1849.3	113.6	5.69	0.297	300	discard	auto 736 screen: {"need_bonus": -1.282, "flex_bonus": 10.567, "depth_quota_rb": 5, "depth_quota_te": 2, "depth_quota_qb": 1, "surplus_penalty": 0.429, "bench_bonus": 3.569, "wait_discount": 0.209, "wait_margin": 2.595, "injury_penalty": 24.024, "rb_early_bonus": -0.3
3d0eed5	1893.1	119.7	4.75	0.418	2700	discard	auto 737 confirmed: {"need_bonus": 27.355, "flex_bonus": 7.314, "depth_quota_rb": 3, "depth_quota_wr": 6, "surplus_penalty": 49.521, "bench_bonus": 4.205, "wait_discount": 0.143, "wait_margin": 3.121, "injury_penalty": 9.428, "rb_early_bonus": 11.853, "avail_sigma": 4.6
3d0eed5	1881.3	115.4	4.87	0.367	300	discard	auto 738 screen: {"need_bonus": 36.39, "flex_bonus": 9.522, "depth_quota_rb": 3, "depth_quota_te": 4, "surplus_penalty": 31.709, "bench_bonus": 3.474, "wait_discount": 0.141, "wait_margin": 3.559, "injury_penalty": 24.982, "rb_early_bonus": 9.64, "qb_earliest_round":
3d0eed5	1889.9	118.1	4.83	0.415	2700	discard	auto 739 confirmed: {"need_bonus": 24.161, "flex_bonus": 9.813, "depth_quota_wr": 4, "depth_quota_te": 2, "surplus_penalty": 33.94, "bench_bonus": -1.76, "wait_discount": -0.049, "wait_margin": 7.331, "injury_penalty": 52.258, "rb_early_bonus": 16.059, "qb_earliest_roun
3d0eed5	1884.8	119.2	4.99	0.402	2700	discard	auto 740 confirmed: {"need_bonus": 31.98, "flex_bonus": 7.952, "depth_quota_qb": 1, "surplus_penalty": 37.078, "bench_bonus": 5.281, "wait_discount": 0.153, "wait_margin": 4.586, "injury_penalty": 25.343, "rb_early_bonus": 10.594, "te_earliest_round": 5, "avail_sigma": 
3d0eed5	1881.6	116.4	4.98	0.38	300	discard	auto 741 screen: {"need_bonus": 11.982, "flex_bonus": 15.544, "depth_quota_rb": 5, "depth_quota_wr": 6, "depth_quota_te": 4, "depth_quota_qb": 1, "surplus_penalty": 42.643, "bench_bonus": 2.655, "wait_discount": 0.179, "wait_margin": 7.236, "injury_penalty": 24.233, 
3d0eed5	1892.7	120.9	4.77	0.423	2700	discard	auto 742 confirmed: {"need_bonus": 33.924, "flex_bonus": 8.67, "depth_quota_te": 2, "surplus_penalty": 35.919, "bench_bonus": 5.26, "wait_discount": 0.168, "wait_margin": 4.117, "kdef_rounds_from_end": 2, "injury_penalty": 25.219, "rb_early_bonus": 8.603, "te_earliest_r
3d0eed5	1890.2	119.6	4.8	0.418	2700	discard	auto 743 confirmed: {"need_bonus": 29.115, "flex_bonus": 9.504, "depth_quota_rb": 5, "depth_quota_wr": 6, "depth_quota_te": 2, "surplus_penalty": 38.155, "bench_bonus": 3.998, "wait_discount": 0.001, "wait_margin": 5.824, "injury_penalty": 21.288, "rb_early_bonus": 2.45
3d0eed5	1887.3	120.7	4.9	0.406	2700	discard	auto 744 confirmed: {"need_bonus": 35.739, "flex_bonus": 10.763, "depth_quota_rb": 5, "depth_quota_te": 2, "surplus_penalty": 46.724, "bench_bonus": 5.313, "wait_discount": 0.182, "wait_margin": 4.281, "injury_penalty": 36.659, "rb_early_bonus": 13.347, "avail_sigma": 3
3d0eed5	1883.3	118.4	5.05	0.383	300	discard	auto 745 screen: {"need_bonus": 5.063, "flex_bonus": 14.779, "depth_quota_wr": 6, "depth_quota_te": 4, "surplus_penalty": 16.888, "bench_bonus": 1.52, "wait_discount": 0.222, "wait_margin": 2.806, "kdef_rounds_from_end": 2, "injury_penalty": 21.821, "rb_early_bonus":
3d0eed5	1878.2	116.6	5.12	0.387	300	discard	auto 746 screen: {"need_bonus": 44.163, "flex_bonus": 7.788, "depth_quota_rb": 5, "depth_quota_te": 2, "depth_quota_qb": 1, "surplus_penalty": 39.284, "bench_bonus": 5.517, "wait_discount": 0.187, "wait_margin": 2.945, "injury_penalty": 12.93, "rb_early_bonus": 11.62
3d0eed5	1893.7	117.0	4.7	0.428	2700	discard	auto 747 confirmed: {"need_bonus": 32.322, "flex_bonus": 8.198, "surplus_penalty": 38.954, "bench_bonus": 3.698, "wait_discount": 0.168, "wait_margin": 3.915, "injury_penalty": 31.634, "rb_early_bonus": 8.847, "qb_earliest_round": 6, "avail_sigma": 3.385, "avail_strengt
3d0eed5	1890.8	119.9	4.77	0.418	2700	discard	auto 748 confirmed: {"need_bonus": 38.487, "flex_bonus": 18.989, "depth_quota_rb": 5, "depth_quota_wr": 6, "depth_quota_qb": 3, "surplus_penalty": 18.383, "bench_bonus": 6.141, "wait_discount": 0.191, "wait_margin": 6.533, "injury_penalty": 38.063, "rb_early_bonus": 5.6
3d0eed5	1890.6	118.6	4.81	0.41	2700	discard	auto 749 confirmed: {"need_bonus": 21.717, "flex_bonus": 12.811, "depth_quota_rb": 5, "depth_quota_te": 2, "surplus_penalty": 30.336, "bench_bonus": 4.275, "wait_discount": 0.157, "wait_margin": 3.885, "injury_penalty": 27.585, "rb_early_bonus": 10.862, "te_earliest_rou
3d0eed5	1893.3	119.1	4.77	0.424	2700	discard	auto 750 confirmed: {"need_bonus": 36.713, "flex_bonus": 13.105, "depth_quota_rb": 5, "depth_quota_wr": 4, "surplus_penalty": 56.227, "bench_bonus": 4.013, "wait_discount": 0.111, "wait_margin": 5.059, "injury_penalty": 30.62, "rb_early_bonus": 5.79, "avail_sigma": 5.81
3d0eed5	1869.9	122.3	5.42	0.337	300	discard	auto 751 screen: {"need_bonus": 57.428, "flex_bonus": 11.308, "depth_quota_qb": 3, "surplus_penalty": 24.024, "bench_bonus": 2.935, "wait_discount": 0.442, "wait_margin": 4.82, "injury_penalty": 37.228, "rb_early_bonus": 8.507, "te_earliest_round": 3, "avail_sigma": 
3d0eed5	1886.3	119.7	5.06	0.39	300	discard	auto 752 screen: {"need_bonus": 42.621, "flex_bonus": 3.079, "depth_quota_wr": 6, "surplus_penalty": 53.052, "bench_bonus": 2.569, "wait_discount": 0.151, "wait_margin": 3.723, "kdef_rounds_from_end": 2, "injury_penalty": 31.387, "rb_early_bonus": 6.862, "qb_earliest
3d0eed5	1879.4	120.4	5.12	0.363	300	discard	auto 753 screen: {"need_bonus": 41.569, "flex_bonus": 7.362, "depth_quota_wr": 4, "depth_quota_te": 4, "depth_quota_qb": 1, "surplus_penalty": 20.434, "bench_bonus": 3.153, "wait_discount": 0.203, "wait_margin": 4.806, "kdef_rounds_from_end": 2, "injury_penalty": 26.
3d0eed5	1889.3	118.8	4.85	0.405	2700	discard	auto 754 confirmed: {"need_bonus": 30.05, "flex_bonus": 8.964, "depth_quota_rb": 5, "surplus_penalty": 34.626, "bench_bonus": 3.558, "wait_discount": 0.171, "wait_margin": 4.412, "kdef_rounds_from_end": 2, "injury_penalty": 24.69, "rb_early_bonus": 10.645, "avail_sigma"
3d0eed5	1883.0	110.9	4.92	0.367	300	discard	auto 755 screen: {"need_bonus": 29.621, "flex_bonus": 10.111, "depth_quota_rb": 3, "depth_quota_wr": 4, "depth_quota_qb": 3, "surplus_penalty": 33.583, "bench_bonus": 3.999, "wait_discount": 0.185, "wait_margin": 4.273, "kdef_rounds_from_end": 2, "injury_penalty": 31
3d0eed5	1884.7	118.5	5.03	0.38	300	discard	auto 756 screen: {"need_bonus": 30.378, "flex_bonus": 8.251, "depth_quota_rb": 3, "surplus_penalty": 39.01, "bench_bonus": 3.993, "wait_discount": 0.127, "wait_margin": 3.842, "kdef_rounds_from_end": 2, "injury_penalty": 19.697, "rb_early_bonus": 9.011, "avail_sigma"
3d0eed5	1893.5	119.6	4.78	0.422	2700	discard	auto 757 confirmed: {"need_bonus": 30.667, "flex_bonus": 14.448, "depth_quota_rb": 3, "depth_quota_wr": 6, "depth_quota_te": 2, "surplus_penalty": 42.933, "bench_bonus": 4.263, "wait_discount": 0.184, "wait_margin": 1.988, "injury_penalty": 22.63, "rb_early_bonus": 13.2
3d0eed5	1867.8	124.8	5.49	0.35	300	discard	auto 758 screen: {"need_bonus": 53.846, "flex_bonus": 13.019, "depth_quota_te": 4, "depth_quota_qb": 1, "surplus_penalty": 16.453, "bench_bonus": 5.838, "wait_discount": 0.087, "wait_margin": 4.856, "injury_penalty": 30.45, "rb_early_bonus": 8.518, "qb_earliest_round
3d0eed5	1884.5	123.8	4.96	0.393	300	discard	auto 759 screen: {"need_bonus": 43.164, "flex_bonus": 14.706, "depth_quota_wr": 6, "depth_quota_te": 4, "depth_quota_qb": 1, "surplus_penalty": 50.688, "bench_bonus": 6.008, "wait_discount": 0.233, "wait_margin": 4.376, "kdef_rounds_from_end": 2, "injury_penalty": 35
3d0eed5	1877.8	115.5	5.12	0.363	300	discard	auto 760 screen: {"need_bonus": 27.774, "flex_bonus": 12.713, "depth_quota_wr": 6, "depth_quota_te": 2, "surplus_penalty": 7.559, "bench_bonus": 1.877, "wait_margin": 3.055, "injury_penalty": 28.397, "rb_early_bonus": 9.107, "te_earliest_round": 5, "avail_sigma": 4.5
3d0eed5	1892.1	119.1	4.75	0.419	2700	discard	auto 761 confirmed: {"need_bonus": 21.532, "flex_bonus": 11.737, "depth_quota_qb": 3, "surplus_penalty": 36.778, "bench_bonus": 4.719, "wait_discount": 0.129, "wait_margin": 4.31, "kdef_rounds_from_end": 2, "injury_penalty": 25.348, "rb_early_bonus": 7.487, "qb_earliest
3d0eed5	1882.4	115.4	5.06	0.383	300	discard	auto 762 screen: {"need_bonus": 53.574, "flex_bonus": 5.854, "depth_quota_rb": 5, "depth_quota_wr": 6, "depth_quota_te": 2, "depth_quota_qb": 3, "surplus_penalty": 35.482, "bench_bonus": 3.719, "wait_discount": 0.138, "wait_margin": 3.811, "injury_penalty": 44.347, "
3d0eed5	1886.7	120.2	4.88	0.402	2700	discard	auto 763 confirmed: {"need_bonus": 32.783, "flex_bonus": 12.125, "depth_quota_rb": 5, "depth_quota_te": 4, "surplus_penalty": 35.652, "bench_bonus": 3.028, "wait_discount": 0.161, "wait_margin": 3.19, "injury_penalty": 27.52, "rb_early_bonus": 6.773, "qb_earliest_round"
3d0eed5	1890.2	118.6	4.82	0.409	2700	discard	auto 764 confirmed: {"need_bonus": 36.874, "flex_bonus": 12.169, "depth_quota_rb": 3, "depth_quota_wr": 6, "surplus_penalty": 30.841, "bench_bonus": 3.597, "wait_discount": 0.166, "wait_margin": 2.575, "injury_penalty": 23.203, "rb_early_bonus": 8.46, "avail_sigma": 4.1
3d0eed5	1892.6	119.0	4.78	0.422	2700	discard	auto 765 confirmed: {"need_bonus": 28.866, "flex_bonus": 9.164, "surplus_penalty": 31.659, "bench_bonus": 4.366, "wait_discount": 0.14, "wait_margin": 3.927, "injury_penalty": 34.842, "rb_early_bonus": 9.145, "qb_earliest_round": 4, "avail_sigma": 5.695, "avail_strength
