commit	score	score_std	mean_rank	p_top3	n_sims	status	description
3d0eed5	1895.7	117.5	4.68	0.437	2700	discard	auto 835 confirmed: {"need_bonus": 29.552, "flex_bonus": 9.18, "depth_quota_rb": 5, "depth_quota_wr": 4, "surplus_penalty": 52.862, "bench_bonus": 0.762, "wait_discount": 0.237, "wait_margin": 3.473, "injury_penalty": 20.382, "rb_early_bonus": 9.878, "te_earliest_round"
3d0eed5	1868.0	123.8	5.57	0.32	300	discard	auto 836 screen: {"need_bonus": 16.522, "flex_bonus": 8.363, "depth_quota_rb": 5, "depth_quota_te": 4, "depth_quota_qb": 1, "surplus_penalty": 41.507, "bench_bonus": 5.087, "wait_discount": 0.154, "wait_margin": -1.385, "injury_penalty": 34.519, "rb_early_bonus": 17.
3d0eed5	1886.6	119.4	4.91	0.414	2700	discard	auto 837 confirmed: {"need_bonus": 16.242, "flex_bonus": 17.209, "depth_quota_wr": 6, "depth_quota_te": 4, "depth_quota_qb": 3, "surplus_penalty": 47.819, "bench_bonus": 3.266, "wait_discount": 0.113, "wait_margin": 7.584, "injury_penalty": 30.233, "rb_early_bonus": 5.2
3d0eed5	1876.1	115.5	5.12	0.383	300	discard	auto 838 screen: {"need_bonus": 24.513, "flex_bonus": 8.382, "depth_quota_rb": 5, "depth_quota_wr": 6, "depth_quota_qb": 3, "surplus_penalty": 23.742, "bench_bonus": 2.998, "wait_discount": 0.118, "wait_margin": 4.121, "injury_penalty": 15.702, "rb_early_bonus": 7.53
3d0eed5	1877.1	123.8	5.15	0.36	300	discard	auto 839 screen: {"need_bonus": 19.252, "flex_bonus": 11.375, "depth_quota_rb": 5, "depth_quota_te": 2, "depth_quota_qb": 1, "surplus_penalty": 37.567, "bench_bonus": 4.89, "wait_discount": 0.152, "wait_margin": 3.577, "injury_penalty": 26.183, "rb_early_bonus": 8.80
3d0eed5	1879.6	135.1	5.19	0.363	300	discard	auto 840 screen: {"need_bonus": 64.874, "flex_bonus": 17.871, "depth_quota_rb": 5, "depth_quota_te": 4, "surplus_penalty": 35.722, "bench_bonus": -2.752, "wait_discount": 0.164, "wait_margin": 2.489, "injury_penalty": 28.312, "rb_early_bonus": 4.253, "avail_sigma": 5
3d0eed5	1878.2	113.7	5.11	0.37	300	discard	auto 841 screen: {"need_bonus": 25.312, "flex_bonus": 11.149, "depth_quota_rb": 3, "depth_quota_wr": 6, "depth_quota_qb": 1, "surplus_penalty": 35.077, "bench_bonus": 3.46, "wait_discount": 0.165, "wait_margin": 4.564, "injury_penalty": 25.987, "rb_early_bonus": 5.19
3d0eed5	1872.7	117.0	5.23	0.37	300	discard	auto 842 screen: {"need_bonus": 5.263, "flex_bonus": 8.403, "depth_quota_rb": 3, "depth_quota_qb": 1, "surplus_penalty": 29.235, "bench_bonus": 4.651, "wait_discount": 0.29, "wait_margin": 4.419, "injury_penalty": 43.161, "rb_early_bonus": 14.576, "qb_earliest_round"
3d0eed5	1854.6	109.7	5.76	0.297	300	discard	auto 843 screen: {"need_bonus": 66.643, "flex_bonus": 3.887, "depth_quota_rb": 3, "depth_quota_wr": 4, "depth_quota_te": 2, "depth_quota_qb": 1, "surplus_penalty": 40.996, "bench_bonus": 2.75, "wait_discount": 0.377, "wait_margin": 4.647, "injury_penalty": 8.187, "rb
3d0eed5	1891.4	117.6	4.77	0.418	2700	discard	auto 844 confirmed: {"need_bonus": 31.524, "flex_bonus": 8.714, "depth_quota_te": 2, "surplus_penalty": 36.524, "bench_bonus": 4.015, "wait_discount": 0.131, "wait_margin": 3.194, "injury_penalty": 25.642, "rb_early_bonus": 9.099, "qb_earliest_round": 6, "avail_sigma": 
3d0eed5	1889.9	117.2	4.78	0.417	2700	discard	auto 845 confirmed: {"need_bonus": 26.91, "flex_bonus": 2.606, "depth_quota_qb": 3, "surplus_penalty": 12.312, "bench_bonus": 2.356, "wait_discount": 0.021, "wait_margin": 7.251, "injury_penalty": 29.251, "rb_early_bonus": 10.295, "qb_earliest_round": 6, "te_earliest_ro
3d0eed5	1881.3	121.9	5.06	0.39	2700	discard	auto 846 confirmed: {"need_bonus": 16.48, "flex_bonus": 9.559, "depth_quota_rb": 5, "depth_quota_wr": 6, "depth_quota_qb": 3, "surplus_penalty": 43.255, "bench_bonus": 1.61, "wait_discount": 0.153, "wait_margin": 1.401, "kdef_rounds_from_end": 2, "injury_penalty": 19.48
3d0eed5	1875.3	119.5	5.37	0.313	300	discard	auto 847 screen: {"need_bonus": 27.303, "flex_bonus": -3.248, "depth_quota_wr": 6, "depth_quota_te": 4, "surplus_penalty": 65.214, "bench_bonus": 9.998, "wait_discount": 0.076, "wait_margin": 1.507, "kdef_rounds_from_end": 2, "injury_penalty": 27.293, "rb_early_bonus
3d0eed5	1884.1	116.8	4.96	0.42	300	discard	auto 848 screen: {"need_bonus": 28.859, "flex_bonus": 8.726, "depth_quota_rb": 3, "depth_quota_wr": 6, "depth_quota_qb": 1, "surplus_penalty": 36.027, "bench_bonus": 2.665, "wait_discount": 0.041, "wait_margin": 2.782, "injury_penalty": 26.29, "rb_early_bonus": 17.46
3d0eed5	1878.3	124.0	5.13	0.367	300	discard	auto 849 screen: {"need_bonus": 31.635, "flex_bonus": 8.707, "depth_quota_wr": 4, "depth_quota_te": 2, "depth_quota_qb": 1, "surplus_penalty": 40.881, "bench_bonus": 2.812, "wait_discount": 0.232, "wait_margin": 6.112, "injury_penalty": 29.208, "rb_early_bonus": 6.38
3d0eed5	1891.5	117.9	4.74	0.428	2700	discard	auto 850 confirmed: {"need_bonus": 17.367, "flex_bonus": 9.033, "depth_quota_qb": 3, "surplus_penalty": 17.049, "bench_bonus": 1.461, "wait_margin": 4.234, "injury_penalty": 32.542, "rb_early_bonus": 11.402, "avail_sigma": 5.533, "avail_strength": 0.401, "cliff_gap": 28
3d0eed5	1892.4	118.9	4.77	0.421	2700	discard	auto 851 confirmed: {"need_bonus": 23.026, "flex_bonus": 10.587, "depth_quota_wr": 6, "depth_quota_te": 2, "surplus_penalty": 42.661, "bench_bonus": 4.435, "wait_discount": 0.088, "wait_margin": 5.23, "injury_penalty": 28.925, "rb_early_bonus": 7.08, "qb_earliest_round"
3d0eed5	1871.4	115.3	5.17	0.37	300	discard	auto 852 screen: {"need_bonus": 12.991, "flex_bonus": 9.215, "depth_quota_rb": 5, "depth_quota_qb": 1, "surplus_penalty": 52.045, "bench_bonus": 1.789, "wait_discount": 0.431, "wait_margin": 4.486, "kdef_rounds_from_end": 2, "injury_penalty": 31.177, "rb_early_bonus"
3d0eed5	1876.0	120.5	5.18	0.347	300	discard	auto 853 screen: {"need_bonus": 59.553, "flex_bonus": 13.966, "depth_quota_rb": 5, "depth_quota_wr": 4, "depth_quota_te": 4, "surplus_penalty": 38.023, "bench_bonus": 6.457, "wait_discount": 0.054, "wait_margin": 1.646, "injury_penalty": 41.308, "rb_early_bonus": 12.
3d0eed5	1862.0	114.2	5.42	0.317	300	discard	auto 854 screen: {"need_bonus": 8.098, "flex_bonus": 7.723, "depth_quota_wr": 6, "depth_quota_qb": 1, "surplus_penalty": 63.541, "bench_bonus": -1.994, "wait_discount": -0.068, "wait_margin": 9.054, "injury_penalty": 12.042, "rb_early_bonus": 17.487, "qb_earliest_rou
3d0eed5	1889.1	120.3	4.82	0.417	2700	discard	auto 855 confirmed: {"need_bonus": 28.451, "flex_bonus": 7.797, "depth_quota_te": 2, "surplus_penalty": 39.071, "bench_bonus": 5.128, "wait_discount": 0.191, "wait_margin": 3.365, "injury_penalty": 28.026, "rb_early_bonus": 11.286, "qb_earliest_round": 6, "avail_sigma":
3d0eed5	1890.6	120.0	4.86	0.414	2700	discard	auto 856 confirmed: {"need_bonus": 38.819, "flex_bonus": 18.748, "depth_quota_rb": 3, "depth_quota_wr": 6, "depth_quota_te": 4, "surplus_penalty": 39.127, "bench_bonus": 6.622, "wait_discount": 0.188, "wait_margin": 2.401, "kdef_rounds_from_end": 2, "injury_penalty": 30
3d0eed5	1892.1	119.7	4.78	0.424	2700	discard	auto 857 confirmed: {"need_bonus": 13.87, "flex_bonus": 4.793, "depth_quota_te": 4, "surplus_penalty": 33.189, "bench_bonus": 3.272, "wait_discount": 0.105, "wait_margin": 1.762, "injury_penalty": 12.717, "rb_early_bonus": 8.675, "te_earliest_round": 5, "avail_sigma": 4
3d0eed5	1882.9	117.7	4.98	0.387	2700	discard	auto 858 confirmed: {"need_bonus": 37.802, "flex_bonus": 10.455, "depth_quota_rb": 5, "depth_quota_wr": 4, "depth_quota_qb": 1, "surplus_penalty": 19.217, "bench_bonus": 4.084, "wait_discount": 0.178, "wait_margin": 4.899, "injury_penalty": 16.393, "rb_early_bonus": 9.3
3d0eed5	1890.9	119.9	4.78	0.423	2700	discard	auto 859 confirmed: {"need_bonus": 41.982, "flex_bonus": 11.532, "depth_quota_wr": 4, "depth_quota_qb": 3, "surplus_penalty": 20.776, "bench_bonus": 6.74, "wait_discount": 0.215, "wait_margin": 4.437, "injury_penalty": 25.615, "rb_early_bonus": 12.009, "qb_earliest_roun
3d0eed5	1889.8	120.6	4.82	0.416	2700	discard	auto 860 confirmed: {"need_bonus": 31.583, "flex_bonus": 9.378, "depth_quota_rb": 3, "depth_quota_qb": 3, "surplus_penalty": 22.655, "bench_bonus": 6.893, "wait_discount": 0.197, "wait_margin": 1.831, "injury_penalty": 13.138, "rb_early_bonus": 7.386, "qb_earliest_round
3d0eed5	1880.3	124.3	5.12	0.387	300	discard	auto 861 screen: {"need_bonus": 33.836, "flex_bonus": 12.502, "depth_quota_te": 2, "surplus_penalty": 15.177, "bench_bonus": 8.104, "wait_discount": 0.199, "wait_margin": 3.648, "kdef_rounds_from_end": 2, "injury_penalty": 43.797, "rb_early_bonus": 3.239, "avail_sigm
3d0eed5	1892.4	119.6	4.77	0.418	2700	discard	auto 862 confirmed: {"need_bonus": 22.515, "flex_bonus": 12.393, "depth_quota_te": 2, "surplus_penalty": 66.245, "bench_bonus": 0.109, "wait_discount": 0.185, "wait_margin": 6.88, "injury_penalty": 42.626, "rb_early_bonus": 5.337, "te_earliest_round": 5, "avail_sigma": 
3d0eed5	1895.5	120.6	4.73	0.42	2700	discard	auto 863 confirmed: {"need_bonus": 7.428, "flex_bonus": 6.92, "depth_quota_rb": 3, "depth_quota_wr": 4, "surplus_penalty": 20.441, "bench_bonus": 4.617, "wait_discount": 0.178, "wait_margin": 4.161, "injury_penalty": 27.121, "rb_early_bonus": 9.12, "qb_earliest_round": 
3d0eed5	1885.0	118.2	4.99	0.394	2700	discard	auto 864 confirmed: {"need_bonus": 48.856, "flex_bonus": 6.396, "depth_quota_te": 4, "surplus_penalty": 46.13, "bench_bonus": 3.947, "wait_discount": 0.192, "wait_margin": 2.27, "kdef_rounds_from_end": 2, "injury_penalty": 36.557, "rb_early_bonus": 14.87, "te_earliest_r
3d0eed5	1887.3	115.7	4.92	0.423	300	discard	auto 865 screen: {"need_bonus": 51.53, "flex_bonus": 5.588, "depth_quota_wr": 4, "depth_quota_qb": 1, "surplus_penalty": 56.028, "bench_bonus": 5.196, "wait_discount": 0.038, "wait_margin": 4.007, "injury_penalty": 15.458, "rb_early_bonus": 12.565, "te_earliest_round
3d0eed5	1890.9	119.3	4.83	0.413	2700	discard	auto 866 confirmed: {"need_bonus": 43.974, "flex_bonus": 10.317, "depth_quota_wr": 4, "depth_quota_te": 4, "surplus_penalty": 34.694, "bench_bonus": 5.65, "wait_discount": 0.148, "wait_margin": 3.527, "injury_penalty": 23.807, "rb_early_bonus": 9.096, "avail_sigma": 4.3
3d0eed5	1887.9	119.4	4.87	0.411	2700	discard	auto 867 confirmed: {"need_bonus": 25.998, "flex_bonus": 6.668, "depth_quota_rb": 5, "depth_quota_te": 4, "surplus_penalty": 18.832, "bench_bonus": 4.451, "wait_discount": 0.18, "wait_margin": 4.408, "kdef_rounds_from_end": 2, "injury_penalty": 13.515, "rb_early_bonus":
3d0eed5	1884.8	122.7	5.0	0.4	300	discard	auto 868 screen: {"need_bonus": 30.286, "flex_bonus": 9.528, "depth_quota_rb": 5, "depth_quota_te": 4, "surplus_penalty": 40.321, "bench_bonus": 4.577, "wait_discount": 0.148, "wait_margin": 3.472, "injury_penalty": 25.377, "rb_early_bonus": 9.071, "te_earliest_round
3d0eed5	1884.5	137.3	5.13	0.393	300	discard	auto 869 screen: {"need_bonus": 37.653, "flex_bonus": 11.256, "depth_quota_te": 4, "depth_quota_qb": 1, "surplus_penalty": 33.808, "bench_bonus": 1.936, "wait_discount": 0.107, "wait_margin": 4.223, "injury_penalty": 32.383, "rb_early_bonus": 6.462, "qb_earliest_roun
3d0eed5	1881.5	120.1	5.02	0.36	300	discard	auto 870 screen: {"need_bonus": 41.01, "flex_bonus": 9.876, "depth_quota_rb": 3, "depth_quota_wr": 4, "depth_quota_te": 4, "surplus_penalty": 46.15, "bench_bonus": 5.977, "wait_discount": 0.097, "wait_margin": 2.238, "kdef_rounds_from_end": 2, "injury_penalty": 21.15
3d0eed5	1884.1	120.0	4.94	0.391	2700	discard	auto 871 confirmed: {"need_bonus": 61.894, "flex_bonus": 1.719, "depth_quota_wr": 6, "depth_quota_te": 4, "depth_quota_qb": 1, "surplus_penalty": 75.409, "bench_bonus": 10.739, "wait_discount": 0.303, "wait_margin": 2.384, "kdef_rounds_from_end": 2, "injury_penalty": 5.
3d0eed5	1872.2	122.5	5.37	0.35	300	discard	auto 872 screen: {"need_bonus": 72.608, "flex_bonus": 15.439, "depth_quota_qb": 1, "surplus_penalty": 27.972, "bench_bonus": 4.882, "wait_discount": 0.053, "wait_margin": 9.547, "injury_penalty": -11.116, "rb_early_bonus": 13.39, "qb_earliest_round": 4, "te_earliest_
3d0eed5	1893.2	118.6	4.72	0.43	2700	discard	auto 873 confirmed: {"need_bonus": 26.934, "flex_bonus": 12.224, "depth_quota_te": 4, "surplus_penalty": 39.791, "bench_bonus": 5.897, "wait_discount": 0.235, "wait_margin": 4.662, "injury_penalty": 21.647, "rb_early_bonus": 13.927, "qb_earliest_round": 6, "avail_sigma"
3d0eed5	1887.2	113.2	4.83	0.39	300	discard	auto 874 screen: {"need_bonus": 30.951, "flex_bonus": 10.628, "depth_quota_rb": 3, "depth_quota_qb": 1, "surplus_penalty": 35.359, "bench_bonus": 7.015, "wait_discount": 0.135, "wait_margin": 4.547, "injury_penalty": 16.715, "rb_early_bonus": 7.044, "qb_earliest_roun
3d0eed5	1892.0	119.3	4.79	0.425	2700	discard	auto 875 confirmed: {"need_bonus": 33.842, "flex_bonus": 8.263, "depth_quota_rb": 5, "depth_quota_wr": 4, "depth_quota_te": 2, "surplus_penalty": 35.026, "bench_bonus": 4.592, "wait_discount": 0.152, "wait_margin": 4.473, "kdef_rounds_from_end": 2, "injury_penalty": 28.
3d0eed5	1878.3	122.6	5.19	0.363	300	discard	auto 876 screen: {"need_bonus": 15.413, "flex_bonus": 7.819, "depth_quota_te": 4, "surplus_penalty": 30.944, "bench_bonus": 4.108, "wait_discount": 0.207, "wait_margin": 3.783, "injury_penalty": 28.982, "rb_early_bonus": 9.108, "te_earliest_round": 5, "avail_sigma": 
3d0eed5	1883.9	109.7	4.94	0.377	300	discard	auto 877 screen: {"need_bonus": 12.227, "flex_bonus": 6.012, "depth_quota_wr": 4, "depth_quota_te": 2, "surplus_penalty": 48.231, "bench_bonus": 4.931, "wait_discount": 0.214, "wait_margin": 6.299, "injury_penalty": 16.777, "rb_early_bonus": 12.039, "avail_sigma": 3.
3d0eed5	1882.9	119.0	4.99	0.387	300	discard	auto 878 screen: {"need_bonus": 29.398, "flex_bonus": 9.545, "depth_quota_rb": 3, "surplus_penalty": 33.806, "bench_bonus": 3.246, "wait_discount": 0.206, "wait_margin": 3.503, "kdef_rounds_from_end": 2, "injury_penalty": 24.329, "rb_early_bonus": 10.125, "qb_earlies
3d0eed5	1887.7	120.2	4.93	0.402	2700	discard	auto 879 confirmed: {"need_bonus": 28.593, "flex_bonus": 3.204, "depth_quota_wr": 4, "surplus_penalty": 45.477, "bench_bonus": 6.041, "wait_discount": 0.275, "wait_margin": 3.437, "injury_penalty": 4.752, "rb_early_bonus": 11.58, "avail_sigma": 2.454, "avail_strength": 
3d0eed5	1890.0	120.6	4.79	0.423	2700	discard	auto 880 confirmed: {"need_bonus": 30.837, "flex_bonus": 11.545, "depth_quota_rb": 3, "depth_quota_wr": 4, "depth_quota_qb": 3, "surplus_penalty": 44.849, "bench_bonus": 3.549, "wait_discount": 0.198, "wait_margin": 3.707, "injury_penalty": 29.155, "rb_early_bonus": 8.4
3d0eed5	1842.5	113.0	6.02	0.273	300	discard	auto 881 screen: {"need_bonus": 71.628, "flex_bonus": 10.225, "depth_quota_wr": 6, "depth_quota_qb": 1, "surplus_penalty": 69.65, "bench_bonus": 6.475, "wait_discount": 0.086, "wait_margin": 5.445, "injury_penalty": 16.731, "rb_early_bonus": 15.2, "avail_sigma": 5.3,
3d0eed5	1846.5	107.6	5.97	0.263	300	discard	auto 882 screen: {"need_bonus": 67.103, "flex_bonus": 12.768, "depth_quota_rb": 5, "depth_quota_wr": 4, "surplus_penalty": 37.622, "bench_bonus": 4.898, "wait_discount": 0.123, "wait_margin": 2.712, "injury_penalty": 11.614, "rb_early_bonus": -2.478, "qb_earliest_rou
3d0eed5	1877.3	115.6	5.15	0.38	300	discard	auto 883 screen: {"need_bonus": 33.848, "flex_bonus": 13.192, "depth_quota_wr": 6, "depth_quota_te": 4, "depth_quota_qb": 1, "surplus_penalty": 43.024, "bench_bonus": 1.046, "wait_discount": 0.237, "wait_margin": 2.435, "injury_penalty": 20.836, "rb_early_bonus": 16.
3d0eed5	1892.7	118.0	4.7	0.429	2700	discard	auto 884 confirmed: {"need_bonus": 21.347, "flex_bonus": 6.309, "depth_quota_wr": 6, "depth_quota_te": 4, "surplus_penalty": -10.946, "bench_bonus": 5.9, "wait_discount": 0.069, "wait_margin": 6.604, "injury_penalty": 20.388, "rb_early_bonus": 4.027, "te_earliest_round"
3d0eed5	1883.6	122.6	5.02	0.38	300	discard	auto 885 screen: {"need_bonus": 12.73, "flex_bonus": 10.62, "depth_quota_rb": 5, "depth_quota_te": 4, "surplus_penalty": 59.888, "bench_bonus": 4.077, "wait_discount": 0.101, "wait_margin": 5.51, "injury_penalty": 37.83, "rb_early_bonus": 12.465, "qb_earliest_round":
3d0eed5	1877.3	115.1	5.04	0.363	300	discard	auto 886 screen: {"need_bonus": 22.261, "flex_bonus": 5.204, "depth_quota_rb": 5, "depth_quota_te": 2, "depth_quota_qb": 1, "surplus_penalty": 24.62, "bench_bonus": 3.94, "wait_discount": 0.054, "wait_margin": 3.139, "kdef_rounds_from_end": 2, "injury_penalty": 28.33
3d0eed5	1875.5	116.6	5.23	0.343	300	discard	auto 887 screen: {"need_bonus": 29.09, "flex_bonus": 6.973, "depth_quota_rb": 5, "depth_quota_wr": 4, "depth_quota_te": 4, "surplus_penalty": 44.012, "bench_bonus": 2.31, "wait_discount": 0.179, "wait_margin": 2.471, "kdef_rounds_from_end": 2, "injury_penalty": 19.03
3d0eed5	1870.8	114.3	5.22	0.353	300	discard	auto 888 screen: {"need_bonus": 35.739, "flex_bonus": 3.829, "depth_quota_rb": 5, "depth_quota_te": 2, "depth_quota_qb": 3, "surplus_penalty": 44.373, "bench_bonus": 6.035, "wait_discount": 0.087, "wait_margin": 3.574, "injury_penalty": 15.47, "rb_early_bonus": 2.656
3d0eed5	1833.7	117.4	6.45	0.23	300	discard	auto 889 screen: {"need_bonus": 35.794, "flex_bonus": -2.726, "depth_quota_rb": 3, "depth_quota_te": 2, "depth_quota_qb": 1, "surplus_penalty": -0.092, "bench_bonus": 1.399, "wait_discount": 0.181, "wait_margin": 6.811, "kdef_rounds_from_end": 2, "injury_penalty": 8.
3d0eed5	1874.9	108.6	5.15	0.367	300	discard	auto 890 screen: {"need_bonus": 40.564, "flex_bonus": 11.843, "depth_quota_wr": 6, "depth_quota_qb": 1, "surplus_penalty": 49.131, "bench_bonus": 3.282, "wait_discount": 0.122, "wait_margin": 3.565, "kdef_rounds_from_end": 2, "injury_penalty": 38.19, "rb_early_bonus"
3d0eed5	1890.5	119.7	4.83	0.404	2700	discard	auto 891 confirmed: {"need_bonus": 33.726, "flex_bonus": 6.104, "depth_quota_rb": 3, "depth_quota_wr": 6, "surplus_penalty": 31.365, "bench_bonus": 1.441, "wait_discount": 0.088, "wait_margin": 5.352, "injury_penalty": 15.71, "rb_early_bonus": 10.856, "qb_earliest_round
3d0eed5	1896.5	117.9	4.64	0.442	2700	discard	auto 892 confirmed: {"need_bonus": 38.061, "flex_bonus": 9.852, "depth_quota_rb": 5, "depth_quota_wr": 6, "surplus_penalty": 37.105, "bench_bonus": 4.457, "wait_discount": 0.152, "wait_margin": 3.33, "injury_penalty": 25.362, "rb_early_bonus": 6.701, "te_earliest_round"
3d0eed5	1874.9	119.5	5.17	0.39	300	discard	auto 893 screen: {"need_bonus": 33.134, "flex_bonus": 8.636, "depth_quota_wr": 6, "depth_quota_te": 2, "depth_quota_qb": 1, "surplus_penalty": 46.055, "bench_bonus": 4.32, "wait_discount": 0.067, "wait_margin": 4.181, "kdef_rounds_from_end": 2, "injury_penalty": 25.1
3d0eed5	1892.9	119.8	4.74	0.425	2700	discard	auto 894 confirmed: {"need_bonus": 29.535, "flex_bonus": 11.654, "depth_quota_rb": 5, "depth_quota_te": 2, "depth_quota_qb": 3, "surplus_penalty": 39.615, "bench_bonus": 4.533, "wait_discount": 0.163, "wait_margin": 4.512, "injury_penalty": 29.302, "rb_early_bonus": 8.5
3d0eed5	1891.1	116.9	4.77	0.429	2700	discard	auto 895 confirmed: {"need_bonus": 22.987, "flex_bonus": 7.078, "depth_quota_rb": 5, "surplus_penalty": 22.724, "bench_bonus": 5.369, "wait_discount": 0.263, "wait_margin": 2.439, "injury_penalty": 38.217, "rb_early_bonus": 7.848, "qb_earliest_round": 4, "avail_sigma": 
3d0eed5	1876.5	127.2	5.14	0.383	300	discard	auto 896 screen: {"need_bonus": 27.853, "flex_bonus": 8.494, "depth_quota_wr": 4, "depth_quota_qb": 1, "surplus_penalty": 45.965, "bench_bonus": 6.188, "wait_discount": 0.141, "wait_margin": 6.473, "injury_penalty": 24.081, "rb_early_bonus": 11.615, "qb_earliest_roun
3d0eed5	1886.8	121.5	5.03	0.377	300	discard	auto 897 screen: {"need_bonus": 31.705, "flex_bonus": 7.067, "depth_quota_rb": 5, "depth_quota_wr": 6, "depth_quota_te": 2, "surplus_penalty": 31.412, "bench_bonus": 4.562, "wait_discount": 0.016, "wait_margin": 1.836, "injury_penalty": 54.576, "rb_early_bonus": 14.0
3d0eed5	1872.6	120.7	5.33	0.343	300	discard	auto 898 screen: {"need_bonus": 17.303, "flex_bonus": 6.2, "depth_quota_rb": 3, "depth_quota_qb": 3, "surplus_penalty": 35.554, "bench_bonus": 4.732, "wait_discount": 0.128, "wait_margin": 3.746, "injury_penalty": 34.275, "rb_early_bonus": 4.41, "te_earliest_round": 
3d0eed5	1882.5	116.6	5.0	0.383	300	discard	auto 899 screen: {"need_bonus": 17.53, "flex_bonus": 13.824, "depth_quota_rb": 3, "depth_quota_wr": 4, "depth_quota_te": 4, "depth_quota_qb": 1, "surplus_penalty": 2.808, "bench_bonus": 0.324, "wait_discount": 0.207, "wait_margin": 4.59, "injury_penalty": 32.025, "rb
3d0eed5	1893.9	119.5	4.68	0.435	2700	discard	auto 900 confirmed: {"need_bonus": 25.857, "flex_bonus": 8.814, "depth_quota_wr": 4, "depth_quota_qb": 3, "surplus_penalty": 31.833, "bench_bonus": 4.363, "wait_discount": 0.171, "wait_margin": 3.446, "injury_penalty": 28.044, "rb_early_bonus": 7.827, "qb_earliest_round
3d0eed5	1884.5	118.7	5.06	0.367	300	discard	auto 901 screen: {"need_bonus": 43.751, "flex_bonus": 8.3, "depth_quota_rb": 5, "depth_quota_te": 4, "surplus_penalty": 37.095, "bench_bonus": 5.463, "wait_discount": 0.142, "wait_margin": 4.709, "injury_penalty": 36.431, "rb_early_bonus": 15.484, "te_earliest_round"
3d0eed5	1891.5	120.1	4.8	0.414	2700	discard	auto 902 confirmed: {"need_bonus": 37.534, "flex_bonus": 10.431, "depth_quota_rb": 3, "depth_quota_wr": 6, "surplus_penalty": 31.717, "bench_bonus": 4.396, "wait_discount": 0.119, "wait_margin": 3.265, "injury_penalty": 27.76, "rb_early_bonus": 8.645, "avail_sigma": 3.7
3d0eed5	1894.2	118.2	4.72	0.426	2700	discard	auto 903 confirmed: {"need_bonus": 35.984, "flex_bonus": 5.561, "depth_quota_rb": 5, "depth_quota_wr": 6, "surplus_penalty": 64.507, "bench_bonus": 3.701, "wait_discount": 0.284, "wait_margin": 4.937, "injury_penalty": 32.545, "rb_early_bonus": 12.553, "qb_earliest_roun
