commit	score	score_std	mean_rank	p_top3	n_sims	status	description
3d0eed5	1883.6	116.5	4.98	0.387	300	discard	auto 1180 screen: {"need_bonus": 19.046, "flex_bonus": 11.864, "depth_quota_rb": 3, "surplus_penalty": 70.751, "bench_bonus": 5.093, "wait_discount": 0.208, "wait_margin": 4.673, "kdef_rounds_from_end": 2, "injury_penalty": 15.346, "rb_early_bonus": 9.869, "te_earlies
3d0eed5	1886.5	120.5	4.85	0.42	300	discard	auto 1181 screen: {"need_bonus": 19.313, "flex_bonus": 11.376, "depth_quota_rb": 3, "depth_quota_wr": 6, "surplus_penalty": 39.408, "bench_bonus": 4.189, "wait_discount": 0.152, "wait_margin": 3.081, "kdef_rounds_from_end": 2, "injury_penalty": 37.782, "rb_early_bonus
3d0eed5	1887.8	119.4	4.81	0.38	300	discard	auto 1182 screen: {"need_bonus": 51.689, "flex_bonus": 7.336, "depth_quota_rb": 3, "depth_quota_wr": 4, "depth_quota_qb": 3, "surplus_penalty": 30.613, "bench_bonus": 7.446, "wait_discount": 0.136, "wait_margin": 0.81, "injury_penalty": 24.551, "rb_early_bonus": 9.392
3d0eed5	1884.5	115.2	4.93	0.383	300	discard	auto 1183 screen: {"need_bonus": 27.16, "flex_bonus": 11.599, "depth_quota_rb": 3, "depth_quota_qb": 1, "surplus_penalty": 36.555, "bench_bonus": 4.576, "wait_discount": 0.122, "wait_margin": 3.825, "kdef_rounds_from_end": 2, "injury_penalty": 18.031, "rb_early_bonus"
3d0eed5	1876.5	118.9	5.21	0.347	300	discard	auto 1184 screen: {"need_bonus": 34.961, "flex_bonus": 4.352, "depth_quota_wr": 6, "depth_quota_te": 4, "surplus_penalty": 52.081, "bench_bonus": 3.871, "wait_discount": 0.204, "wait_margin": 3.062, "injury_penalty": 14.426, "rb_early_bonus": 7.586, "qb_earliest_round
3d0eed5	1892.7	120.2	4.75	0.429	2700	discard	auto 1185 confirmed: {"need_bonus": 23.837, "flex_bonus": 9.424, "depth_quota_te": 2, "surplus_penalty": 41.013, "bench_bonus": 5.13, "wait_discount": 0.138, "wait_margin": 3.021, "kdef_rounds_from_end": 2, "injury_penalty": 22.149, "rb_early_bonus": 11.217, "te_earliest
3d0eed5	1885.8	118.8	4.91	0.405	2700	discard	auto 1186 confirmed: {"need_bonus": 23.785, "flex_bonus": 6.724, "depth_quota_wr": 4, "surplus_penalty": 25.465, "bench_bonus": 4.866, "wait_discount": 0.197, "wait_margin": 4.408, "injury_penalty": 21.982, "rb_early_bonus": 13.026, "qb_earliest_round": 4, "te_earliest_r
3d0eed5	1877.2	116.5	5.22	0.367	300	discard	auto 1187 screen: {"need_bonus": 18.424, "flex_bonus": 10.207, "depth_quota_rb": 3, "surplus_penalty": 41.762, "bench_bonus": 2.736, "wait_discount": 0.194, "wait_margin": 3.002, "kdef_rounds_from_end": 2, "injury_penalty": 27.021, "rb_early_bonus": 1.774, "qb_earlies
3d0eed5	1888.7	120.4	4.87	0.405	2700	discard	auto 1188 confirmed: {"need_bonus": 15.421, "flex_bonus": 8.855, "depth_quota_rb": 5, "depth_quota_te": 4, "surplus_penalty": 55.998, "bench_bonus": 2.899, "wait_discount": 0.127, "wait_margin": 3.883, "injury_penalty": 22.277, "rb_early_bonus": 7.042, "te_earliest_round
3d0eed5	1883.8	115.3	5.03	0.367	300	discard	auto 1189 screen: {"need_bonus": 45.696, "flex_bonus": 13.16, "depth_quota_rb": 3, "depth_quota_te": 4, "surplus_penalty": 21.47, "bench_bonus": 0.597, "wait_discount": 0.113, "wait_margin": 4.774, "injury_penalty": 24.826, "rb_early_bonus": 11.8, "qb_earliest_round":
3d0eed5	1893.2	118.9	4.74	0.425	2700	discard	auto 1190 confirmed: {"need_bonus": 27.831, "flex_bonus": 8.328, "depth_quota_rb": 3, "depth_quota_wr": 4, "depth_quota_te": 2, "surplus_penalty": 37.564, "bench_bonus": 4.717, "wait_discount": 0.125, "wait_margin": 4.125, "injury_penalty": 24.394, "rb_early_bonus": 7.61
3d0eed5	1880.3	121.7	5.2	0.37	300	discard	auto 1191 screen: {"need_bonus": 26.342, "flex_bonus": 10.553, "depth_quota_rb": 3, "depth_quota_qb": 1, "surplus_penalty": 33.81, "bench_bonus": 8.23, "wait_discount": 0.209, "wait_margin": 3.369, "kdef_rounds_from_end": 2, "injury_penalty": 21.848, "rb_early_bonus":
3d0eed5	1886.0	120.8	4.86	0.404	2700	discard	auto 1192 confirmed: {"need_bonus": 30.749, "flex_bonus": 9.705, "depth_quota_rb": 3, "depth_quota_qb": 3, "surplus_penalty": 50.392, "bench_bonus": 2.127, "wait_discount": 0.12, "wait_margin": 1.852, "injury_penalty": 27.438, "rb_early_bonus": 7.578, "qb_earliest_round"
3d0eed5	1860.4	114.5	5.5	0.307	300	discard	auto 1193 screen: {"need_bonus": 12.414, "flex_bonus": 11.608, "depth_quota_te": 2, "depth_quota_qb": 1, "surplus_penalty": 18.824, "bench_bonus": 4.609, "wait_discount": 0.229, "wait_margin": 2.59, "kdef_rounds_from_end": 2, "injury_penalty": 25.306, "rb_early_bonus"
3d0eed5	1868.6	117.1	5.35	0.35	300	discard	auto 1194 screen: {"need_bonus": 21.218, "flex_bonus": 10.73, "depth_quota_wr": 6, "depth_quota_te": 4, "depth_quota_qb": 3, "surplus_penalty": 38.069, "bench_bonus": 4.058, "wait_discount": 0.123, "wait_margin": 3.502, "injury_penalty": 40.079, "rb_early_bonus": 16.9
3d0eed5	1883.9	122.4	4.99	0.403	300	discard	auto 1195 screen: {"need_bonus": 40.59, "flex_bonus": 8.915, "depth_quota_te": 4, "surplus_penalty": 60.09, "bench_bonus": -0.377, "wait_discount": 0.211, "wait_margin": 3.806, "kdef_rounds_from_end": 2, "injury_penalty": 16.151, "rb_early_bonus": -5.445, "te_earliest
3d0eed5	1886.2	114.0	4.77	0.413	300	discard	auto 1196 screen: {"need_bonus": 34.643, "flex_bonus": 10.224, "depth_quota_te": 4, "depth_quota_qb": 3, "surplus_penalty": 24.199, "bench_bonus": 0.057, "wait_discount": 0.148, "wait_margin": 3.311, "injury_penalty": 31.347, "rb_early_bonus": 5.69, "qb_earliest_round
3d0eed5	1840.4	119.9	6.04	0.287	300	discard	auto 1197 screen: {"need_bonus": 59.89, "flex_bonus": 0.736, "depth_quota_wr": 4, "surplus_penalty": 56.577, "bench_bonus": 6.251, "wait_discount": 0.243, "wait_margin": 2.659, "injury_penalty": 32.947, "rb_early_bonus": 6.586, "te_earliest_round": 3, "avail_sigma": 3
3d0eed5	1886.2	126.0	4.94	0.4	300	discard	auto 1198 screen: {"need_bonus": 29.744, "flex_bonus": 10.215, "depth_quota_rb": 3, "depth_quota_wr": 6, "depth_quota_qb": 3, "surplus_penalty": 49.977, "bench_bonus": 8.386, "wait_discount": 0.134, "wait_margin": 1.61, "injury_penalty": 14.576, "rb_early_bonus": 4.54
3d0eed5	1880.5	119.7	5.04	0.367	300	discard	auto 1199 screen: {"need_bonus": 10.928, "flex_bonus": 12.538, "depth_quota_wr": 4, "depth_quota_qb": 3, "surplus_penalty": 23.481, "bench_bonus": 4.138, "wait_discount": 0.07, "wait_margin": 3.024, "injury_penalty": 34.674, "rb_early_bonus": 4.871, "te_earliest_round
3d0eed5	1887.5	120.5	4.91	0.402	2700	discard	auto 1200 confirmed: {"need_bonus": 41.736, "flex_bonus": 11.378, "depth_quota_rb": 3, "depth_quota_wr": 4, "depth_quota_te": 2, "depth_quota_qb": 3, "surplus_penalty": 33.438, "bench_bonus": 5.06, "wait_discount": 0.095, "wait_margin": 3.929, "kdef_rounds_from_end": 2, 
3d0eed5	1891.8	118.4	4.73	0.423	2700	discard	auto 1201 confirmed: {"need_bonus": 16.144, "flex_bonus": 16.632, "depth_quota_wr": 4, "surplus_penalty": 33.921, "bench_bonus": 4.479, "wait_discount": 0.182, "wait_margin": 2.431, "kdef_rounds_from_end": 2, "injury_penalty": 23.642, "rb_early_bonus": 9.854, "te_earlies
3d0eed5	1891.7	118.0	4.77	0.416	2700	discard	auto 1202 confirmed: {"need_bonus": 29.214, "flex_bonus": 11.218, "depth_quota_rb": 3, "depth_quota_wr": 6, "surplus_penalty": 37.103, "bench_bonus": 4.599, "wait_discount": 0.166, "wait_margin": 3.531, "injury_penalty": 28.175, "rb_early_bonus": 8.731, "qb_earliest_roun
3d0eed5	1889.8	117.9	4.8	0.415	2700	discard	auto 1203 confirmed: {"need_bonus": 36.444, "flex_bonus": 8.893, "depth_quota_wr": 6, "depth_quota_te": 2, "surplus_penalty": 56.204, "bench_bonus": 4.649, "wait_discount": 0.217, "wait_margin": 4.966, "injury_penalty": 29.333, "rb_early_bonus": 8.169, "te_earliest_round
3d0eed5	1883.6	112.5	4.88	0.393	300	discard	auto 1204 screen: {"need_bonus": 39.226, "flex_bonus": 8.452, "depth_quota_rb": 3, "depth_quota_wr": 6, "depth_quota_qb": 3, "surplus_penalty": 4.207, "bench_bonus": 4.729, "wait_discount": 0.151, "wait_margin": 3.165, "kdef_rounds_from_end": 2, "injury_penalty": 21.0
3d0eed5	1886.1	122.4	4.96	0.407	300	discard	auto 1205 screen: {"need_bonus": 31.774, "flex_bonus": 7.517, "depth_quota_rb": 3, "depth_quota_te": 2, "surplus_penalty": 44.383, "bench_bonus": 2.463, "wait_discount": 0.286, "wait_margin": 4.625, "kdef_rounds_from_end": 2, "injury_penalty": 38.814, "rb_early_bonus"
3d0eed5	1864.8	112.6	5.44	0.333	300	discard	auto 1206 screen: {"need_bonus": 38.799, "flex_bonus": 3.628, "depth_quota_rb": 5, "depth_quota_wr": 4, "surplus_penalty": 6.344, "bench_bonus": -0.371, "wait_discount": 0.234, "wait_margin": 1.999, "kdef_rounds_from_end": 2, "injury_penalty": 56.892, "rb_early_bonus"
3d0eed5	1854.8	123.8	5.79	0.323	300	discard	auto 1207 screen: {"need_bonus": 4.388, "flex_bonus": -2.816, "surplus_penalty": 6.218, "bench_bonus": 1.64, "wait_discount": 0.147, "wait_margin": 4.294, "injury_penalty": 16.381, "rb_early_bonus": 19.847, "te_earliest_round": 3, "avail_sigma": 2.838, "avail_strength
3d0eed5	1893.6	118.4	4.75	0.421	2700	discard	auto 1208 confirmed: {"need_bonus": 35.872, "flex_bonus": 10.249, "depth_quota_rb": 3, "depth_quota_wr": 6, "surplus_penalty": 35.331, "bench_bonus": 5.723, "wait_discount": 0.145, "wait_margin": 3.783, "injury_penalty": 22.342, "rb_early_bonus": 9.263, "qb_earliest_roun
3d0eed5	1873.4	125.3	5.19	0.38	300	discard	auto 1209 screen: {"need_bonus": 51.838, "flex_bonus": 5.719, "depth_quota_te": 2, "depth_quota_qb": 3, "surplus_penalty": 30.667, "bench_bonus": 2.936, "wait_discount": 0.266, "wait_margin": 4.211, "injury_penalty": 56.316, "rb_early_bonus": 12.589, "qb_earliest_roun
3d0eed5	1887.1	117.8	4.92	0.393	300	discard	auto 1210 screen: {"need_bonus": 28.53, "flex_bonus": 6.224, "depth_quota_qb": 3, "surplus_penalty": 33.144, "bench_bonus": 2.091, "wait_discount": 0.278, "wait_margin": 2.946, "injury_penalty": 35.245, "rb_early_bonus": 6.298, "qb_earliest_round": 4, "avail_sigma": 4
3d0eed5	1886.5	121.5	4.91	0.406	2700	discard	auto 1211 confirmed: {"need_bonus": 32.201, "flex_bonus": 13.662, "depth_quota_te": 4, "surplus_penalty": 20.431, "bench_bonus": 2.151, "wait_discount": 0.208, "wait_margin": 6.401, "injury_penalty": 23.178, "rb_early_bonus": 2.931, "avail_sigma": 1.702, "avail_strength"
3d0eed5	1887.3	116.0	4.91	0.387	2700	discard	auto 1212 confirmed: {"need_bonus": 23.67, "flex_bonus": 9.177, "depth_quota_wr": 6, "depth_quota_te": 4, "surplus_penalty": 53.303, "bench_bonus": 4.544, "wait_discount": 0.159, "wait_margin": 4.926, "kdef_rounds_from_end": 2, "injury_penalty": 31.147, "rb_early_bonus":
3d0eed5	1879.9	119.0	5.09	0.376	2700	discard	auto 1213 confirmed: {"need_bonus": 24.076, "flex_bonus": 10.01, "depth_quota_rb": 3, "depth_quota_wr": 6, "surplus_penalty": 33.927, "bench_bonus": 4.536, "wait_discount": 0.182, "wait_margin": 3.356, "injury_penalty": 37.506, "rb_early_bonus": 6.574, "qb_earliest_round
3d0eed5	1895.4	121.3	4.69	0.433	2700	discard	auto 1214 confirmed: {"need_bonus": 33.272, "flex_bonus": 15.148, "depth_quota_rb": 3, "depth_quota_wr": 4, "surplus_penalty": 71.061, "bench_bonus": -3.735, "wait_discount": 0.09, "wait_margin": 6.501, "injury_penalty": 33.21, "rb_early_bonus": 12.187, "qb_earliest_roun
3d0eed5	1884.6	122.9	5.03	0.39	300	discard	auto 1215 screen: {"need_bonus": 28.493, "flex_bonus": 1.795, "depth_quota_qb": 1, "surplus_penalty": 23.421, "bench_bonus": 2.827, "wait_discount": 0.253, "wait_margin": 4.229, "injury_penalty": 34.734, "rb_early_bonus": 10.898, "qb_earliest_round": 6, "te_earliest_r
3d0eed5	1887.7	127.1	4.97	0.413	300	discard	auto 1216 screen: {"need_bonus": 31.173, "flex_bonus": 9.118, "depth_quota_qb": 1, "surplus_penalty": 50.37, "bench_bonus": 4.921, "wait_discount": 0.144, "wait_margin": 3.937, "injury_penalty": 24.464, "rb_early_bonus": 15.358, "avail_sigma": 3.888, "avail_strength":
3d0eed5	1886.0	116.7	4.86	0.41	300	discard	auto 1217 screen: {"need_bonus": 59.486, "flex_bonus": 14.478, "depth_quota_rb": 3, "depth_quota_wr": 6, "depth_quota_qb": 1, "surplus_penalty": 29.846, "bench_bonus": 2.255, "wait_discount": 0.19, "wait_margin": 3.426, "injury_penalty": 28.895, "rb_early_bonus": 11.7
3d0eed5	1877.6	115.3	5.14	0.377	300	discard	auto 1218 screen: {"need_bonus": 23.64, "flex_bonus": 12.237, "depth_quota_rb": 3, "depth_quota_wr": 6, "depth_quota_te": 2, "depth_quota_qb": 1, "surplus_penalty": 55.004, "bench_bonus": 2.793, "wait_discount": 0.186, "wait_margin": 2.319, "injury_penalty": 38.543, "
3d0eed5	1848.0	113.2	5.95	0.257	300	discard	auto 1219 screen: {"need_bonus": 50.041, "flex_bonus": 7.313, "depth_quota_wr": 4, "depth_quota_te": 4, "depth_quota_qb": 3, "surplus_penalty": 21.781, "bench_bonus": 2.984, "wait_discount": 0.118, "wait_margin": -0.854, "injury_penalty": 24.841, "rb_early_bonus": 7.3
3d0eed5	1857.5	110.2	5.58	0.283	300	discard	auto 1220 screen: {"need_bonus": -4.691, "flex_bonus": 6.474, "surplus_penalty": 25.76, "bench_bonus": 10.725, "wait_discount": 0.255, "wait_margin": -1.245, "injury_penalty": 70.939, "rb_early_bonus": -0.999, "qb_earliest_round": 6, "avail_sigma": 4.755, "avail_stren
3d0eed5	1887.3	125.3	5.07	0.41	300	discard	auto 1221 screen: {"need_bonus": 32.656, "flex_bonus": 1.828, "depth_quota_rb": 3, "surplus_penalty": 12.884, "bench_bonus": 1.777, "wait_discount": 0.22, "wait_margin": 6.826, "kdef_rounds_from_end": 2, "injury_penalty": 18.341, "rb_early_bonus": 7.697, "qb_earliest_
3d0eed5	1883.4	118.3	4.97	0.423	300	discard	auto 1222 screen: {"need_bonus": 25.373, "flex_bonus": 12.767, "depth_quota_wr": 6, "depth_quota_qb": 3, "surplus_penalty": 26.273, "bench_bonus": 6.386, "wait_discount": 0.098, "wait_margin": 3.021, "kdef_rounds_from_end": 2, "injury_penalty": 32.092, "rb_early_bonus
3d0eed5	1882.1	115.4	4.98	0.389	2700	discard	auto 1223 confirmed: {"need_bonus": 23.415, "flex_bonus": 8.432, "depth_quota_wr": 4, "depth_quota_te": 2, "depth_quota_qb": 1, "surplus_penalty": 31.363, "bench_bonus": 4.319, "wait_discount": 0.113, "wait_margin": 2.167, "injury_penalty": 35.539, "rb_early_bonus": 6.62
3d0eed5	1877.1	127.0	5.26	0.403	300	discard	auto 1224 screen: {"need_bonus": 28.392, "flex_bonus": 10.532, "depth_quota_wr": 4, "depth_quota_te": 4, "depth_quota_qb": 1, "surplus_penalty": 32.594, "bench_bonus": 3.589, "wait_margin": 2.867, "injury_penalty": 31.542, "rb_early_bonus": 10.024, "avail_sigma": -0.5
3d0eed5	1886.9	112.5	4.89	0.373	300	discard	auto 1225 screen: {"need_bonus": 28.655, "flex_bonus": 11.129, "depth_quota_wr": 4, "depth_quota_te": 4, "surplus_penalty": 39.35, "bench_bonus": 4.461, "wait_discount": 0.169, "wait_margin": 3.518, "injury_penalty": 25.33, "rb_early_bonus": 8.31, "te_earliest_round":
3d0eed5	1871.3	119.2	5.3	0.363	300	discard	auto 1226 screen: {"need_bonus": -4.984, "flex_bonus": 10.5, "depth_quota_rb": 3, "depth_quota_te": 4, "depth_quota_qb": 1, "surplus_penalty": 53.293, "bench_bonus": 7.464, "wait_discount": 0.072, "wait_margin": 7.085, "injury_penalty": 10.069, "rb_early_bonus": 13.01
3d0eed5	1884.5	121.5	4.99	0.39	300	discard	auto 1227 screen: {"need_bonus": 22.936, "flex_bonus": 11.451, "depth_quota_wr": 6, "depth_quota_te": 4, "surplus_penalty": 40.513, "bench_bonus": 5.214, "wait_discount": 0.184, "wait_margin": 3.841, "kdef_rounds_from_end": 2, "injury_penalty": 21.152, "rb_early_bonus
3d0eed5	1878.9	118.2	5.2	0.363	300	discard	auto 1228 screen: {"need_bonus": 52.624, "flex_bonus": -0.916, "depth_quota_rb": 3, "depth_quota_wr": 6, "surplus_penalty": 55.319, "bench_bonus": 7.764, "wait_discount": 0.206, "wait_margin": 2.718, "kdef_rounds_from_end": 2, "injury_penalty": 9.94, "rb_early_bonus":
3d0eed5	1870.0	114.7	5.2	0.373	300	discard	auto 1229 screen: {"need_bonus": -5.289, "flex_bonus": 17.067, "depth_quota_te": 2, "surplus_penalty": 31.388, "bench_bonus": -0.392, "wait_discount": 0.157, "wait_margin": 3.589, "injury_penalty": 25.867, "rb_early_bonus": 6.31, "qb_earliest_round": 6, "te_earliest_r
3d0eed5	1881.1	115.3	5.1	0.373	300	discard	auto 1230 screen: {"need_bonus": 37.493, "flex_bonus": 0.212, "depth_quota_rb": 3, "depth_quota_wr": 4, "surplus_penalty": 74.501, "bench_bonus": 1.844, "wait_discount": 0.096, "wait_margin": 2.999, "injury_penalty": 4.083, "rb_early_bonus": 13.767, "avail_sigma": 3.7
3d0eed5	1887.6	120.2	4.87	0.403	300	discard	auto 1231 screen: {"need_bonus": 21.358, "flex_bonus": 3.486, "depth_quota_wr": 4, "depth_quota_te": 4, "surplus_penalty": 32.017, "bench_bonus": 8.078, "wait_discount": 0.202, "wait_margin": 4.679, "injury_penalty": 38.68, "rb_early_bonus": 13.206, "avail_sigma": 5.4
3d0eed5	1883.1	118.0	5.04	0.387	2700	discard	auto 1232 confirmed: {"need_bonus": 35.531, "flex_bonus": 9.076, "depth_quota_rb": 5, "depth_quota_qb": 1, "surplus_penalty": 14.45, "bench_bonus": 4.35, "wait_discount": 0.191, "wait_margin": 2.955, "injury_penalty": 39.179, "rb_early_bonus": 5.188, "te_earliest_round":
3d0eed5	1858.8	116.7	5.61	0.337	300	discard	auto 1233 screen: {"need_bonus": 2.574, "flex_bonus": 12.656, "depth_quota_qb": 3, "surplus_penalty": 50.99, "bench_bonus": 3.271, "wait_discount": 0.206, "wait_margin": 2.052, "injury_penalty": 28.592, "rb_early_bonus": 20.304, "qb_earliest_round": 6, "avail_sigma": 
3d0eed5	1890.0	118.9	4.82	0.42	2700	discard	auto 1234 confirmed: {"need_bonus": 36.692, "flex_bonus": 13.255, "depth_quota_rb": 5, "depth_quota_te": 4, "depth_quota_qb": 3, "surplus_penalty": 21.512, "bench_bonus": 4.096, "wait_discount": 0.107, "wait_margin": 4.426, "injury_penalty": 40.261, "rb_early_bonus": 14.
3d0eed5	1895.4	116.9	4.65	0.435	2700	discard	auto 1235 confirmed: {"need_bonus": 32.87, "flex_bonus": 7.507, "depth_quota_rb": 3, "depth_quota_te": 4, "surplus_penalty": 30.124, "bench_bonus": 4.272, "wait_discount": 0.158, "wait_margin": 4.008, "injury_penalty": 24.771, "rb_early_bonus": 11.109, "te_earliest_round
