commit	score	score_std	mean_rank	p_top3	n_sims	status	description
3d0eed5	1888.0	120.7	4.93	0.4	2700	discard	auto 766 confirmed: {"need_bonus": 31.643, "flex_bonus": 10.281, "depth_quota_rb": 3, "depth_quota_te": 2, "surplus_penalty": 35.752, "bench_bonus": 5.532, "wait_discount": 0.205, "wait_margin": 4.016, "kdef_rounds_from_end": 2, "injury_penalty": 20.702, "rb_early_bonus
3d0eed5	1886.1	119.7	4.94	0.397	2700	discard	auto 767 confirmed: {"need_bonus": 25.175, "flex_bonus": 7.339, "depth_quota_rb": 5, "depth_quota_wr": 6, "depth_quota_te": 4, "surplus_penalty": 44.153, "bench_bonus": 4.048, "wait_discount": 0.061, "wait_margin": 6.113, "kdef_rounds_from_end": 2, "injury_penalty": 26.
3d0eed5	1883.4	115.2	4.9	0.393	300	discard	auto 768 screen: {"need_bonus": 33.468, "flex_bonus": 11.945, "depth_quota_rb": 5, "depth_quota_te": 2, "depth_quota_qb": 1, "surplus_penalty": 23.917, "bench_bonus": 2.592, "wait_discount": 0.215, "wait_margin": 4.824, "injury_penalty": 25.554, "rb_early_bonus": 3.6
3d0eed5	1878.4	113.8	5.05	0.357	300	discard	auto 769 screen: {"need_bonus": 7.458, "flex_bonus": 17.633, "depth_quota_wr": 6, "depth_quota_qb": 3, "surplus_penalty": 60.891, "bench_bonus": -2.447, "wait_discount": 0.152, "wait_margin": 4.202, "kdef_rounds_from_end": 2, "injury_penalty": 17.442, "rb_early_bonus
3d0eed5	1887.2	110.9	4.85	0.397	300	discard	auto 770 screen: {"need_bonus": 34.516, "flex_bonus": 11.436, "depth_quota_rb": 3, "depth_quota_wr": 4, "depth_quota_te": 4, "surplus_penalty": 52.537, "bench_bonus": 5.566, "wait_discount": 0.192, "wait_margin": 4.148, "injury_penalty": 20.726, "rb_early_bonus": 0.1
3d0eed5	1889.2	121.2	4.87	0.411	2700	discard	auto 771 confirmed: {"need_bonus": 39.034, "flex_bonus": 9.881, "depth_quota_te": 2, "surplus_penalty": 45.468, "bench_bonus": 5.979, "wait_discount": 0.198, "wait_margin": 3.484, "injury_penalty": 20.093, "rb_early_bonus": 15.731, "qb_earliest_round": 6, "avail_sigma":
3d0eed5	1895.1	117.8	4.67	0.436	2700	discard	auto 772 confirmed: {"need_bonus": 33.6, "flex_bonus": 11.214, "surplus_penalty": 40.982, "bench_bonus": 4.789, "wait_discount": 0.202, "wait_margin": 4.576, "injury_penalty": 24.6, "rb_early_bonus": 11.916, "te_earliest_round": 3, "avail_sigma": 4.379, "avail_strength"
3d0eed5	1882.6	122.0	5.02	0.403	300	discard	auto 773 screen: {"need_bonus": 33.577, "flex_bonus": 13.067, "depth_quota_wr": 6, "depth_quota_qb": 1, "surplus_penalty": 13.908, "bench_bonus": 3.776, "wait_discount": 0.204, "wait_margin": 3.02, "injury_penalty": 26.691, "rb_early_bonus": 4.817, "te_earliest_round
3d0eed5	1887.0	118.9	4.9	0.406	2700	discard	auto 774 confirmed: {"need_bonus": 40.753, "flex_bonus": 2.963, "depth_quota_rb": 3, "depth_quota_wr": 6, "surplus_penalty": 47.817, "bench_bonus": 4.868, "wait_discount": 0.179, "wait_margin": 2.964, "injury_penalty": 27.213, "rb_early_bonus": 3.977, "qb_earliest_round
3d0eed5	1892.3	119.8	4.75	0.422	2700	discard	auto 775 confirmed: {"need_bonus": 24.161, "flex_bonus": 10.066, "depth_quota_wr": 6, "depth_quota_qb": 3, "surplus_penalty": 27.261, "bench_bonus": 5.368, "wait_discount": 0.168, "wait_margin": 3.938, "injury_penalty": 29.779, "rb_early_bonus": 8.023, "te_earliest_roun
3d0eed5	1859.8	114.8	5.53	0.31	300	discard	auto 776 screen: {"need_bonus": 3.296, "flex_bonus": 14.972, "depth_quota_rb": 5, "depth_quota_wr": 6, "depth_quota_te": 2, "depth_quota_qb": 1, "surplus_penalty": 44.882, "bench_bonus": 4.879, "wait_discount": 0.16, "wait_margin": 3.488, "kdef_rounds_from_end": 2, "
3d0eed5	1891.3	117.1	4.82	0.41	2700	discard	auto 777 confirmed: {"need_bonus": 28.053, "flex_bonus": 17.581, "depth_quota_rb": 3, "depth_quota_te": 2, "surplus_penalty": 34.024, "bench_bonus": 5.696, "wait_discount": 0.235, "wait_margin": 6.095, "injury_penalty": 35.441, "rb_early_bonus": 9.503, "qb_earliest_roun
3d0eed5	1878.2	109.6	5.14	0.377	300	discard	auto 778 screen: {"need_bonus": 28.621, "flex_bonus": 9.936, "depth_quota_rb": 3, "depth_quota_wr": 6, "depth_quota_qb": 1, "surplus_penalty": 40.504, "bench_bonus": 3.978, "wait_discount": 0.128, "wait_margin": 4.385, "injury_penalty": 19.021, "rb_early_bonus": 8.71
3d0eed5	1891.6	119.3	4.8	0.412	2700	discard	auto 779 confirmed: {"need_bonus": 36.969, "flex_bonus": 10.449, "depth_quota_rb": 5, "depth_quota_wr": 4, "depth_quota_te": 4, "surplus_penalty": 36.88, "bench_bonus": 4.119, "wait_discount": 0.194, "wait_margin": 4.146, "injury_penalty": 23.506, "rb_early_bonus": 11.8
3d0eed5	1880.4	119.8	4.95	0.36	300	discard	auto 780 screen: {"need_bonus": 18.96, "flex_bonus": 1.998, "depth_quota_rb": 5, "depth_quota_te": 4, "depth_quota_qb": 1, "surplus_penalty": 27.451, "bench_bonus": 3.674, "wait_discount": 0.14, "wait_margin": 4.487, "injury_penalty": 27.61, "rb_early_bonus": 6.845, 
3d0eed5	1885.8	119.3	4.96	0.4	300	discard	auto 781 screen: {"need_bonus": 27.147, "flex_bonus": 8.506, "depth_quota_rb": 5, "depth_quota_wr": 4, "surplus_penalty": 35.703, "bench_bonus": 3.737, "wait_discount": 0.175, "wait_margin": 3.797, "kdef_rounds_from_end": 2, "injury_penalty": 29.706, "rb_early_bonus"
3d0eed5	1846.3	119.5	5.92	0.297	300	discard	auto 782 screen: {"need_bonus": -4.942, "flex_bonus": 13.761, "depth_quota_wr": 4, "depth_quota_te": 4, "depth_quota_qb": 3, "surplus_penalty": 70.439, "bench_bonus": 4.707, "wait_discount": 0.104, "wait_margin": 5.451, "injury_penalty": 48.599, "rb_early_bonus": 15.
3d0eed5	1883.7	119.4	4.99	0.38	300	discard	auto 783 screen: {"need_bonus": 33.459, "flex_bonus": 5.716, "depth_quota_wr": 4, "depth_quota_te": 2, "surplus_penalty": 20.503, "bench_bonus": 5.465, "wait_discount": 0.191, "wait_margin": 3.828, "injury_penalty": 23.675, "rb_early_bonus": 4.18, "qb_earliest_round"
3d0eed5	1879.8	112.4	4.99	0.35	300	discard	auto 784 screen: {"need_bonus": 9.471, "flex_bonus": 6.11, "depth_quota_rb": 3, "depth_quota_te": 2, "surplus_penalty": 46.422, "bench_bonus": -1.817, "wait_discount": 0.206, "wait_margin": 4.875, "kdef_rounds_from_end": 2, "injury_penalty": 13.527, "rb_early_bonus":
3d0eed5	1891.3	118.4	4.79	0.423	2700	discard	auto 785 confirmed: {"need_bonus": 46.49, "flex_bonus": 8.718, "depth_quota_rb": 5, "depth_quota_te": 4, "surplus_penalty": 24.916, "bench_bonus": 5.635, "wait_discount": 0.176, "wait_margin": 3.543, "injury_penalty": 7.659, "rb_early_bonus": 13.372, "qb_earliest_round"
3d0eed5	1876.7	119.8	5.09	0.397	300	discard	auto 786 screen: {"need_bonus": 30.613, "flex_bonus": 6.228, "depth_quota_rb": 3, "depth_quota_qb": 1, "surplus_penalty": 37.171, "bench_bonus": 2.535, "wait_discount": 0.263, "wait_margin": 5.807, "kdef_rounds_from_end": 2, "injury_penalty": 22.547, "rb_early_bonus"
3d0eed5	1874.1	116.6	5.14	0.387	300	discard	auto 787 screen: {"need_bonus": 33.313, "flex_bonus": 12.183, "depth_quota_wr": 6, "depth_quota_te": 2, "depth_quota_qb": 1, "surplus_penalty": 36.066, "bench_bonus": 3.996, "wait_discount": 0.138, "wait_margin": 4.807, "kdef_rounds_from_end": 2, "injury_penalty": 27
3d0eed5	1885.3	120.8	4.95	0.367	300	discard	auto 788 screen: {"need_bonus": 24.486, "flex_bonus": -1.909, "depth_quota_rb": 3, "depth_quota_te": 4, "depth_quota_qb": 3, "surplus_penalty": 6.599, "bench_bonus": 6.539, "wait_discount": 0.142, "wait_margin": 7.479, "injury_penalty": 20.437, "rb_early_bonus": 5.46
3d0eed5	1886.2	118.1	4.9	0.417	300	discard	auto 789 screen: {"need_bonus": 24.101, "flex_bonus": 14.78, "depth_quota_rb": 5, "depth_quota_wr": 4, "surplus_penalty": 36.078, "bench_bonus": 1.791, "wait_discount": 0.17, "wait_margin": 3.536, "injury_penalty": 26.655, "rb_early_bonus": 9.603, "qb_earliest_round"
3d0eed5	1895.6	119.9	4.68	0.436	2700	discard	auto 790 confirmed: {"need_bonus": 33.226, "flex_bonus": 8.841, "depth_quota_wr": 4, "surplus_penalty": 40.962, "bench_bonus": 4.195, "wait_discount": 0.169, "wait_margin": 3.333, "injury_penalty": 28.781, "rb_early_bonus": 9.564, "avail_sigma": 5.657, "avail_strength":
3d0eed5	1866.6	115.0	5.48	0.34	300	discard	auto 791 screen: {"need_bonus": 10.331, "flex_bonus": 14.696, "depth_quota_wr": 6, "depth_quota_te": 4, "depth_quota_qb": 1, "surplus_penalty": 26.931, "bench_bonus": 4.491, "wait_discount": 0.173, "wait_margin": 2.704, "injury_penalty": 15.708, "rb_early_bonus": 11.
3d0eed5	1886.8	126.5	4.98	0.417	300	discard	auto 792 screen: {"need_bonus": 24.163, "flex_bonus": 12.266, "depth_quota_rb": 5, "depth_quota_te": 2, "depth_quota_qb": 3, "surplus_penalty": -34.107, "bench_bonus": 3.717, "wait_discount": 0.358, "wait_margin": 5.52, "injury_penalty": 54.226, "rb_early_bonus": 12.
3d0eed5	1890.3	121.2	4.75	0.421	2700	discard	auto 793 confirmed: {"need_bonus": 29.725, "flex_bonus": 16.658, "depth_quota_rb": 3, "depth_quota_qb": 3, "surplus_penalty": 37.394, "bench_bonus": 2.324, "wait_discount": 0.144, "wait_margin": 3.692, "injury_penalty": 34.389, "rb_early_bonus": 9.866, "te_earliest_roun
3d0eed5	1890.2	119.0	4.81	0.412	2700	discard	auto 794 confirmed: {"need_bonus": 30.0, "flex_bonus": 10.983, "depth_quota_rb": 5, "depth_quota_wr": 4, "depth_quota_te": 2, "surplus_penalty": 40.181, "bench_bonus": 4.617, "wait_discount": 0.183, "wait_margin": 3.719, "injury_penalty": 21.437, "rb_early_bonus": 9.475
3d0eed5	1890.9	118.5	4.8	0.409	2700	discard	auto 795 confirmed: {"need_bonus": 31.802, "flex_bonus": 8.371, "depth_quota_te": 2, "surplus_penalty": 43.643, "bench_bonus": -0.3, "wait_discount": 0.179, "wait_margin": 3.937, "injury_penalty": 34.478, "rb_early_bonus": 10.612, "qb_earliest_round": 4, "te_earliest_ro
3d0eed5	1893.7	117.0	4.71	0.426	2700	discard	auto 796 confirmed: {"need_bonus": 31.798, "flex_bonus": 9.297, "depth_quota_te": 4, "surplus_penalty": 35.038, "bench_bonus": 4.571, "wait_discount": 0.148, "wait_margin": 5.043, "injury_penalty": 27.497, "rb_early_bonus": 8.017, "avail_sigma": 4.034, "avail_strength":
3d0eed5	1889.7	117.4	4.86	0.399	2700	discard	auto 797 confirmed: {"need_bonus": 25.405, "flex_bonus": 11.441, "depth_quota_rb": 3, "depth_quota_wr": 6, "depth_quota_te": 2, "surplus_penalty": 49.984, "bench_bonus": 4.999, "wait_discount": 0.188, "wait_margin": 5.016, "kdef_rounds_from_end": 2, "injury_penalty": 27
3d0eed5	1888.3	120.5	4.87	0.413	2700	discard	auto 798 confirmed: {"need_bonus": 47.468, "flex_bonus": 12.231, "depth_quota_qb": 3, "surplus_penalty": 43.257, "bench_bonus": 6.296, "wait_discount": 0.15, "wait_margin": 5.116, "injury_penalty": 33.012, "rb_early_bonus": 13.864, "qb_earliest_round": 6, "avail_sigma":
3d0eed5	1885.1	124.7	5.0	0.387	300	discard	auto 799 screen: {"need_bonus": 17.454, "flex_bonus": 13.766, "depth_quota_wr": 4, "depth_quota_te": 4, "surplus_penalty": 19.831, "bench_bonus": 4.684, "wait_discount": 0.194, "wait_margin": 4.551, "injury_penalty": 33.825, "rb_early_bonus": 11.925, "avail_sigma": 6
3d0eed5	1884.4	123.7	5.08	0.403	300	discard	auto 800 screen: {"need_bonus": 30.76, "flex_bonus": -0.731, "surplus_penalty": 51.986, "bench_bonus": 1.086, "wait_discount": -0.129, "wait_margin": 6.531, "injury_penalty": -7.594, "rb_early_bonus": 5.251, "avail_sigma": 6.977, "avail_strength": 0.591, "cliff_gap":
3d0eed5	1883.9	117.3	4.97	0.403	300	discard	auto 801 screen: {"need_bonus": 35.645, "flex_bonus": 10.584, "depth_quota_rb": 3, "depth_quota_wr": 6, "depth_quota_te": 4, "depth_quota_qb": 1, "surplus_penalty": 30.318, "bench_bonus": 5.126, "wait_discount": 0.159, "wait_margin": 3.61, "injury_penalty": 20.045, "
3d0eed5	1885.7	119.2	4.97	0.379	2700	discard	auto 802 confirmed: {"need_bonus": 37.154, "flex_bonus": 11.302, "depth_quota_rb": 3, "depth_quota_wr": 4, "depth_quota_te": 2, "surplus_penalty": 34.317, "bench_bonus": 1.68, "wait_discount": 0.168, "wait_margin": 2.272, "kdef_rounds_from_end": 2, "injury_penalty": 9.3
3d0eed5	1892.2	117.9	4.82	0.412	2700	discard	auto 803 confirmed: {"need_bonus": 22.925, "flex_bonus": 8.023, "depth_quota_rb": 3, "depth_quota_te": 2, "surplus_penalty": 37.146, "bench_bonus": 5.052, "wait_discount": 0.213, "wait_margin": 4.937, "injury_penalty": 13.679, "rb_early_bonus": 13.198, "te_earliest_roun
3d0eed5	1893.1	120.4	4.75	0.425	2700	discard	auto 804 confirmed: {"need_bonus": 16.727, "flex_bonus": 7.216, "depth_quota_wr": 4, "surplus_penalty": 44.836, "bench_bonus": 4.452, "wait_discount": 0.158, "wait_margin": 5.573, "injury_penalty": 24.566, "rb_early_bonus": 7.835, "te_earliest_round": 3, "avail_sigma": 
3d0eed5	1891.1	122.2	4.84	0.421	2700	discard	auto 805 confirmed: {"need_bonus": 28.545, "flex_bonus": 11.451, "depth_quota_wr": 4, "depth_quota_te": 4, "depth_quota_qb": 3, "surplus_penalty": 40.393, "bench_bonus": 5.724, "wait_discount": 0.164, "wait_margin": 4.874, "injury_penalty": 27.574, "rb_early_bonus": 9.6
3d0eed5	1862.9	113.9	5.64	0.273	300	discard	auto 806 screen: {"need_bonus": 37.238, "flex_bonus": 10.167, "depth_quota_rb": 5, "depth_quota_te": 2, "depth_quota_qb": 1, "surplus_penalty": 29.537, "bench_bonus": 2.273, "wait_discount": 0.285, "wait_margin": 4.085, "injury_penalty": 50.763, "rb_early_bonus": 10.
3d0eed5	1891.6	121.3	4.83	0.416	2700	discard	auto 807 confirmed: {"need_bonus": 41.207, "flex_bonus": 10.577, "depth_quota_wr": 4, "surplus_penalty": 68.106, "bench_bonus": 2.841, "wait_discount": 0.094, "wait_margin": 6.219, "injury_penalty": 29.903, "rb_early_bonus": 14.608, "qb_earliest_round": 6, "avail_sigma"
3d0eed5	1887.8	116.2	4.83	0.397	300	discard	auto 808 screen: {"need_bonus": 26.533, "flex_bonus": 12.531, "depth_quota_wr": 4, "surplus_penalty": 47.01, "bench_bonus": 3.654, "wait_discount": 0.175, "wait_margin": 1.952, "injury_penalty": 23.525, "rb_early_bonus": 4.013, "qb_earliest_round": 4, "avail_sigma": 
3d0eed5	1861.9	119.5	5.6	0.313	300	discard	auto 809 screen: {"need_bonus": 64.612, "flex_bonus": 8.311, "depth_quota_te": 2, "surplus_penalty": 23.041, "bench_bonus": 5.044, "wait_discount": 0.09, "wait_margin": 4.981, "injury_penalty": -11.64, "rb_early_bonus": 10.366, "qb_earliest_round": 4, "avail_sigma": 
3d0eed5	1888.2	118.9	4.84	0.407	2700	discard	auto 810 confirmed: {"need_bonus": 36.512, "flex_bonus": 10.854, "depth_quota_rb": 5, "surplus_penalty": 14.464, "bench_bonus": 3.46, "wait_margin": 3.389, "injury_penalty": 37.958, "rb_early_bonus": 12.229, "avail_sigma": 5.199, "avail_strength": 0.166, "cliff_gap": 7.
3d0eed5	1891.1	117.0	4.77	0.426	2700	discard	auto 811 confirmed: {"need_bonus": 8.855, "flex_bonus": 22.647, "depth_quota_te": 2, "surplus_penalty": 36.889, "bench_bonus": 4.716, "wait_discount": 0.244, "wait_margin": 5.564, "kdef_rounds_from_end": 2, "injury_penalty": -28.104, "rb_early_bonus": -0.303, "qb_earlie
3d0eed5	1870.7	119.0	5.32	0.36	300	discard	auto 812 screen: {"need_bonus": 48.373, "flex_bonus": 6.922, "depth_quota_te": 4, "depth_quota_qb": 3, "surplus_penalty": 39.355, "bench_bonus": 3.922, "wait_discount": 0.191, "wait_margin": 3.201, "injury_penalty": 29.217, "rb_early_bonus": 15.215, "avail_sigma": 1.
3d0eed5	1895.2	118.2	4.7	0.435	2700	discard	auto 813 confirmed: {"need_bonus": 31.634, "flex_bonus": 10.835, "depth_quota_qb": 3, "surplus_penalty": 38.875, "bench_bonus": 4.737, "wait_discount": 0.168, "wait_margin": 3.966, "kdef_rounds_from_end": 2, "injury_penalty": 12.786, "rb_early_bonus": 10.333, "te_earlie
3d0eed5	1892.8	120.6	4.78	0.423	2700	discard	auto 814 confirmed: {"need_bonus": 26.291, "flex_bonus": 7.507, "depth_quota_rb": 3, "depth_quota_wr": 4, "depth_quota_te": 2, "surplus_penalty": 38.581, "bench_bonus": 4.549, "wait_discount": 0.144, "wait_margin": 3.516, "injury_penalty": 28.594, "rb_early_bonus": 8.56
3d0eed5	1887.8	129.3	4.95	0.42	300	discard	auto 815 screen: {"need_bonus": 36.609, "flex_bonus": 9.817, "depth_quota_wr": 6, "depth_quota_qb": 1, "surplus_penalty": 33.59, "bench_bonus": 6.143, "wait_discount": 0.145, "wait_margin": 5.524, "injury_penalty": 30.053, "rb_early_bonus": 12.567, "qb_earliest_round
3d0eed5	1890.8	121.3	4.79	0.418	2700	discard	auto 816 confirmed: {"need_bonus": 30.054, "flex_bonus": 11.944, "depth_quota_wr": 6, "depth_quota_te": 4, "depth_quota_qb": 3, "surplus_penalty": 34.926, "bench_bonus": 5.949, "wait_discount": 0.173, "wait_margin": 4.19, "injury_penalty": 21.259, "rb_early_bonus": 6.30
3d0eed5	1881.1	118.8	5.06	0.373	300	discard	auto 817 screen: {"need_bonus": 24.695, "flex_bonus": 5.172, "depth_quota_rb": 5, "surplus_penalty": 62.207, "bench_bonus": 5.816, "wait_discount": 0.155, "wait_margin": 3.111, "kdef_rounds_from_end": 2, "injury_penalty": 19.691, "rb_early_bonus": 6.6, "qb_earliest_r
3d0eed5	1889.3	119.2	4.87	0.41	2700	discard	auto 818 confirmed: {"need_bonus": 26.554, "flex_bonus": 9.927, "surplus_penalty": 57.624, "bench_bonus": 1.308, "wait_discount": 0.106, "wait_margin": 4.931, "injury_penalty": 31.383, "rb_early_bonus": 14.66, "avail_sigma": 2.219, "avail_strength": 0.392, "cliff_gap": 
3d0eed5	1879.8	119.8	5.05	0.35	300	discard	auto 819 screen: {"need_bonus": 45.328, "flex_bonus": 5.466, "depth_quota_rb": 5, "depth_quota_wr": 4, "depth_quota_te": 4, "surplus_penalty": 31.973, "bench_bonus": 2.347, "wait_discount": 0.153, "wait_margin": 4.466, "injury_penalty": 6.907, "rb_early_bonus": 9.741
3d0eed5	1897.3	117.9	4.61	0.445	2700	discard	auto 820 confirmed: {"need_bonus": 30.389, "flex_bonus": 8.898, "surplus_penalty": 41.812, "bench_bonus": 4.289, "wait_discount": 0.171, "wait_margin": 4.326, "injury_penalty": 20.677, "rb_early_bonus": 7.841, "qb_earliest_round": 6, "avail_sigma": 4.606, "avail_strengt
3d0eed5	1864.8	116.7	5.49	0.333	300	discard	auto 821 screen: {"need_bonus": 4.758, "flex_bonus": 14.021, "depth_quota_rb": 5, "depth_quota_te": 4, "depth_quota_qb": 1, "surplus_penalty": 34.689, "bench_bonus": 3.592, "wait_discount": 0.105, "wait_margin": 5.998, "kdef_rounds_from_end": 2, "injury_penalty": 42.
3d0eed5	1894.8	117.8	4.69	0.427	2700	discard	auto 822 confirmed: {"need_bonus": 14.407, "flex_bonus": 26.295, "depth_quota_rb": 3, "depth_quota_wr": 4, "surplus_penalty": 39.451, "bench_bonus": 5.232, "wait_discount": 0.151, "wait_margin": 3.652, "injury_penalty": 26.996, "rb_early_bonus": 4.695, "avail_sigma": 9.
3d0eed5	1893.5	118.5	4.67	0.435	2700	discard	auto 823 confirmed: {"need_bonus": 34.056, "flex_bonus": 10.077, "depth_quota_qb": 3, "surplus_penalty": 38.401, "bench_bonus": 3.423, "wait_discount": 0.164, "wait_margin": 4.074, "injury_penalty": 22.809, "rb_early_bonus": 8.846, "qb_earliest_round": 6, "te_earliest_r
3d0eed5	1881.4	109.5	5.07	0.37	300	discard	auto 824 screen: {"need_bonus": 33.011, "flex_bonus": 9.964, "depth_quota_rb": 3, "depth_quota_te": 2, "depth_quota_qb": 3, "surplus_penalty": 34.549, "bench_bonus": 5.076, "wait_discount": 0.157, "wait_margin": 3.767, "injury_penalty": 27.418, "rb_early_bonus": 7.98
3d0eed5	1871.3	114.5	5.29	0.37	300	discard	auto 825 screen: {"need_bonus": 18.004, "flex_bonus": 9.704, "surplus_penalty": 30.835, "bench_bonus": 6.871, "wait_discount": 0.197, "wait_margin": 1.811, "injury_penalty": 33.483, "rb_early_bonus": 12.295, "avail_sigma": 3.629, "avail_strength": 0.303, "cliff_gap":
3d0eed5	1883.5	115.0	4.95	0.38	300	discard	auto 826 screen: {"need_bonus": 37.471, "flex_bonus": 9.093, "depth_quota_rb": 5, "depth_quota_wr": 6, "depth_quota_te": 4, "depth_quota_qb": 3, "surplus_penalty": 34.054, "bench_bonus": 7.356, "wait_discount": 0.216, "wait_margin": 4.024, "injury_penalty": 42.668, "
3d0eed5	1872.7	125.4	5.41	0.357	300	discard	auto 827 screen: {"need_bonus": 14.509, "flex_bonus": 18.167, "depth_quota_rb": 5, "surplus_penalty": 55.929, "bench_bonus": 5.86, "wait_discount": 0.182, "wait_margin": 2.738, "injury_penalty": 36.18, "rb_early_bonus": 19.073, "qb_earliest_round": 4, "avail_sigma": 
3d0eed5	1879.0	115.9	4.93	0.403	300	discard	auto 828 screen: {"need_bonus": 30.422, "flex_bonus": 8.627, "depth_quota_rb": 3, "depth_quota_wr": 4, "depth_quota_te": 2, "depth_quota_qb": 1, "surplus_penalty": 23.541, "bench_bonus": 5.156, "wait_discount": 0.171, "wait_margin": 4.654, "injury_penalty": 27.354, "
3d0eed5	1873.2	110.9	5.13	0.36	300	discard	auto 829 screen: {"need_bonus": 26.018, "flex_bonus": 9.505, "depth_quota_wr": 6, "surplus_penalty": 56.474, "bench_bonus": 2.717, "wait_discount": 0.227, "wait_margin": -1.219, "injury_penalty": 18.559, "rb_early_bonus": 5.342, "qb_earliest_round": 6, "te_earliest_r
3d0eed5	1885.8	124.1	5.01	0.4	300	discard	auto 830 screen: {"need_bonus": 56.12, "flex_bonus": 12.051, "depth_quota_rb": 5, "depth_quota_te": 2, "depth_quota_qb": 3, "surplus_penalty": 61.178, "bench_bonus": 3.761, "wait_discount": 0.116, "wait_margin": 10.643, "injury_penalty": 26.545, "rb_early_bonus": 6.1
3d0eed5	1887.8	120.1	4.89	0.408	2700	discard	auto 831 confirmed: {"need_bonus": 27.234, "flex_bonus": 7.667, "depth_quota_rb": 3, "depth_quota_wr": 4, "depth_quota_te": 2, "surplus_penalty": 29.435, "bench_bonus": 3.646, "wait_discount": 0.182, "wait_margin": 5.413, "injury_penalty": 27.578, "rb_early_bonus": 10.6
3d0eed5	1876.3	117.6	5.23	0.34	300	discard	auto 832 screen: {"need_bonus": 34.442, "flex_bonus": 10.263, "depth_quota_te": 4, "surplus_penalty": 40.84, "bench_bonus": 2.766, "wait_discount": 0.157, "wait_margin": 4.002, "injury_penalty": 26.598, "rb_early_bonus": 10.213, "avail_sigma": 4.241, "avail_strength"
3d0eed5	1881.5	117.1	4.96	0.423	300	discard	auto 833 screen: {"need_bonus": 56.504, "flex_bonus": 23.442, "depth_quota_rb": 3, "depth_quota_wr": 6, "depth_quota_te": 2, "depth_quota_qb": 3, "surplus_penalty": -5.593, "bench_bonus": 9.428, "wait_discount": 0.274, "wait_margin": 0.901, "injury_penalty": 33.872, 
3d0eed5	1895.9	120.7	4.66	0.434	2700	discard	auto 834 confirmed: {"need_bonus": 34.23, "flex_bonus": 8.417, "depth_quota_rb": 5, "depth_quota_te": 2, "depth_quota_qb": 3, "surplus_penalty": 13.886, "bench_bonus": 3.81, "wait_discount": 0.252, "wait_margin": 3.135, "injury_penalty": 33.727, "rb_early_bonus": 10.526
