commit	score	score_std	mean_rank	p_top3	n_sims	status	description
a42634f	1862.3	112.9	5.43	0.297	300	discard	auto 419 screen: {"need_bonus": 35.884, "flex_bonus": 15.597, "depth_quota_rb": 4, "surplus_penalty": 36.257, "bench_bonus": 7.034, "wait_discount": 0.293, "wait_margin": 2.721, "kdef_rounds_from_end": 1, "injury_penalty": 57.051, "rb_early_bonus": 10.927, "avail_sig
a42634f	1881.7	117.4	5.07	0.377	2700	discard	auto 420 confirmed: {"need_bonus": 68.151, "flex_bonus": 9.189, "depth_quota_wr": 6, "surplus_penalty": 30.529, "bench_bonus": 6.568, "wait_discount": 0.344, "wait_margin": 5.533, "injury_penalty": 74.232, "rb_early_bonus": 4.783, "qb_earliest_round": 3, "avail_sigma": 
a42634f	1884.6	114.7	5.01	0.393	300	discard	auto 421 screen: {"need_bonus": 54.026, "flex_bonus": 9.449, "depth_quota_rb": 2, "depth_quota_te": 2, "depth_quota_qb": 2, "surplus_penalty": 20.808, "bench_bonus": 8.394, "wait_discount": 0.426, "wait_margin": 3.791, "kdef_rounds_from_end": 3, "injury_penalty": 82.
a42634f	1869.1	120.0	5.58	0.337	300	discard	auto 422 screen: {"need_bonus": 7.795, "flex_bonus": 19.779, "depth_quota_wr": 4, "depth_quota_qb": 4, "surplus_penalty": 23.36, "bench_bonus": 3.111, "wait_discount": 0.229, "wait_margin": -3.955, "injury_penalty": 61.063, "rb_early_bonus": 4.989, "avail_sigma": 6.8
a42634f	1884.2	113.1	5.01	0.403	300	discard	auto 423 screen: {"need_bonus": 46.537, "flex_bonus": 10.637, "depth_quota_rb": 2, "depth_quota_qb": 2, "surplus_penalty": 28.308, "bench_bonus": 5.706, "wait_discount": 0.322, "wait_margin": 1.793, "kdef_rounds_from_end": 3, "injury_penalty": 64.123, "rb_early_bonus
a42634f	1822.6	119.7	6.52	0.233	300	discard	auto 424 screen: {"need_bonus": 43.895, "flex_bonus": 1.075, "depth_quota_rb": 2, "depth_quota_wr": 4, "surplus_penalty": 65.332, "bench_bonus": 16.695, "wait_discount": 0.159, "wait_margin": 5.8, "kdef_rounds_from_end": 1, "injury_penalty": 72.638, "rb_early_bonus":
a42634f	1845.5	122.8	5.97	0.28	300	discard	auto 425 screen: {"need_bonus": 88.296, "flex_bonus": 21.903, "surplus_penalty": 32.725, "bench_bonus": 5.949, "wait_discount": 0.068, "wait_margin": 3.592, "kdef_rounds_from_end": 3, "injury_penalty": 150.01, "rb_early_bonus": 3.875, "te_earliest_round": 4, "avail_s
a42634f	1893.3	118.5	4.71	0.421	2700	discard	auto 426 confirmed: {"need_bonus": 37.641, "flex_bonus": 19.222, "depth_quota_wr": 4, "depth_quota_te": 4, "depth_quota_qb": 2, "surplus_penalty": 27.889, "bench_bonus": 6.694, "wait_discount": 0.392, "wait_margin": 3.37, "kdef_rounds_from_end": 3, "injury_penalty": 21.
a42634f	1875.6	108.4	5.2	0.337	300	discard	auto 427 screen: {"need_bonus": 39.563, "flex_bonus": 8.632, "depth_quota_wr": 6, "depth_quota_te": 4, "depth_quota_qb": 4, "surplus_penalty": 30.135, "bench_bonus": 9.558, "wait_discount": 0.363, "wait_margin": 5.034, "injury_penalty": 77.813, "rb_early_bonus": 7.06
a42634f	1871.0	121.1	5.22	0.353	300	discard	auto 428 screen: {"need_bonus": 39.054, "flex_bonus": 12.826, "depth_quota_rb": 4, "surplus_penalty": 35.527, "bench_bonus": 7.872, "wait_discount": 0.333, "wait_margin": 4.807, "kdef_rounds_from_end": 1, "injury_penalty": 144.811, "rb_early_bonus": 4.89, "te_earlies
a42634f	1821.7	112.5	6.61	0.213	300	discard	auto 429 screen: {"need_bonus": 32.322, "flex_bonus": 9.597, "depth_quota_rb": 2, "surplus_penalty": 18.739, "bench_bonus": 2.359, "wait_discount": 0.357, "wait_margin": 3.38, "kdef_rounds_from_end": 1, "injury_penalty": 60.398, "rb_early_bonus": 3.456, "qb_earliest_
a42634f	1893.9	115.9	4.67	0.434	2700	keep	auto 430 confirmed: {"need_bonus": 44.75, "flex_bonus": 10.95, "depth_quota_qb": 4, "surplus_penalty": 23.072, "bench_bonus": 6.815, "wait_discount": 0.312, "wait_margin": 3.964, "injury_penalty": 76.712, "rb_early_bonus": 7.026, "qb_earliest_round": 5, "te_earliest_rou
a42634f	1883.7	119.6	5.0	0.41	300	discard	auto 431 screen: {"need_bonus": 46.193, "flex_bonus": 7.389, "depth_quota_rb": 4, "depth_quota_qb": 5, "surplus_penalty": 31.861, "bench_bonus": 7.749, "wait_discount": 0.299, "wait_margin": 5.117, "kdef_rounds_from_end": 3, "injury_penalty": 41.011, "rb_early_bonus"
a42634f	1894.1	120.8	4.73	0.433	2700	keep	auto 432 confirmed: {"need_bonus": 47.238, "flex_bonus": 10.14, "depth_quota_rb": 4, "depth_quota_wr": 4, "depth_quota_qb": 3, "surplus_penalty": 29.566, "bench_bonus": 6.516, "wait_discount": 0.385, "wait_margin": 3.054, "kdef_rounds_from_end": 3, "injury_penalty": 40.
a42634f	1881.0	129.3	5.03	0.397	300	discard	auto 433 screen: {"need_bonus": 44.296, "flex_bonus": 10.225, "depth_quota_te": 2, "depth_quota_qb": 4, "surplus_penalty": 44.163, "bench_bonus": 8.119, "wait_discount": 0.306, "wait_margin": 3.908, "injury_penalty": 46.522, "rb_early_bonus": 4.938, "avail_sigma": 1.
a42634f	1886.3	116.5	4.9	0.44	300	discard	auto 434 screen: {"need_bonus": 46.718, "flex_bonus": 13.124, "depth_quota_te": 2, "depth_quota_qb": 4, "surplus_penalty": 9.693, "bench_bonus": 7.118, "wait_discount": 0.066, "wait_margin": 3.024, "kdef_rounds_from_end": 2, "injury_penalty": 39.534, "rb_early_bonus"
a42634f	1849.2	109.6	5.89	0.29	300	discard	auto 435 screen: {"need_bonus": 65.886, "flex_bonus": 21.177, "depth_quota_rb": 3, "depth_quota_wr": 3, "depth_quota_te": 2, "depth_quota_qb": 4, "surplus_penalty": 8.988, "bench_bonus": 1.117, "wait_discount": 0.676, "wait_margin": 7.902, "injury_penalty": 18.86, "r
a42634f	1884.0	117.8	4.95	0.373	300	discard	auto 436 screen: {"need_bonus": 41.722, "flex_bonus": 7.901, "depth_quota_rb": 5, "depth_quota_wr": 5, "surplus_penalty": 40.738, "bench_bonus": 7.254, "wait_discount": 0.5, "wait_margin": 2.23, "injury_penalty": 27.681, "rb_early_bonus": 1.817, "qb_earliest_round": 
a42634f	1868.8	122.9	5.25	0.383	300	discard	auto 437 screen: {"need_bonus": 36.942, "flex_bonus": 16.461, "depth_quota_qb": 4, "surplus_penalty": 44.477, "bench_bonus": -1.138, "wait_discount": 0.529, "wait_margin": 3.021, "injury_penalty": 19.969, "rb_early_bonus": 0.313, "avail_sigma": 4.338, "avail_strength
a42634f	1882.5	127.5	5.19	0.377	300	discard	auto 438 screen: {"need_bonus": 54.863, "flex_bonus": 9.423, "surplus_penalty": 24.42, "bench_bonus": 5.801, "wait_discount": 0.349, "wait_margin": 3.27, "injury_penalty": 43.434, "rb_early_bonus": 4.164, "avail_sigma": 5.919, "avail_strength": 0.43, "cliff_gap": 28.
a42634f	1886.4	119.1	4.88	0.399	2700	discard	auto 439 confirmed: {"need_bonus": 18.961, "flex_bonus": 10.633, "depth_quota_rb": 3, "depth_quota_wr": 3, "surplus_penalty": 40.788, "bench_bonus": 6.755, "wait_discount": 0.397, "wait_margin": 2.375, "injury_penalty": 49.141, "rb_early_bonus": 3.391, "qb_earliest_roun
a42634f	1873.4	122.5	5.23	0.38	300	discard	auto 440 screen: {"need_bonus": 17.819, "flex_bonus": 13.161, "depth_quota_wr": 3, "depth_quota_te": 4, "surplus_penalty": 37.551, "bench_bonus": 10.906, "wait_discount": 0.056, "wait_margin": 5.669, "kdef_rounds_from_end": 2, "injury_penalty": 42.378, "rb_early_bonu
a42634f	1890.4	117.4	4.79	0.413	2700	discard	auto 441 confirmed: {"need_bonus": 45.225, "flex_bonus": 8.781, "depth_quota_te": 4, "surplus_penalty": 31.362, "bench_bonus": 4.884, "wait_discount": 0.333, "wait_margin": 2.8, "injury_penalty": 57.234, "rb_early_bonus": 4.629, "qb_earliest_round": 5, "te_earliest_roun
a42634f	1889.4	116.2	4.82	0.412	2700	discard	auto 442 confirmed: {"need_bonus": 74.876, "flex_bonus": 5.852, "depth_quota_wr": 3, "surplus_penalty": 19.073, "bench_bonus": 6.606, "wait_discount": 0.409, "wait_margin": 0.135, "injury_penalty": 25.039, "rb_early_bonus": 6.97, "qb_earliest_round": 5, "te_earliest_rou
a42634f	1889.0	119.9	4.8	0.42	2700	discard	auto 443 confirmed: {"need_bonus": 35.25, "flex_bonus": -0.594, "depth_quota_qb": 4, "surplus_penalty": 16.496, "bench_bonus": 10.167, "wait_discount": 0.429, "wait_margin": 4.265, "kdef_rounds_from_end": 2, "injury_penalty": 36.102, "rb_early_bonus": 4.697, "qb_earlies
a42634f	1892.0	122.9	4.82	0.416	2700	discard	auto 444 confirmed: {"need_bonus": 48.849, "flex_bonus": 11.897, "depth_quota_wr": 5, "depth_quota_te": 2, "depth_quota_qb": 2, "surplus_penalty": 23.628, "bench_bonus": 4.542, "wait_discount": 0.517, "wait_margin": 3.728, "injury_penalty": 41.907, "rb_early_bonus": 7.1
a42634f	1880.4	109.1	4.98	0.36	300	discard	auto 445 screen: {"need_bonus": 69.764, "flex_bonus": 5.784, "depth_quota_wr": 5, "depth_quota_qb": 2, "surplus_penalty": 40.779, "bench_bonus": 12.443, "wait_discount": 0.374, "wait_margin": 3.105, "injury_penalty": 37.724, "rb_early_bonus": 4.508, "qb_earliest_roun
a42634f	1888.5	118.4	4.84	0.413	2700	discard	auto 446 confirmed: {"need_bonus": 55.376, "flex_bonus": 11.64, "depth_quota_rb": 3, "depth_quota_wr": 3, "depth_quota_qb": 4, "surplus_penalty": 31.035, "bench_bonus": 10.061, "wait_discount": 0.238, "wait_margin": 1.79, "injury_penalty": 18.157, "rb_early_bonus": 3.77
a42634f	1854.3	113.3	5.73	0.293	300	discard	auto 447 screen: {"need_bonus": 1.014, "flex_bonus": 14.631, "depth_quota_rb": 5, "depth_quota_wr": 3, "depth_quota_te": 4, "depth_quota_qb": 4, "surplus_penalty": 36.871, "bench_bonus": 8.077, "wait_discount": -0.075, "wait_margin": 2.224, "injury_penalty": 76.31, "
a42634f	1864.6	116.5	5.3	0.337	300	discard	auto 448 screen: {"need_bonus": 6.573, "flex_bonus": 8.113, "depth_quota_rb": 5, "depth_quota_wr": 3, "depth_quota_te": 4, "depth_quota_qb": 4, "surplus_penalty": 27.118, "bench_bonus": 9.772, "wait_discount": 0.426, "wait_margin": 3.838, "injury_penalty": 37.245, "r
a42634f	1886.3	113.4	4.89	0.4	300	discard	auto 449 screen: {"need_bonus": 33.577, "flex_bonus": 4.75, "depth_quota_rb": 5, "surplus_penalty": 19.832, "bench_bonus": 5.19, "wait_discount": 0.319, "wait_margin": 3.251, "kdef_rounds_from_end": 2, "injury_penalty": 34.629, "rb_early_bonus": 2.337, "qb_earliest_r
a42634f	1881.7	112.2	4.98	0.393	300	discard	auto 450 screen: {"need_bonus": 49.766, "flex_bonus": 14.416, "depth_quota_te": 2, "depth_quota_qb": 4, "surplus_penalty": 3.44, "bench_bonus": 3.664, "wait_discount": 0.226, "wait_margin": 1.865, "injury_penalty": 37.192, "rb_early_bonus": 5.041, "qb_earliest_round"
a42634f	1881.4	114.9	4.98	0.4	300	discard	auto 451 screen: {"need_bonus": 49.391, "flex_bonus": 8.438, "depth_quota_rb": 5, "depth_quota_wr": 5, "depth_quota_te": 4, "surplus_penalty": 28.238, "bench_bonus": 7.0, "wait_discount": 0.285, "wait_margin": 2.765, "kdef_rounds_from_end": 2, "injury_penalty": 42.16
a42634f	1885.9	118.4	4.95	0.417	300	discard	auto 452 screen: {"need_bonus": 34.644, "flex_bonus": 12.825, "depth_quota_rb": 5, "depth_quota_wr": 5, "surplus_penalty": 22.065, "bench_bonus": -0.855, "wait_discount": 0.642, "wait_margin": -0.009, "injury_penalty": 23.043, "rb_early_bonus": 5.414, "avail_sigma": 
a42634f	1881.9	121.2	5.04	0.398	2700	discard	auto 453 confirmed: {"need_bonus": 37.446, "flex_bonus": 11.93, "depth_quota_rb": 5, "depth_quota_qb": 4, "surplus_penalty": 23.217, "bench_bonus": 5.377, "wait_discount": 0.184, "wait_margin": 2.385, "injury_penalty": 41.512, "rb_early_bonus": 5.306, "avail_sigma": 6.5
a42634f	1885.4	116.3	4.92	0.41	300	discard	auto 454 screen: {"need_bonus": 50.098, "flex_bonus": 9.136, "depth_quota_rb": 5, "depth_quota_wr": 5, "depth_quota_qb": 2, "surplus_penalty": 31.986, "bench_bonus": 10.528, "wait_discount": 0.306, "wait_margin": 5.847, "injury_penalty": 68.246, "rb_early_bonus": 4.1
a42634f	1866.7	115.9	5.56	0.333	300	discard	auto 455 screen: {"need_bonus": 4.45, "flex_bonus": 15.266, "depth_quota_rb": 5, "depth_quota_wr": 5, "depth_quota_qb": 2, "surplus_penalty": 22.906, "bench_bonus": 12.12, "wait_discount": 0.388, "wait_margin": 5.874, "injury_penalty": 69.099, "rb_early_bonus": 2.507
a42634f	1889.1	116.7	4.79	0.417	2700	discard	auto 456 confirmed: {"need_bonus": 40.74, "flex_bonus": 10.243, "depth_quota_wr": 5, "surplus_penalty": 35.77, "bench_bonus": 3.133, "wait_discount": 0.503, "wait_margin": 2.588, "injury_penalty": 30.922, "rb_early_bonus": 4.81, "qb_earliest_round": 5, "te_earliest_roun
a42634f	1882.7	120.3	4.97	0.403	300	discard	auto 457 screen: {"need_bonus": 41.372, "flex_bonus": 8.247, "depth_quota_rb": 5, "depth_quota_te": 4, "surplus_penalty": 22.648, "bench_bonus": 9.605, "wait_discount": 0.497, "wait_margin": 4.705, "injury_penalty": 71.19, "rb_early_bonus": 4.983, "te_earliest_round"
a42634f	1879.9	121.0	5.05	0.393	300	discard	auto 458 screen: {"need_bonus": 51.755, "flex_bonus": 9.483, "depth_quota_rb": 3, "depth_quota_te": 2, "surplus_penalty": 27.452, "bench_bonus": 7.226, "wait_discount": 0.382, "wait_margin": 3.037, "injury_penalty": 42.513, "rb_early_bonus": 5.442, "qb_earliest_round
a42634f	1842.1	115.8	5.98	0.303	300	discard	auto 459 screen: {"need_bonus": 52.464, "flex_bonus": -3.835, "depth_quota_rb": 5, "depth_quota_wr": 3, "depth_quota_te": 4, "depth_quota_qb": 2, "surplus_penalty": -1.708, "bench_bonus": 4.083, "wait_discount": 0.488, "wait_margin": 1.836, "injury_penalty": 34.273, 
a42634f	1886.8	121.3	5.04	0.393	300	discard	auto 460 screen: {"need_bonus": 47.559, "flex_bonus": 16.376, "depth_quota_rb": 3, "depth_quota_wr": 3, "depth_quota_te": 4, "depth_quota_qb": 2, "surplus_penalty": 43.29, "bench_bonus": 1.932, "wait_discount": 0.38, "wait_margin": 5.245, "kdef_rounds_from_end": 2, "
a42634f	1859.3	126.7	5.76	0.323	300	discard	auto 461 screen: {"need_bonus": 40.242, "flex_bonus": 20.201, "depth_quota_wr": 5, "depth_quota_qb": 2, "surplus_penalty": 44.447, "bench_bonus": 2.318, "wait_discount": 0.026, "wait_margin": 0.334, "injury_penalty": 25.091, "rb_early_bonus": 1.231, "qb_earliest_roun
a42634f	1877.9	109.4	5.04	0.37	300	discard	auto 462 screen: {"need_bonus": 90.5, "flex_bonus": 0.925, "depth_quota_rb": 3, "depth_quota_te": 4, "surplus_penalty": 14.188, "bench_bonus": 8.803, "wait_discount": 0.478, "wait_margin": 1.561, "kdef_rounds_from_end": 2, "injury_penalty": 73.38, "rb_early_bonus": 3
a42634f	1887.1	116.6	4.83	0.406	2700	discard	auto 463 confirmed: {"need_bonus": 39.056, "flex_bonus": 6.047, "depth_quota_rb": 5, "depth_quota_qb": 4, "surplus_penalty": 26.031, "bench_bonus": 7.656, "wait_discount": 0.707, "wait_margin": 2.024, "kdef_rounds_from_end": 2, "injury_penalty": 36.497, "rb_early_bonus"
a42634f	1880.7	126.3	4.98	0.41	300	discard	auto 464 screen: {"need_bonus": 23.972, "flex_bonus": 13.323, "depth_quota_rb": 5, "surplus_penalty": 22.699, "bench_bonus": 6.514, "wait_discount": 0.405, "wait_margin": 1.123, "kdef_rounds_from_end": 2, "injury_penalty": 25.772, "rb_early_bonus": 6.333, "te_earlies
a42634f	1881.0	116.8	4.92	0.41	300	discard	auto 465 screen: {"need_bonus": 45.074, "flex_bonus": 11.179, "depth_quota_rb": 5, "depth_quota_wr": 5, "depth_quota_te": 4, "depth_quota_qb": 4, "surplus_penalty": 49.275, "bench_bonus": 4.181, "wait_discount": 0.47, "wait_margin": 3.766, "kdef_rounds_from_end": 2, 
a42634f	1893.4	118.6	4.73	0.431	2700	discard	auto 466 confirmed: {"need_bonus": 52.522, "flex_bonus": 12.503, "depth_quota_wr": 5, "depth_quota_te": 2, "surplus_penalty": 30.076, "bench_bonus": 6.055, "wait_discount": 0.416, "wait_margin": 2.856, "injury_penalty": 34.34, "rb_early_bonus": 4.887, "te_earliest_round
a42634f	1884.3	125.4	5.06	0.397	300	discard	auto 467 screen: {"need_bonus": 25.013, "flex_bonus": -1.479, "depth_quota_rb": 5, "surplus_penalty": 29.821, "bench_bonus": 12.088, "wait_discount": 0.332, "wait_margin": 0.556, "injury_penalty": 30.425, "rb_early_bonus": 9.196, "te_earliest_round": 3, "avail_sigma"
a42634f	1893.3	119.9	4.76	0.428	2700	discard	auto 468 confirmed: {"need_bonus": 47.121, "flex_bonus": 10.384, "depth_quota_qb": 4, "surplus_penalty": 29.557, "bench_bonus": 5.083, "wait_discount": 0.349, "wait_margin": 2.946, "injury_penalty": 40.68, "rb_early_bonus": 5.382, "avail_sigma": 6.555, "avail_strength":
a42634f	1896.4	119.7	4.67	0.427	2700	keep	auto 469 confirmed: {"need_bonus": 32.301, "flex_bonus": 9.463, "depth_quota_te": 2, "surplus_penalty": 32.511, "bench_bonus": 3.957, "wait_discount": 0.202, "wait_margin": 3.247, "injury_penalty": 26.832, "rb_early_bonus": 10.039, "qb_earliest_round": 5, "avail_sigma":
a42634f	1879.7	123.0	5.26	0.353	300	discard	auto 470 screen: {"need_bonus": 48.638, "flex_bonus": 5.697, "depth_quota_wr": 5, "depth_quota_qb": 4, "surplus_penalty": 31.674, "bench_bonus": 4.565, "wait_discount": 0.346, "wait_margin": 2.843, "injury_penalty": 31.009, "rb_early_bonus": 6.323, "avail_sigma": 6.8
a42634f	1879.1	118.2	5.1	0.383	300	discard	auto 471 screen: {"need_bonus": 39.563, "flex_bonus": 10.959, "depth_quota_qb": 2, "surplus_penalty": 37.158, "bench_bonus": 3.372, "wait_discount": 0.21, "wait_margin": 2.941, "kdef_rounds_from_end": 2, "injury_penalty": 24.249, "rb_early_bonus": 8.218, "te_earliest
a42634f	1894.5	118.6	4.71	0.438	2700	discard	auto 472 confirmed: {"need_bonus": 26.219, "flex_bonus": 2.9, "depth_quota_te": 3, "surplus_penalty": 21.536, "bench_bonus": 4.225, "wait_discount": 0.117, "wait_margin": 2.592, "injury_penalty": 13.314, "rb_early_bonus": 9.327, "qb_earliest_round": 6, "te_earliest_roun
a42634f	1862.6	115.4	5.46	0.297	300	discard	auto 473 screen: {"need_bonus": 41.629, "flex_bonus": 6.652, "depth_quota_te": 1, "surplus_penalty": 42.302, "bench_bonus": 4.633, "wait_discount": 0.127, "wait_margin": 4.317, "injury_penalty": 18.561, "rb_early_bonus": 10.212, "avail_sigma": -5.077, "avail_strength
a42634f	1885.0	126.8	4.95	0.423	300	discard	auto 474 screen: {"need_bonus": 30.432, "flex_bonus": 10.868, "depth_quota_te": 3, "surplus_penalty": 34.704, "bench_bonus": 3.508, "wait_discount": 0.188, "wait_margin": 2.656, "kdef_rounds_from_end": 2, "injury_penalty": 31.523, "rb_early_bonus": 11.639, "te_earlie
a42634f	1885.5	117.8	4.97	0.383	300	discard	auto 475 screen: {"need_bonus": 24.24, "flex_bonus": 12.479, "depth_quota_te": 3, "surplus_penalty": 35.554, "bench_bonus": 8.539, "wait_discount": 0.121, "wait_margin": 1.404, "injury_penalty": 25.781, "rb_early_bonus": -7.101, "te_earliest_round": 5, "avail_sigma":
a42634f	1882.3	118.0	5.15	0.36	300	discard	auto 476 screen: {"need_bonus": -1.643, "flex_bonus": 1.356, "depth_quota_rb": 3, "depth_quota_te": 1, "depth_quota_qb": 4, "surplus_penalty": 42.501, "bench_bonus": 4.783, "wait_discount": 0.495, "wait_margin": 3.953, "injury_penalty": 18.032, "rb_early_bonus": 25.8
a42634f	1884.2	119.3	4.82	0.423	300	discard	auto 477 screen: {"need_bonus": 38.417, "flex_bonus": 9.001, "depth_quota_wr": 3, "surplus_penalty": 32.882, "bench_bonus": 4.472, "wait_discount": 0.205, "wait_margin": 2.826, "kdef_rounds_from_end": 2, "injury_penalty": 27.983, "rb_early_bonus": 8.668, "avail_sigma
a42634f	1880.7	119.5	5.04	0.389	2700	discard	auto 478 confirmed: {"need_bonus": 38.459, "flex_bonus": 10.602, "depth_quota_wr": 5, "depth_quota_te": 1, "surplus_penalty": 39.018, "bench_bonus": 3.325, "wait_discount": 0.215, "wait_margin": 2.83, "injury_penalty": 25.93, "rb_early_bonus": 9.951, "qb_earliest_round"
a42634f	1891.9	119.7	4.78	0.42	2700	discard	auto 479 confirmed: {"need_bonus": 31.327, "flex_bonus": 7.875, "depth_quota_wr": 5, "depth_quota_qb": 2, "surplus_penalty": 30.864, "bench_bonus": 3.891, "wait_discount": 0.183, "wait_margin": 3.169, "injury_penalty": 19.482, "rb_early_bonus": 12.031, "avail_sigma": 6.
a42634f	1890.1	117.8	4.77	0.42	2700	discard	auto 480 confirmed: {"need_bonus": 59.804, "flex_bonus": 10.591, "depth_quota_rb": 3, "depth_quota_wr": 5, "depth_quota_te": 3, "depth_quota_qb": 4, "surplus_penalty": 96.362, "bench_bonus": 5.014, "wait_discount": 0.188, "wait_margin": 1.417, "injury_penalty": 36.331, 
a42634f	1883.9	116.1	5.04	0.36	300	discard	auto 481 screen: {"need_bonus": 16.354, "flex_bonus": 5.333, "depth_quota_rb": 3, "depth_quota_wr": 5, "depth_quota_te": 1, "surplus_penalty": 39.036, "bench_bonus": 5.374, "wait_discount": 0.126, "wait_margin": 2.826, "kdef_rounds_from_end": 2, "injury_penalty": 40.
a42634f	1886.6	117.9	4.92	0.399	2700	discard	auto 482 confirmed: {"need_bonus": 30.341, "flex_bonus": 10.295, "depth_quota_wr": 5, "depth_quota_te": 1, "depth_quota_qb": 2, "surplus_penalty": 27.459, "bench_bonus": 5.091, "wait_discount": 0.245, "wait_margin": 3.28, "injury_penalty": 26.341, "rb_early_bonus": 8.47
a42634f	1879.4	114.4	4.9	0.383	300	discard	auto 483 screen: {"need_bonus": 34.237, "flex_bonus": 14.52, "depth_quota_rb": 3, "depth_quota_wr": 5, "depth_quota_te": 3, "surplus_penalty": 29.87, "bench_bonus": 3.025, "wait_discount": 0.331, "wait_margin": 3.753, "injury_penalty": 20.697, "rb_early_bonus": 9.832
a42634f	1882.1	125.7	5.11	0.397	300	discard	auto 484 screen: {"need_bonus": 36.605, "flex_bonus": 6.215, "depth_quota_wr": 3, "depth_quota_te": 1, "surplus_penalty": 20.314, "bench_bonus": 7.186, "wait_discount": 0.322, "wait_margin": 2.351, "kdef_rounds_from_end": 2, "injury_penalty": 53.465, "rb_early_bonus"
a42634f	1892.0	115.6	4.79	0.405	2700	discard	auto 485 confirmed: {"need_bonus": 25.666, "flex_bonus": 11.644, "depth_quota_rb": 3, "depth_quota_wr": 5, "depth_quota_qb": 2, "surplus_penalty": 36.523, "bench_bonus": 2.985, "wait_discount": 0.188, "wait_margin": 3.13, "kdef_rounds_from_end": 2, "injury_penalty": 29.
a42634f	1889.8	119.2	4.81	0.419	2700	discard	auto 486 confirmed: {"need_bonus": 60.722, "flex_bonus": 8.346, "depth_quota_wr": 5, "depth_quota_te": 3, "depth_quota_qb": 4, "surplus_penalty": 12.453, "bench_bonus": 4.256, "wait_discount": 0.331, "wait_margin": 3.834, "injury_penalty": 34.425, "rb_early_bonus": 22.9
a42634f	1892.6	120.4	4.77	0.429	2700	discard	auto 487 confirmed: {"need_bonus": 41.317, "flex_bonus": 11.119, "surplus_penalty": 44.757, "bench_bonus": 4.526, "wait_discount": 0.159, "wait_margin": 2.806, "injury_penalty": 35.367, "rb_early_bonus": 7.182, "qb_earliest_round": 6, "avail_sigma": 3.643, "avail_streng
a42634f	1885.0	117.2	5.0	0.39	300	discard	auto 488 screen: {"need_bonus": 53.501, "flex_bonus": 19.095, "depth_quota_rb": 3, "depth_quota_wr": 3, "depth_quota_qb": 2, "surplus_penalty": 45.892, "bench_bonus": 5.727, "wait_discount": 0.085, "wait_margin": 2.743, "injury_penalty": 4.334, "rb_early_bonus": 7.65
