commit	score	score_std	mean_rank	p_top3	n_sims	status	description
3d0eed5	1875.6	121.1	5.17	0.387	300	discard	auto 1111 screen: {"need_bonus": 39.487, "flex_bonus": 17.351, "depth_quota_wr": 6, "depth_quota_te": 2, "depth_quota_qb": 1, "surplus_penalty": 46.303, "bench_bonus": 4.498, "wait_discount": 0.258, "wait_margin": 4.901, "injury_penalty": 16.885, "rb_early_bonus": 5.1
3d0eed5	1893.3	117.0	4.73	0.422	2700	discard	auto 1112 confirmed: {"need_bonus": 34.616, "flex_bonus": 5.104, "depth_quota_rb": 3, "surplus_penalty": 27.037, "bench_bonus": 7.097, "wait_discount": 0.122, "wait_margin": 3.095, "injury_penalty": 45.914, "rb_early_bonus": 13.307, "avail_sigma": 4.404, "avail_strength"
3d0eed5	1886.9	118.3	4.91	0.413	2700	discard	auto 1113 confirmed: {"need_bonus": 28.699, "flex_bonus": 8.087, "depth_quota_qb": 1, "surplus_penalty": 44.249, "bench_bonus": 4.543, "wait_discount": 0.143, "wait_margin": 4.499, "injury_penalty": 25.312, "rb_early_bonus": 9.815, "qb_earliest_round": 4, "avail_sigma": 
3d0eed5	1885.4	116.4	4.94	0.407	300	discard	auto 1114 screen: {"need_bonus": 30.646, "flex_bonus": 9.103, "depth_quota_rb": 3, "depth_quota_wr": 6, "depth_quota_te": 2, "depth_quota_qb": 3, "surplus_penalty": 50.357, "bench_bonus": 4.836, "wait_discount": 0.131, "wait_margin": 4.511, "injury_penalty": 29.37, "r
3d0eed5	1893.1	119.5	4.76	0.422	2700	discard	auto 1115 confirmed: {"need_bonus": 35.071, "flex_bonus": 11.163, "depth_quota_rb": 3, "depth_quota_te": 2, "surplus_penalty": 39.43, "bench_bonus": 4.15, "wait_discount": 0.173, "wait_margin": 4.008, "injury_penalty": 26.254, "rb_early_bonus": 10.321, "qb_earliest_round
3d0eed5	1891.8	118.8	4.77	0.423	2700	discard	auto 1116 confirmed: {"need_bonus": 12.821, "flex_bonus": 12.126, "depth_quota_wr": 4, "surplus_penalty": 21.087, "bench_bonus": -0.044, "wait_discount": 0.22, "wait_margin": 3.595, "injury_penalty": 19.132, "rb_early_bonus": 9.215, "qb_earliest_round": 4, "te_earliest_r
3d0eed5	1889.4	121.3	4.85	0.413	2700	discard	auto 1117 confirmed: {"need_bonus": 26.807, "flex_bonus": 14.45, "surplus_penalty": 30.899, "bench_bonus": 3.895, "wait_discount": 0.224, "wait_margin": 5.384, "injury_penalty": 26.456, "rb_early_bonus": 4.188, "qb_earliest_round": 4, "avail_sigma": 4.93, "avail_strength
3d0eed5	1891.5	121.0	4.75	0.42	2700	discard	auto 1118 confirmed: {"need_bonus": 25.782, "flex_bonus": 6.21, "depth_quota_rb": 5, "depth_quota_te": 4, "depth_quota_qb": 3, "surplus_penalty": 45.162, "bench_bonus": 7.459, "wait_discount": 0.092, "wait_margin": 3.469, "injury_penalty": 43.765, "rb_early_bonus": 10.1,
3d0eed5	1878.6	133.7	5.23	0.397	300	discard	auto 1119 screen: {"need_bonus": 53.861, "flex_bonus": 9.701, "depth_quota_rb": 3, "depth_quota_te": 4, "depth_quota_qb": 3, "surplus_penalty": 72.6, "bench_bonus": 3.271, "wait_discount": 0.428, "wait_margin": 4.085, "injury_penalty": -11.975, "rb_early_bonus": 8.814
3d0eed5	1883.7	113.6	4.94	0.39	300	discard	auto 1120 screen: {"need_bonus": 31.197, "flex_bonus": 8.876, "depth_quota_rb": 3, "depth_quota_te": 2, "depth_quota_qb": 1, "surplus_penalty": 50.436, "bench_bonus": 5.031, "wait_discount": 0.302, "wait_margin": 0.144, "injury_penalty": 26.883, "rb_early_bonus": 16.8
3d0eed5	1892.3	120.7	4.76	0.424	2700	discard	auto 1121 confirmed: {"need_bonus": 26.854, "flex_bonus": 12.431, "depth_quota_wr": 6, "depth_quota_te": 4, "depth_quota_qb": 3, "surplus_penalty": 36.516, "bench_bonus": 5.641, "wait_discount": 0.181, "wait_margin": 3.69, "injury_penalty": 30.468, "rb_early_bonus": 9.75
3d0eed5	1881.9	107.5	4.84	0.403	300	discard	auto 1122 screen: {"need_bonus": 20.171, "flex_bonus": 6.338, "depth_quota_rb": 5, "depth_quota_wr": 6, "depth_quota_te": 4, "depth_quota_qb": 3, "surplus_penalty": 16.443, "bench_bonus": 2.988, "wait_discount": 0.201, "wait_margin": 2.684, "injury_penalty": 23.988, "
3d0eed5	1887.6	117.7	4.84	0.409	2700	discard	auto 1123 confirmed: {"need_bonus": 29.266, "flex_bonus": 11.12, "depth_quota_rb": 3, "depth_quota_te": 4, "surplus_penalty": 31.026, "bench_bonus": 4.223, "wait_discount": 0.142, "wait_margin": 3.641, "kdef_rounds_from_end": 2, "injury_penalty": 28.372, "rb_early_bonus"
3d0eed5	1887.5	119.7	4.89	0.411	2700	discard	auto 1124 confirmed: {"need_bonus": 21.555, "flex_bonus": 11.108, "depth_quota_rb": 5, "depth_quota_wr": 6, "depth_quota_te": 2, "depth_quota_qb": 3, "surplus_penalty": 54.567, "bench_bonus": 2.58, "wait_discount": 0.175, "wait_margin": 4.371, "injury_penalty": 21.231, "
3d0eed5	1893.2	121.2	4.75	0.43	2700	discard	auto 1125 confirmed: {"need_bonus": 25.338, "flex_bonus": 7.395, "depth_quota_te": 2, "surplus_penalty": 41.444, "bench_bonus": 4.019, "wait_discount": 0.151, "wait_margin": 3.57, "kdef_rounds_from_end": 2, "injury_penalty": 27.009, "rb_early_bonus": 11.666, "qb_earliest
3d0eed5	1888.6	121.4	4.9	0.404	2700	discard	auto 1126 confirmed: {"need_bonus": 19.834, "flex_bonus": 9.45, "depth_quota_te": 2, "surplus_penalty": 28.912, "bench_bonus": 7.907, "wait_discount": 0.177, "wait_margin": 4.508, "injury_penalty": 43.39, "rb_early_bonus": 7.12, "qb_earliest_round": 4, "te_earliest_round
3d0eed5	1886.1	119.0	4.92	0.4	300	discard	auto 1127 screen: {"need_bonus": 30.05, "flex_bonus": 10.348, "depth_quota_rb": 5, "depth_quota_te": 4, "surplus_penalty": 42.268, "bench_bonus": 3.167, "wait_discount": 0.211, "wait_margin": 4.17, "injury_penalty": 11.187, "rb_early_bonus": 6.721, "qb_earliest_round"
3d0eed5	1874.3	122.4	5.37	0.357	300	discard	auto 1128 screen: {"need_bonus": 11.643, "flex_bonus": 9.583, "depth_quota_wr": 6, "depth_quota_te": 4, "surplus_penalty": 41.096, "bench_bonus": 6.38, "wait_discount": 0.127, "wait_margin": 4.798, "injury_penalty": 39.858, "rb_early_bonus": 8.501, "avail_sigma": 6.30
3d0eed5	1880.7	109.7	5.11	0.36	300	discard	auto 1129 screen: {"need_bonus": 49.386, "flex_bonus": 4.887, "depth_quota_wr": 4, "depth_quota_te": 4, "depth_quota_qb": 3, "surplus_penalty": 24.801, "bench_bonus": 7.449, "wait_discount": 0.279, "wait_margin": 4.041, "injury_penalty": -0.719, "rb_early_bonus": 15.2
3d0eed5	1884.7	120.3	4.97	0.403	300	discard	auto 1130 screen: {"need_bonus": 11.582, "flex_bonus": 14.506, "depth_quota_rb": 5, "depth_quota_wr": 4, "depth_quota_te": 4, "depth_quota_qb": 1, "surplus_penalty": 28.227, "bench_bonus": 3.561, "wait_discount": 0.18, "wait_margin": 9.738, "kdef_rounds_from_end": 2, 
3d0eed5	1893.2	119.7	4.77	0.417	2700	discard	auto 1131 confirmed: {"need_bonus": 20.818, "flex_bonus": 10.313, "depth_quota_rb": 5, "depth_quota_te": 2, "surplus_penalty": 19.9, "bench_bonus": 2.535, "wait_discount": 0.082, "wait_margin": 4.455, "injury_penalty": 34.149, "rb_early_bonus": 7.319, "avail_sigma": 6.51
3d0eed5	1891.4	118.5	4.8	0.418	2700	discard	auto 1132 confirmed: {"need_bonus": 19.183, "flex_bonus": 6.286, "depth_quota_rb": 3, "depth_quota_wr": 4, "depth_quota_te": 4, "surplus_penalty": 35.567, "bench_bonus": 6.93, "wait_discount": 0.094, "wait_margin": 5.145, "injury_penalty": 20.016, "rb_early_bonus": 10.91
3d0eed5	1891.0	119.0	4.78	0.425	2700	discard	auto 1133 confirmed: {"need_bonus": 17.801, "flex_bonus": 11.194, "depth_quota_rb": 5, "depth_quota_wr": 4, "depth_quota_te": 2, "depth_quota_qb": 3, "surplus_penalty": 3.28, "bench_bonus": 6.397, "wait_discount": 0.112, "wait_margin": 3.6, "injury_penalty": 19.52, "rb_e
3d0eed5	1881.2	116.2	4.98	0.383	300	discard	auto 1134 screen: {"need_bonus": 36.755, "flex_bonus": 15.58, "depth_quota_wr": 6, "surplus_penalty": 38.631, "bench_bonus": 5.24, "wait_discount": 0.168, "wait_margin": 4.012, "kdef_rounds_from_end": 2, "injury_penalty": 26.739, "rb_early_bonus": 5.948, "qb_earliest_
3d0eed5	1827.6	119.2	6.58	0.233	300	discard	auto 1135 screen: {"need_bonus": 93.295, "flex_bonus": 7.175, "depth_quota_rb": 3, "depth_quota_wr": 6, "depth_quota_te": 4, "depth_quota_qb": 1, "surplus_penalty": 28.765, "bench_bonus": 7.741, "wait_discount": 0.243, "wait_margin": 3.956, "injury_penalty": 27.041, "
3d0eed5	1891.3	118.4	4.77	0.415	2700	discard	auto 1136 confirmed: {"need_bonus": 22.63, "flex_bonus": 9.349, "depth_quota_rb": 3, "depth_quota_te": 4, "surplus_penalty": 52.353, "bench_bonus": 2.86, "wait_discount": 0.15, "wait_margin": 6.304, "injury_penalty": 25.863, "rb_early_bonus": 10.178, "avail_sigma": 5.701
3d0eed5	1865.9	115.6	5.3	0.34	300	discard	auto 1137 screen: {"need_bonus": 35.2, "flex_bonus": 9.986, "depth_quota_wr": 4, "depth_quota_te": 2, "depth_quota_qb": 1, "surplus_penalty": 38.557, "bench_bonus": 4.393, "wait_discount": 0.149, "wait_margin": 3.593, "kdef_rounds_from_end": 2, "injury_penalty": 27.58
3d0eed5	1890.7	118.6	4.82	0.41	2700	discard	auto 1138 confirmed: {"need_bonus": 26.416, "flex_bonus": 8.876, "depth_quota_te": 2, "surplus_penalty": 32.946, "bench_bonus": 5.9, "wait_margin": 7.327, "injury_penalty": 23.236, "rb_early_bonus": 6.773, "qb_earliest_round": 4, "avail_sigma": 5.036, "avail_strength": 0
3d0eed5	1874.0	111.5	5.14	0.363	300	discard	auto 1139 screen: {"need_bonus": 34.537, "flex_bonus": 10.054, "depth_quota_rb": 5, "depth_quota_wr": 4, "depth_quota_te": 4, "depth_quota_qb": 1, "surplus_penalty": 34.512, "bench_bonus": 3.24, "wait_discount": 0.154, "wait_margin": 3.508, "injury_penalty": 30.75, "r
3d0eed5	1894.8	119.3	4.72	0.421	2700	discard	auto 1140 confirmed: {"need_bonus": 23.617, "flex_bonus": 9.207, "depth_quota_rb": 5, "depth_quota_wr": 6, "depth_quota_te": 2, "depth_quota_qb": 3, "surplus_penalty": 30.141, "bench_bonus": 4.716, "wait_discount": 0.165, "wait_margin": 3.968, "injury_penalty": 30.855, "
3d0eed5	1871.6	114.4	5.27	0.363	300	discard	auto 1141 screen: {"need_bonus": 9.127, "flex_bonus": 10.587, "depth_quota_rb": 3, "surplus_penalty": 50.625, "bench_bonus": 4.454, "wait_discount": 0.163, "wait_margin": 6.322, "kdef_rounds_from_end": 2, "injury_penalty": 41.43, "rb_early_bonus": 6.016, "te_earliest_
3d0eed5	1886.4	119.5	4.86	0.423	300	discard	auto 1142 screen: {"need_bonus": 36.4, "flex_bonus": 7.309, "depth_quota_rb": 5, "depth_quota_te": 2, "surplus_penalty": 43.987, "bench_bonus": 6.169, "wait_discount": 0.262, "wait_margin": 5.949, "injury_penalty": 24.045, "rb_early_bonus": 5.327, "avail_sigma": 5.818
3d0eed5	1886.5	121.9	4.92	0.4	2700	discard	auto 1143 confirmed: {"need_bonus": 40.47, "flex_bonus": 4.155, "depth_quota_rb": 3, "depth_quota_te": 4, "surplus_penalty": 36.211, "bench_bonus": 6.006, "wait_discount": 0.185, "wait_margin": 2.556, "injury_penalty": 3.031, "rb_early_bonus": 9.28, "avail_sigma": 4.106,
3d0eed5	1890.0	118.2	4.83	0.419	2700	discard	auto 1144 confirmed: {"need_bonus": 42.698, "flex_bonus": 14.631, "depth_quota_wr": 6, "depth_quota_te": 4, "surplus_penalty": 30.667, "bench_bonus": 6.036, "wait_discount": 0.133, "wait_margin": 3.644, "injury_penalty": 39.183, "rb_early_bonus": 12.074, "avail_sigma": 3
3d0eed5	1889.4	119.0	4.77	0.416	2700	discard	auto 1145 confirmed: {"need_bonus": 28.191, "flex_bonus": 10.94, "depth_quota_rb": 3, "depth_quota_wr": 6, "depth_quota_qb": 3, "surplus_penalty": 35.143, "bench_bonus": 3.369, "wait_discount": 0.178, "wait_margin": 3.369, "injury_penalty": 30.643, "rb_early_bonus": 6.32
3d0eed5	1867.9	113.6	5.36	0.31	300	discard	auto 1146 screen: {"need_bonus": 35.127, "flex_bonus": 2.683, "depth_quota_rb": 3, "depth_quota_qb": 3, "surplus_penalty": 32.454, "bench_bonus": -0.752, "wait_discount": 0.202, "wait_margin": 5.959, "injury_penalty": 1.96, "rb_early_bonus": 3.818, "qb_earliest_round"
3d0eed5	1882.4	122.1	5.1	0.36	300	discard	auto 1147 screen: {"need_bonus": 46.652, "flex_bonus": 0.747, "depth_quota_rb": 3, "depth_quota_te": 2, "surplus_penalty": 18.327, "bench_bonus": 4.223, "wait_discount": 0.297, "wait_margin": 1.878, "kdef_rounds_from_end": 2, "injury_penalty": 57.088, "rb_early_bonus"
3d0eed5	1872.7	123.4	5.29	0.37	300	discard	auto 1148 screen: {"need_bonus": 10.555, "flex_bonus": 4.848, "surplus_penalty": 32.921, "bench_bonus": -0.59, "wait_discount": 0.287, "wait_margin": 4.511, "injury_penalty": 41.955, "rb_early_bonus": 21.982, "te_earliest_round": 5, "avail_sigma": 1.564, "avail_streng
3d0eed5	1875.1	117.4	5.2	0.343	300	discard	auto 1149 screen: {"need_bonus": 17.263, "flex_bonus": 7.114, "depth_quota_wr": 4, "depth_quota_te": 2, "surplus_penalty": 38.48, "bench_bonus": 4.662, "wait_discount": 0.216, "wait_margin": 6.253, "injury_penalty": 35.598, "rb_early_bonus": 11.75, "qb_earliest_round"
3d0eed5	1893.1	117.9	4.72	0.431	2700	discard	auto 1150 confirmed: {"need_bonus": 29.517, "flex_bonus": 4.912, "depth_quota_wr": 4, "depth_quota_qb": 3, "surplus_penalty": 27.843, "bench_bonus": 2.638, "wait_discount": 0.128, "wait_margin": 3.101, "injury_penalty": 24.924, "rb_early_bonus": 7.841, "qb_earliest_round
3d0eed5	1882.2	108.8	4.84	0.417	300	discard	auto 1151 screen: {"need_bonus": 35.142, "flex_bonus": 10.735, "depth_quota_te": 4, "depth_quota_qb": 3, "surplus_penalty": 37.006, "bench_bonus": 4.47, "wait_discount": 0.118, "wait_margin": 3.949, "kdef_rounds_from_end": 2, "injury_penalty": 25.714, "rb_early_bonus"
3d0eed5	1892.4	119.8	4.8	0.415	2700	discard	auto 1152 confirmed: {"need_bonus": 28.239, "flex_bonus": 2.532, "depth_quota_wr": 4, "depth_quota_te": 2, "surplus_penalty": 51.282, "bench_bonus": 8.573, "wait_discount": 0.173, "wait_margin": 1.948, "injury_penalty": 29.197, "rb_early_bonus": 11.78, "te_earliest_round
3d0eed5	1885.2	116.6	4.95	0.38	300	discard	auto 1153 screen: {"need_bonus": 24.654, "flex_bonus": 13.937, "depth_quota_te": 4, "surplus_penalty": 59.901, "bench_bonus": 3.59, "wait_discount": -0.008, "wait_margin": 5.522, "injury_penalty": 27.708, "rb_early_bonus": -1.933, "qb_earliest_round": 4, "te_earliest_
3d0eed5	1889.8	123.8	4.85	0.425	2700	discard	auto 1154 confirmed: {"need_bonus": 32.827, "flex_bonus": 12.163, "surplus_penalty": 31.654, "bench_bonus": 6.352, "wait_discount": 0.145, "wait_margin": 4.022, "injury_penalty": 23.839, "rb_early_bonus": 15.083, "te_earliest_round": 3, "avail_sigma": 5.138, "avail_stren
3d0eed5	1893.0	117.4	4.72	0.433	2700	discard	auto 1155 confirmed: {"need_bonus": 23.495, "flex_bonus": 9.286, "surplus_penalty": 33.408, "bench_bonus": 5.305, "wait_discount": 0.204, "wait_margin": 2.53, "injury_penalty": 17.92, "rb_early_bonus": 10.881, "qb_earliest_round": 6, "avail_sigma": 3.797, "avail_strength
3d0eed5	1887.2	117.0	4.79	0.403	300	discard	auto 1156 screen: {"need_bonus": 28.295, "flex_bonus": 15.519, "depth_quota_rb": 3, "depth_quota_wr": 4, "depth_quota_qb": 3, "surplus_penalty": 46.629, "bench_bonus": 4.069, "wait_discount": 0.245, "wait_margin": 4.107, "injury_penalty": 45.497, "rb_early_bonus": 8.0
3d0eed5	1840.2	123.9	6.06	0.273	300	discard	auto 1157 screen: {"need_bonus": 32.637, "flex_bonus": 2.83, "depth_quota_rb": 5, "depth_quota_wr": 4, "depth_quota_te": 4, "surplus_penalty": 8.19, "bench_bonus": 0.258, "wait_discount": 0.255, "wait_margin": 2.823, "injury_penalty": 45.817, "rb_early_bonus": 1.068, 
3d0eed5	1887.8	118.7	4.85	0.423	300	discard	auto 1158 screen: {"need_bonus": 27.367, "flex_bonus": 7.375, "depth_quota_rb": 5, "depth_quota_wr": 6, "depth_quota_te": 2, "surplus_penalty": 31.944, "bench_bonus": 4.123, "wait_discount": 0.147, "wait_margin": 4.106, "injury_penalty": 20.771, "rb_early_bonus": 8.67
3d0eed5	1889.0	116.2	4.78	0.416	2700	discard	auto 1159 confirmed: {"need_bonus": 40.89, "flex_bonus": 4.108, "depth_quota_rb": 3, "surplus_penalty": 48.596, "bench_bonus": 4.31, "wait_discount": 0.129, "wait_margin": 3.913, "injury_penalty": 43.389, "rb_early_bonus": 8.665, "te_earliest_round": 5, "avail_sigma": 2.
3d0eed5	1891.4	117.2	4.8	0.411	2700	discard	auto 1160 confirmed: {"need_bonus": 25.453, "flex_bonus": 7.73, "depth_quota_wr": 4, "depth_quota_te": 4, "surplus_penalty": 32.755, "bench_bonus": 3.891, "wait_discount": 0.174, "wait_margin": 4.051, "kdef_rounds_from_end": 2, "injury_penalty": 28.277, "rb_early_bonus":
3d0eed5	1886.1	117.6	4.97	0.38	300	discard	auto 1161 screen: {"need_bonus": 26.522, "flex_bonus": 12.57, "depth_quota_te": 2, "surplus_penalty": 66.82, "bench_bonus": 2.894, "wait_discount": 0.38, "wait_margin": 7.35, "injury_penalty": 34.244, "rb_early_bonus": 12.036, "te_earliest_round": 3, "avail_sigma": 8.
3d0eed5	1850.1	125.9	5.93	0.283	300	discard	auto 1162 screen: {"need_bonus": 19.749, "flex_bonus": 7.645, "depth_quota_wr": 4, "depth_quota_te": 4, "depth_quota_qb": 1, "surplus_penalty": 4.839, "bench_bonus": 6.816, "wait_discount": 0.127, "wait_margin": 6.337, "injury_penalty": 42.13, "rb_early_bonus": 13.959
3d0eed5	1879.1	110.0	5.13	0.337	300	discard	auto 1163 screen: {"need_bonus": 21.075, "flex_bonus": 9.653, "depth_quota_rb": 5, "depth_quota_wr": 4, "depth_quota_qb": 1, "surplus_penalty": 54.581, "bench_bonus": 6.133, "wait_discount": 0.095, "wait_margin": 3.222, "injury_penalty": 42.7, "rb_early_bonus": 6.973,
3d0eed5	1891.2	120.6	4.84	0.409	2700	discard	auto 1164 confirmed: {"need_bonus": 41.423, "flex_bonus": 13.907, "depth_quota_te": 4, "surplus_penalty": 42.366, "bench_bonus": 7.151, "wait_discount": 0.173, "wait_margin": 2.843, "injury_penalty": 32.054, "rb_early_bonus": 13.583, "qb_earliest_round": 4, "avail_sigma"
3d0eed5	1895.7	118.4	4.67	0.435	2700	discard	auto 1165 confirmed: {"need_bonus": 31.095, "flex_bonus": 12.082, "depth_quota_rb": 5, "depth_quota_te": 4, "surplus_penalty": 27.334, "bench_bonus": 4.18, "wait_discount": 0.172, "wait_margin": 4.552, "injury_penalty": 24.881, "rb_early_bonus": 7.296, "qb_earliest_round
3d0eed5	1891.4	118.0	4.78	0.42	2700	discard	auto 1166 confirmed: {"need_bonus": 33.96, "flex_bonus": 8.953, "surplus_penalty": 38.123, "bench_bonus": 3.834, "wait_discount": 0.213, "wait_margin": 4.462, "injury_penalty": 19.679, "rb_early_bonus": 9.507, "qb_earliest_round": 6, "te_earliest_round": 5, "avail_sigma"
3d0eed5	1889.1	120.4	4.85	0.415	2700	discard	auto 1167 confirmed: {"need_bonus": 28.136, "flex_bonus": 3.62, "depth_quota_wr": 4, "depth_quota_qb": 3, "surplus_penalty": 18.749, "bench_bonus": 2.476, "wait_discount": 0.164, "wait_margin": 2.306, "injury_penalty": 27.364, "rb_early_bonus": 7.0, "te_earliest_round": 
3d0eed5	1890.1	119.8	4.86	0.416	2700	discard	auto 1168 confirmed: {"need_bonus": 28.877, "flex_bonus": 12.984, "depth_quota_rb": 3, "depth_quota_te": 2, "surplus_penalty": 47.397, "bench_bonus": 3.186, "wait_discount": 0.287, "wait_margin": 2.638, "injury_penalty": 11.357, "rb_early_bonus": 14.227, "qb_earliest_rou
3d0eed5	1893.8	118.3	4.73	0.415	2700	discard	auto 1169 confirmed: {"need_bonus": 58.495, "flex_bonus": 5.971, "depth_quota_wr": 4, "depth_quota_te": 4, "surplus_penalty": 27.859, "bench_bonus": 7.138, "wait_discount": 0.129, "wait_margin": 7.56, "injury_penalty": 57.609, "rb_early_bonus": 7.308, "qb_earliest_round"
3d0eed5	1890.8	120.0	4.84	0.413	2700	discard	auto 1170 confirmed: {"need_bonus": 32.47, "flex_bonus": 5.996, "depth_quota_rb": 5, "depth_quota_wr": 6, "surplus_penalty": 43.549, "bench_bonus": 4.968, "wait_discount": 0.251, "wait_margin": 3.359, "kdef_rounds_from_end": 2, "injury_penalty": 14.721, "rb_early_bonus":
3d0eed5	1885.4	113.5	4.93	0.4	300	discard	auto 1171 screen: {"need_bonus": 29.107, "flex_bonus": 11.827, "depth_quota_rb": 3, "depth_quota_te": 2, "depth_quota_qb": 3, "surplus_penalty": 40.042, "bench_bonus": 4.339, "wait_discount": 0.153, "wait_margin": 3.265, "injury_penalty": 28.403, "rb_early_bonus": 11.
3d0eed5	1878.6	118.0	5.11	0.37	300	discard	auto 1172 screen: {"need_bonus": 26.717, "flex_bonus": 11.753, "depth_quota_rb": 5, "depth_quota_wr": 6, "depth_quota_te": 4, "surplus_penalty": 24.223, "bench_bonus": 4.799, "wait_discount": 0.137, "wait_margin": 3.323, "injury_penalty": 33.517, "rb_early_bonus": 9.5
3d0eed5	1892.1	121.2	4.84	0.407	2700	discard	auto 1173 confirmed: {"need_bonus": 25.252, "flex_bonus": 8.963, "depth_quota_rb": 5, "depth_quota_wr": 4, "surplus_penalty": 37.627, "bench_bonus": 6.467, "wait_discount": 0.187, "wait_margin": 3.71, "injury_penalty": 30.262, "rb_early_bonus": 10.929, "te_earliest_round
3d0eed5	1889.4	117.5	4.81	0.414	2700	discard	auto 1174 confirmed: {"need_bonus": 25.029, "flex_bonus": 8.897, "depth_quota_rb": 3, "depth_quota_wr": 6, "depth_quota_te": 4, "depth_quota_qb": 3, "surplus_penalty": 36.529, "bench_bonus": 4.616, "wait_discount": 0.262, "wait_margin": 2.102, "injury_penalty": 16.816, "
3d0eed5	1893.5	120.4	4.76	0.416	2700	discard	auto 1175 confirmed: {"need_bonus": 25.595, "flex_bonus": 9.857, "depth_quota_wr": 6, "depth_quota_te": 2, "surplus_penalty": 38.655, "bench_bonus": 3.162, "wait_discount": 0.212, "wait_margin": 1.94, "injury_penalty": 38.675, "rb_early_bonus": 14.516, "te_earliest_round
3d0eed5	1875.4	118.7	5.28	0.35	300	discard	auto 1176 screen: {"need_bonus": 25.001, "flex_bonus": 9.136, "depth_quota_rb": 3, "depth_quota_te": 2, "depth_quota_qb": 1, "surplus_penalty": 38.197, "bench_bonus": 3.899, "wait_discount": 0.163, "wait_margin": 4.008, "kdef_rounds_from_end": 2, "injury_penalty": 33.
3d0eed5	1845.4	123.0	6.08	0.297	300	discard	auto 1177 screen: {"need_bonus": 61.559, "flex_bonus": 7.06, "depth_quota_wr": 6, "depth_quota_te": 4, "surplus_penalty": 42.666, "bench_bonus": 8.424, "wait_discount": 0.166, "wait_margin": 6.103, "injury_penalty": 21.564, "rb_early_bonus": 1.919, "avail_sigma": 1.73
3d0eed5	1882.1	119.4	5.06	0.407	300	discard	auto 1178 screen: {"need_bonus": 21.679, "flex_bonus": 9.069, "depth_quota_rb": 3, "depth_quota_te": 2, "depth_quota_qb": 1, "surplus_penalty": 38.46, "bench_bonus": 1.329, "wait_discount": 0.115, "wait_margin": 0.557, "injury_penalty": 15.862, "rb_early_bonus": 18.54
3d0eed5	1877.6	115.0	5.06	0.383	300	discard	auto 1179 screen: {"need_bonus": 28.921, "flex_bonus": 11.852, "depth_quota_rb": 3, "depth_quota_wr": 6, "depth_quota_te": 2, "depth_quota_qb": 1, "surplus_penalty": 32.004, "bench_bonus": 4.643, "wait_discount": 0.174, "wait_margin": 3.027, "injury_penalty": 31.863, 
