commit	score	score_std	mean_rank	p_top3	n_sims	status	description
a42634f	1834.6	117.3	6.4	0.233	300	discard	auto 349 screen: {"need_bonus": 85.829, "flex_bonus": 12.567, "depth_quota_wr": 4, "depth_quota_qb": 2, "surplus_penalty": 19.736, "bench_bonus": 3.709, "wait_discount": 0.286, "wait_margin": 1.951, "injury_penalty": 22.821, "rb_early_bonus": 12.043, "qb_earliest_rou
a42634f	1890.0	121.4	4.91	0.406	2700	discard	auto 350 confirmed: {"need_bonus": 37.301, "flex_bonus": 8.823, "depth_quota_wr": 4, "depth_quota_te": 2, "surplus_penalty": 59.466, "bench_bonus": -1.47, "wait_discount": 0.267, "wait_margin": 0.822, "kdef_rounds_from_end": 3, "injury_penalty": 44.025, "rb_early_bonus"
a42634f	1793.8	114.0	7.36	0.163	300	discard	auto 351 screen: {"need_bonus": 58.789, "flex_bonus": 25.072, "depth_quota_qb": 4, "surplus_penalty": 63.62, "bench_bonus": -0.055, "wait_discount": 0.257, "wait_margin": 4.428, "injury_penalty": 59.195, "rb_early_bonus": -0.507, "te_earliest_round": 2, "avail_sigma"
a42634f	1841.7	115.0	6.07	0.243	300	discard	auto 352 screen: {"need_bonus": 41.105, "flex_bonus": 9.34, "depth_quota_wr": 6, "depth_quota_te": 4, "surplus_penalty": 33.957, "bench_bonus": 6.736, "wait_discount": 0.306, "wait_margin": 5.926, "kdef_rounds_from_end": 1, "injury_penalty": 75.587, "rb_early_bonus":
a42634f	1871.2	111.2	5.21	0.33	300	discard	auto 353 screen: {"need_bonus": 41.61, "flex_bonus": 13.014, "depth_quota_rb": 4, "surplus_penalty": -0.358, "bench_bonus": 9.078, "wait_discount": 0.514, "wait_margin": 4.793, "kdef_rounds_from_end": 1, "injury_penalty": 75.053, "rb_early_bonus": 13.011, "avail_sigm
a42634f	1877.1	120.1	5.19	0.381	2700	discard	auto 354 confirmed: {"need_bonus": 65.459, "flex_bonus": 11.925, "depth_quota_te": 4, "depth_quota_qb": 2, "surplus_penalty": 37.802, "bench_bonus": 11.093, "wait_discount": 0.361, "wait_margin": 7.498, "injury_penalty": 74.333, "rb_early_bonus": 5.974, "te_earliest_rou
a42634f	1866.1	123.5	5.48	0.363	300	discard	auto 355 screen: {"need_bonus": 40.801, "flex_bonus": 9.373, "depth_quota_rb": 4, "depth_quota_wr": 6, "depth_quota_te": 4, "surplus_penalty": 36.589, "bench_bonus": 6.79, "wait_discount": 0.286, "wait_margin": 4.338, "injury_penalty": 90.368, "rb_early_bonus": 9.315
a42634f	1879.6	126.9	5.26	0.35	300	discard	auto 356 screen: {"need_bonus": 16.972, "flex_bonus": -2.203, "depth_quota_wr": 6, "depth_quota_te": 4, "surplus_penalty": 35.364, "bench_bonus": 17.269, "wait_discount": 0.437, "wait_margin": 6.877, "kdef_rounds_from_end": 3, "injury_penalty": 130.124, "rb_early_bon
a42634f	1876.8	114.5	5.11	0.373	300	discard	auto 357 screen: {"need_bonus": 44.261, "flex_bonus": 12.509, "surplus_penalty": 21.95, "bench_bonus": 7.024, "wait_discount": 0.383, "wait_margin": 3.652, "injury_penalty": 77.503, "rb_early_bonus": 7.353, "te_earliest_round": 4, "avail_sigma": 8.767, "avail_strengt
a42634f	1873.4	119.1	5.28	0.343	300	discard	auto 358 screen: {"need_bonus": 46.871, "flex_bonus": 7.905, "depth_quota_rb": 2, "depth_quota_qb": 2, "surplus_penalty": 18.79, "bench_bonus": 13.013, "wait_discount": 0.233, "wait_margin": 4.441, "kdef_rounds_from_end": 3, "injury_penalty": 71.129, "rb_early_bonus"
a42634f	1883.6	121.8	5.05	0.39	300	discard	auto 359 screen: {"need_bonus": 38.105, "flex_bonus": 11.887, "depth_quota_wr": 4, "depth_quota_qb": 4, "surplus_penalty": 15.599, "bench_bonus": 9.875, "wait_discount": 0.259, "wait_margin": 1.537, "injury_penalty": 86.407, "rb_early_bonus": 5.906, "qb_earliest_roun
a42634f	1854.5	126.7	5.75	0.277	300	discard	auto 360 screen: {"need_bonus": 44.968, "flex_bonus": 6.463, "depth_quota_wr": 6, "depth_quota_te": 2, "depth_quota_qb": 2, "surplus_penalty": 27.652, "bench_bonus": 6.686, "wait_discount": 0.4, "wait_margin": 6.375, "kdef_rounds_from_end": 1, "injury_penalty": 62.92
a42634f	1852.2	117.9	5.87	0.29	300	discard	auto 361 screen: {"need_bonus": 121.286, "flex_bonus": -0.249, "depth_quota_te": 2, "depth_quota_qb": 4, "surplus_penalty": 15.14, "bench_bonus": 16.177, "wait_margin": 4.15, "injury_penalty": 68.042, "rb_early_bonus": 9.172, "te_earliest_round": 4, "avail_sigma": 6.
a42634f	1870.6	114.1	5.21	0.373	300	discard	auto 362 screen: {"need_bonus": 42.914, "flex_bonus": 9.046, "depth_quota_qb": 2, "surplus_penalty": 32.768, "bench_bonus": 8.963, "wait_discount": 0.367, "wait_margin": 3.747, "kdef_rounds_from_end": 1, "injury_penalty": 54.645, "rb_early_bonus": 8.507, "qb_earliest
a42634f	1862.4	118.8	5.47	0.313	300	discard	auto 363 screen: {"need_bonus": 25.818, "flex_bonus": 10.612, "surplus_penalty": 10.615, "bench_bonus": 5.833, "wait_discount": 0.104, "wait_margin": 3.004, "kdef_rounds_from_end": 1, "injury_penalty": 109.126, "rb_early_bonus": 9.912, "avail_sigma": 11.593, "avail_s
a42634f	1875.1	119.6	5.28	0.343	300	discard	auto 364 screen: {"need_bonus": 30.769, "flex_bonus": 11.243, "depth_quota_rb": 2, "surplus_penalty": 30.491, "bench_bonus": 4.837, "wait_discount": 0.45, "wait_margin": 6.795, "injury_penalty": 57.084, "rb_early_bonus": 7.841, "te_earliest_round": 4, "avail_sigma": 
a42634f	1876.7	119.8	5.09	0.39	300	discard	auto 365 screen: {"need_bonus": 57.607, "flex_bonus": 5.759, "surplus_penalty": 10.03, "bench_bonus": 13.144, "wait_discount": 0.591, "wait_margin": 9.494, "injury_penalty": 87.968, "rb_early_bonus": 6.995, "qb_earliest_round": 5, "te_earliest_round": 2, "avail_sigma
a42634f	1858.9	108.8	5.41	0.317	300	discard	auto 366 screen: {"need_bonus": 59.854, "flex_bonus": 8.358, "depth_quota_rb": 2, "depth_quota_qb": 4, "surplus_penalty": 23.406, "bench_bonus": 9.043, "wait_discount": 0.284, "wait_margin": 4.204, "kdef_rounds_from_end": 3, "injury_penalty": 96.784, "rb_early_bonus"
a42634f	1872.8	114.9	5.27	0.36	300	discard	auto 367 screen: {"need_bonus": 33.083, "flex_bonus": 7.535, "depth_quota_rb": 4, "depth_quota_wr": 6, "depth_quota_te": 2, "surplus_penalty": 21.445, "bench_bonus": 7.646, "wait_discount": 0.242, "wait_margin": 4.757, "injury_penalty": 105.48, "rb_early_bonus": 7.68
a42634f	1887.2	118.0	4.81	0.416	2700	discard	auto 368 confirmed: {"need_bonus": 51.317, "flex_bonus": 17.189, "depth_quota_te": 2, "depth_quota_qb": 4, "surplus_penalty": 12.201, "bench_bonus": 4.244, "wait_discount": 0.263, "wait_margin": 1.169, "injury_penalty": 38.707, "rb_early_bonus": 5.803, "te_earliest_roun
a42634f	1861.7	119.8	5.38	0.353	300	discard	auto 369 screen: {"need_bonus": 47.318, "flex_bonus": 8.596, "depth_quota_rb": 2, "surplus_penalty": 35.113, "bench_bonus": 6.94, "wait_discount": 0.288, "wait_margin": 4.618, "kdef_rounds_from_end": 3, "injury_penalty": 83.573, "rb_early_bonus": 8.27, "qb_earliest_r
a42634f	1861.7	117.7	5.67	0.307	300	discard	auto 370 screen: {"need_bonus": 30.926, "flex_bonus": 4.316, "depth_quota_wr": 6, "depth_quota_te": 2, "depth_quota_qb": 2, "surplus_penalty": 26.758, "bench_bonus": 9.639, "wait_discount": 0.271, "wait_margin": 1.62, "kdef_rounds_from_end": 1, "injury_penalty": 80.0
a42634f	1882.4	118.7	5.06	0.393	300	discard	auto 371 screen: {"need_bonus": 35.278, "flex_bonus": 10.465, "depth_quota_rb": 4, "depth_quota_wr": 4, "surplus_penalty": 25.494, "bench_bonus": 6.618, "wait_discount": 0.253, "wait_margin": 4.313, "kdef_rounds_from_end": 3, "injury_penalty": 68.995, "rb_early_bonus
a42634f	1851.5	120.5	5.64	0.347	300	discard	auto 372 screen: {"need_bonus": 36.276, "flex_bonus": 15.694, "depth_quota_rb": 2, "depth_quota_wr": 4, "depth_quota_te": 4, "depth_quota_qb": 4, "surplus_penalty": -5.486, "bench_bonus": -5.413, "wait_discount": 0.404, "wait_margin": -0.102, "injury_penalty": 150.26
a42634f	1865.9	127.5	5.59	0.33	300	discard	auto 373 screen: {"need_bonus": 20.824, "flex_bonus": 11.511, "depth_quota_qb": 4, "surplus_penalty": 41.69, "bench_bonus": 7.535, "wait_discount": 0.39, "wait_margin": 3.912, "kdef_rounds_from_end": 1, "injury_penalty": 54.459, "rb_early_bonus": 5.623, "qb_earliest_
a42634f	1843.4	118.6	6.08	0.277	300	discard	auto 374 screen: {"need_bonus": 87.86, "flex_bonus": 0.965, "depth_quota_wr": 6, "depth_quota_qb": 4, "surplus_penalty": 21.024, "bench_bonus": 1.984, "wait_discount": 0.428, "wait_margin": -1.075, "kdef_rounds_from_end": 1, "injury_penalty": 72.972, "rb_early_bonus"
a42634f	1836.6	120.0	6.25	0.257	300	discard	auto 375 screen: {"need_bonus": 74.843, "flex_bonus": 7.734, "depth_quota_rb": 2, "depth_quota_te": 2, "depth_quota_qb": 4, "surplus_penalty": 37.496, "bench_bonus": 7.662, "wait_discount": 0.412, "wait_margin": 6.025, "injury_penalty": 91.123, "rb_early_bonus": 4.90
a42634f	1833.7	122.9	6.26	0.25	300	discard	auto 376 screen: {"need_bonus": 53.048, "flex_bonus": 11.818, "depth_quota_rb": 2, "depth_quota_wr": 6, "depth_quota_te": 4, "depth_quota_qb": 2, "surplus_penalty": 25.764, "bench_bonus": 5.951, "wait_discount": 0.13, "wait_margin": 3.202, "kdef_rounds_from_end": 1, 
a42634f	1878.1	117.5	5.18	0.353	300	discard	auto 377 screen: {"need_bonus": 121.938, "flex_bonus": -8.601, "depth_quota_te": 2, "depth_quota_qb": 2, "surplus_penalty": 0.584, "bench_bonus": 7.571, "wait_discount": 0.514, "wait_margin": 5.905, "kdef_rounds_from_end": 3, "injury_penalty": 152.008, "rb_early_bonu
a42634f	1884.4	123.2	5.08	0.387	300	discard	auto 378 screen: {"need_bonus": 77.158, "flex_bonus": 7.771, "depth_quota_rb": 4, "depth_quota_wr": 6, "depth_quota_te": 2, "depth_quota_qb": 2, "surplus_penalty": 29.019, "bench_bonus": 9.955, "wait_discount": 0.093, "wait_margin": 6.502, "injury_penalty": 118.068, 
a42634f	1852.2	125.2	5.85	0.29	300	discard	auto 379 screen: {"need_bonus": 41.885, "flex_bonus": 6.567, "depth_quota_rb": 2, "depth_quota_te": 4, "depth_quota_qb": 2, "surplus_penalty": 29.857, "bench_bonus": -0.582, "wait_discount": 0.818, "wait_margin": 4.313, "kdef_rounds_from_end": 3, "injury_penalty": 84
a42634f	1857.2	124.3	5.68	0.347	300	discard	auto 380 screen: {"need_bonus": 58.709, "flex_bonus": 9.622, "depth_quota_rb": 2, "depth_quota_te": 2, "depth_quota_qb": 4, "surplus_penalty": 27.454, "bench_bonus": 9.116, "wait_discount": 0.347, "wait_margin": 4.18, "kdef_rounds_from_end": 3, "injury_penalty": 91.4
a42634f	1849.7	119.5	5.98	0.27	300	discard	auto 381 screen: {"need_bonus": 47.657, "flex_bonus": 7.921, "depth_quota_wr": 6, "depth_quota_te": 4, "depth_quota_qb": 2, "surplus_penalty": 15.031, "bench_bonus": 1.432, "wait_discount": 0.159, "wait_margin": 3.185, "kdef_rounds_from_end": 1, "injury_penalty": 150
a42634f	1847.4	114.6	6.04	0.253	300	discard	auto 382 screen: {"need_bonus": 45.661, "flex_bonus": 12.065, "depth_quota_te": 4, "surplus_penalty": 29.644, "bench_bonus": 13.131, "wait_discount": 0.302, "wait_margin": 4.296, "kdef_rounds_from_end": 1, "injury_penalty": 75.529, "rb_early_bonus": 8.857, "te_earlie
a42634f	1862.0	116.1	5.61	0.307	300	discard	auto 383 screen: {"need_bonus": 44.852, "flex_bonus": 12.419, "depth_quota_wr": 4, "surplus_penalty": 30.167, "bench_bonus": 6.684, "wait_discount": 0.253, "wait_margin": 4.769, "kdef_rounds_from_end": 1, "injury_penalty": 75.175, "rb_early_bonus": 5.863, "te_earlies
a42634f	1876.5	115.1	5.17	0.393	300	discard	auto 384 screen: {"need_bonus": 35.739, "flex_bonus": 17.011, "depth_quota_qb": 2, "surplus_penalty": 38.371, "bench_bonus": 4.291, "wait_discount": 0.31, "wait_margin": 3.324, "injury_penalty": 92.043, "rb_early_bonus": 12.473, "qb_earliest_round": 5, "avail_sigma":
a42634f	1883.3	115.1	5.13	0.353	300	discard	auto 385 screen: {"need_bonus": 49.313, "flex_bonus": -4.3, "depth_quota_te": 4, "depth_quota_qb": 2, "surplus_penalty": 24.104, "bench_bonus": 13.941, "wait_discount": 0.151, "wait_margin": 6.598, "injury_penalty": 132.776, "rb_early_bonus": 8.741, "avail_sigma": 12
a42634f	1849.3	123.5	5.81	0.317	300	discard	auto 386 screen: {"need_bonus": 36.747, "flex_bonus": 7.12, "depth_quota_rb": 4, "depth_quota_wr": 4, "depth_quota_te": 4, "depth_quota_qb": 4, "surplus_penalty": 16.542, "bench_bonus": 4.617, "wait_discount": 0.311, "wait_margin": 5.948, "kdef_rounds_from_end": 1, "
a42634f	1871.4	125.5	5.43	0.333	300	discard	auto 387 screen: {"need_bonus": 51.319, "flex_bonus": 8.919, "depth_quota_rb": 2, "depth_quota_wr": 4, "depth_quota_te": 2, "depth_quota_qb": 2, "surplus_penalty": 30.145, "bench_bonus": 8.302, "wait_discount": 0.243, "wait_margin": 3.599, "kdef_rounds_from_end": 3, 
a42634f	1826.0	123.0	6.58	0.24	300	discard	auto 388 screen: {"need_bonus": 62.579, "flex_bonus": 12.224, "surplus_penalty": 39.493, "bench_bonus": 1.23, "wait_discount": 0.74, "wait_margin": 8.43, "injury_penalty": 81.483, "rb_early_bonus": 1.712, "qb_earliest_round": 5, "avail_sigma": 10.344, "avail_strength
a42634f	1868.0	127.6	5.52	0.327	300	discard	auto 389 screen: {"need_bonus": 34.089, "flex_bonus": 12.934, "depth_quota_rb": 4, "depth_quota_te": 2, "depth_quota_qb": 2, "surplus_penalty": 9.733, "bench_bonus": 10.928, "wait_discount": 0.044, "wait_margin": 3.392, "injury_penalty": 136.973, "rb_early_bonus": 11
a42634f	1879.8	123.3	5.28	0.347	300	discard	auto 390 screen: {"need_bonus": 33.847, "flex_bonus": 19.519, "depth_quota_rb": 2, "depth_quota_wr": 6, "depth_quota_te": 4, "depth_quota_qb": 2, "surplus_penalty": 24.246, "bench_bonus": 4.677, "wait_discount": 0.352, "wait_margin": 5.926, "kdef_rounds_from_end": 3,
a42634f	1855.6	115.6	5.64	0.33	300	discard	auto 391 screen: {"need_bonus": 17.371, "flex_bonus": 11.087, "depth_quota_rb": 4, "depth_quota_wr": 6, "surplus_penalty": 22.485, "bench_bonus": 1.21, "wait_discount": 0.333, "wait_margin": 7.532, "injury_penalty": 84.445, "rb_early_bonus": 11.368, "avail_sigma": 6.
a42634f	1890.7	118.7	4.79	0.409	2700	discard	auto 392 confirmed: {"need_bonus": 45.156, "flex_bonus": 4.844, "depth_quota_te": 4, "surplus_penalty": 23.833, "bench_bonus": 8.364, "wait_discount": 0.488, "wait_margin": 5.274, "injury_penalty": 33.24, "rb_early_bonus": 4.979, "avail_sigma": 10.969, "avail_strength":
a42634f	1881.8	120.1	5.01	0.41	300	discard	auto 393 screen: {"need_bonus": 53.035, "flex_bonus": 10.746, "depth_quota_wr": 4, "depth_quota_te": 4, "surplus_penalty": 19.675, "bench_bonus": 6.412, "wait_discount": 0.237, "wait_margin": 6.502, "kdef_rounds_from_end": 3, "injury_penalty": 45.169, "rb_early_bonus
a42634f	1885.0	118.6	4.94	0.403	2700	discard	auto 394 confirmed: {"need_bonus": 47.763, "flex_bonus": 11.021, "depth_quota_te": 2, "surplus_penalty": 38.175, "bench_bonus": 8.116, "wait_discount": 0.334, "wait_margin": 4.259, "injury_penalty": 70.634, "rb_early_bonus": 8.991, "qb_earliest_round": 5, "te_earliest_r
a42634f	1852.6	117.2	5.92	0.293	300	discard	auto 395 screen: {"need_bonus": 64.935, "flex_bonus": 13.416, "depth_quota_rb": 4, "depth_quota_wr": 4, "depth_quota_qb": 4, "surplus_penalty": 29.27, "bench_bonus": 11.585, "wait_discount": 0.337, "wait_margin": 9.537, "kdef_rounds_from_end": 3, "injury_penalty": 10
a42634f	1866.3	119.1	5.36	0.357	300	discard	auto 396 screen: {"need_bonus": 52.293, "flex_bonus": 15.56, "depth_quota_wr": 6, "depth_quota_te": 2, "depth_quota_qb": 2, "surplus_penalty": 25.218, "bench_bonus": 11.031, "wait_discount": 0.365, "wait_margin": 5.049, "kdef_rounds_from_end": 1, "injury_penalty": 65
a42634f	1880.6	116.9	5.04	0.35	300	discard	auto 397 screen: {"need_bonus": 45.741, "flex_bonus": 14.995, "depth_quota_te": 4, "depth_quota_qb": 2, "surplus_penalty": 35.552, "bench_bonus": 7.615, "wait_discount": 0.11, "wait_margin": 4.403, "injury_penalty": 38.093, "rb_early_bonus": 12.354, "qb_earliest_roun
a42634f	1880.2	116.6	4.96	0.393	300	discard	auto 398 screen: {"need_bonus": 48.848, "flex_bonus": 10.704, "depth_quota_qb": 2, "surplus_penalty": 29.055, "bench_bonus": 7.893, "wait_discount": 0.289, "wait_margin": 3.681, "injury_penalty": 67.449, "rb_early_bonus": 7.008, "avail_sigma": 5.663, "avail_strength"
a42634f	1871.2	114.4	5.36	0.333	300	discard	auto 399 screen: {"need_bonus": 76.967, "flex_bonus": 15.418, "surplus_penalty": 40.39, "bench_bonus": 9.413, "wait_discount": 0.473, "wait_margin": 3.898, "injury_penalty": 49.133, "rb_early_bonus": 2.338, "qb_earliest_round": 5, "avail_sigma": 6.006, "avail_strengt
a42634f	1849.5	110.5	5.85	0.263	300	discard	auto 400 screen: {"need_bonus": 62.1, "flex_bonus": 4.83, "depth_quota_wr": 4, "surplus_penalty": 6.254, "bench_bonus": 7.663, "wait_discount": 0.586, "wait_margin": 4.878, "kdef_rounds_from_end": 1, "injury_penalty": 73.534, "rb_early_bonus": 7.241, "te_earliest_rou
a42634f	1865.3	119.9	5.35	0.353	300	discard	auto 401 screen: {"need_bonus": 6.938, "flex_bonus": 10.651, "depth_quota_wr": 6, "depth_quota_te": 4, "surplus_penalty": 34.068, "bench_bonus": 8.973, "wait_discount": 0.388, "wait_margin": 3.478, "injury_penalty": 54.811, "rb_early_bonus": 6.271, "qb_earliest_round
a42634f	1879.6	120.7	5.18	0.377	300	discard	auto 402 screen: {"need_bonus": 22.531, "flex_bonus": 2.05, "depth_quota_wr": 6, "depth_quota_qb": 4, "surplus_penalty": 48.361, "bench_bonus": 8.094, "wait_discount": 0.061, "wait_margin": 6.34, "injury_penalty": 152.394, "rb_early_bonus": 15.258, "qb_earliest_round
a42634f	1876.7	112.4	5.01	0.39	300	discard	auto 403 screen: {"need_bonus": 59.746, "flex_bonus": 9.962, "depth_quota_rb": 4, "depth_quota_qb": 2, "surplus_penalty": 24.022, "bench_bonus": 6.481, "wait_discount": 0.333, "wait_margin": 4.879, "injury_penalty": 79.964, "rb_early_bonus": 6.26, "avail_sigma": 7.43
a42634f	1882.8	123.0	5.0	0.4	2700	discard	auto 404 confirmed: {"need_bonus": 36.363, "flex_bonus": 14.131, "depth_quota_rb": 4, "depth_quota_te": 2, "surplus_penalty": 31.555, "bench_bonus": 6.421, "wait_discount": 0.204, "wait_margin": 3.935, "injury_penalty": 26.587, "rb_early_bonus": 8.161, "qb_earliest_roun
a42634f	1878.3	124.3	5.18	0.357	300	discard	auto 405 screen: {"need_bonus": 26.774, "flex_bonus": 4.636, "depth_quota_wr": 6, "depth_quota_te": 2, "surplus_penalty": 26.229, "bench_bonus": 4.426, "wait_discount": 0.27, "wait_margin": 3.305, "kdef_rounds_from_end": 3, "injury_penalty": 136.441, "rb_early_bonus"
a42634f	1863.1	120.2	5.58	0.323	300	discard	auto 406 screen: {"need_bonus": 39.929, "flex_bonus": 10.015, "depth_quota_wr": 4, "surplus_penalty": 40.308, "bench_bonus": 5.677, "wait_discount": 0.389, "wait_margin": 5.167, "kdef_rounds_from_end": 1, "injury_penalty": 95.931, "rb_early_bonus": 6.062, "qb_earlies
a42634f	1875.7	118.9	5.26	0.353	300	discard	auto 407 screen: {"need_bonus": 36.772, "flex_bonus": 15.829, "depth_quota_rb": 4, "depth_quota_qb": 2, "surplus_penalty": 27.843, "bench_bonus": 4.917, "wait_discount": 0.41, "wait_margin": 7.618, "injury_penalty": 84.134, "rb_early_bonus": 5.589, "avail_sigma": 12.
a42634f	1882.5	111.3	4.97	0.4	300	discard	auto 408 screen: {"need_bonus": 61.875, "flex_bonus": 29.339, "depth_quota_rb": 4, "depth_quota_te": 4, "surplus_penalty": 21.434, "bench_bonus": 9.973, "wait_discount": 0.622, "wait_margin": 4.992, "injury_penalty": 89.75, "rb_early_bonus": 5.513, "qb_earliest_round
a42634f	1873.3	120.6	5.28	0.35	300	discard	auto 409 screen: {"need_bonus": 45.698, "flex_bonus": 8.861, "depth_quota_wr": 4, "depth_quota_te": 4, "surplus_penalty": 23.528, "bench_bonus": 8.866, "wait_discount": 0.325, "wait_margin": 4.39, "injury_penalty": 62.43, "rb_early_bonus": 5.23, "avail_sigma": 7.843,
a42634f	1880.7	129.6	5.21	0.363	300	discard	auto 410 screen: {"need_bonus": 49.579, "flex_bonus": 6.552, "surplus_penalty": 23.283, "bench_bonus": 8.199, "wait_discount": 0.346, "wait_margin": 5.245, "injury_penalty": 88.442, "rb_early_bonus": 8.158, "qb_earliest_round": 5, "te_earliest_round": 4, "avail_sigma
a42634f	1891.8	119.4	4.77	0.424	2700	discard	auto 411 confirmed: {"need_bonus": 30.565, "flex_bonus": 14.034, "depth_quota_wr": 4, "depth_quota_te": 2, "surplus_penalty": 36.535, "bench_bonus": 6.473, "wait_discount": 0.574, "wait_margin": 1.364, "injury_penalty": 72.749, "rb_early_bonus": 6.624, "qb_earliest_roun
a42634f	1855.5	122.4	5.75	0.317	300	discard	auto 412 screen: {"need_bonus": 20.63, "flex_bonus": 9.048, "depth_quota_rb": 4, "depth_quota_wr": 4, "depth_quota_te": 4, "surplus_penalty": 36.826, "bench_bonus": 6.888, "wait_discount": 0.346, "wait_margin": 4.163, "injury_penalty": 45.558, "rb_early_bonus": 10.20
a42634f	1847.7	117.5	5.87	0.303	300	discard	auto 413 screen: {"need_bonus": 1.989, "flex_bonus": 15.312, "depth_quota_rb": 2, "depth_quota_qb": 4, "surplus_penalty": 69.43, "bench_bonus": 12.673, "wait_discount": 0.509, "wait_margin": 6.665, "injury_penalty": 82.937, "rb_early_bonus": 8.957, "qb_earliest_round
a42634f	1882.6	118.2	4.97	0.4	300	discard	auto 414 screen: {"need_bonus": 49.299, "flex_bonus": 8.793, "depth_quota_wr": 6, "depth_quota_te": 2, "surplus_penalty": 27.843, "bench_bonus": 9.286, "wait_discount": 0.297, "wait_margin": 3.839, "injury_penalty": 73.26, "rb_early_bonus": 5.909, "avail_sigma": 9.88
a42634f	1890.9	119.0	4.81	0.41	2700	discard	auto 415 confirmed: {"need_bonus": 50.413, "flex_bonus": 14.46, "depth_quota_rb": 4, "depth_quota_wr": 6, "depth_quota_te": 4, "surplus_penalty": 36.701, "bench_bonus": 8.426, "wait_discount": 0.349, "wait_margin": 5.212, "injury_penalty": 34.1, "rb_early_bonus": 5.162,
a42634f	1884.9	120.4	4.96	0.398	2700	discard	auto 416 confirmed: {"need_bonus": 65.938, "flex_bonus": 3.342, "depth_quota_qb": 4, "surplus_penalty": 26.69, "bench_bonus": 8.522, "wait_discount": 0.4, "wait_margin": 6.173, "injury_penalty": 99.614, "rb_early_bonus": 9.514, "qb_earliest_round": 5, "avail_sigma": 3.2
a42634f	1877.7	114.6	5.02	0.38	300	discard	auto 417 screen: {"need_bonus": 18.085, "flex_bonus": 13.562, "depth_quota_wr": 4, "depth_quota_te": 4, "depth_quota_qb": 4, "surplus_penalty": 36.425, "bench_bonus": 12.127, "wait_discount": 0.227, "wait_margin": 2.028, "injury_penalty": 61.168, "rb_early_bonus": 9.
a42634f	1872.4	121.1	5.17	0.35	300	discard	auto 418 screen: {"need_bonus": 40.913, "flex_bonus": 9.421, "depth_quota_wr": 4, "depth_quota_te": 4, "depth_quota_qb": 4, "surplus_penalty": 19.25, "bench_bonus": 7.638, "wait_discount": 0.334, "wait_margin": 2.682, "kdef_rounds_from_end": 1, "injury_penalty": 58.7
